link,name,ingredients,recipe_category,recipe_cuisine,rating,rating_count,keywords
https://www.epicurious.com/recipes/food/views/bearnaise-sauce-395049,Béarnaise Sauce ,"1 tablespoon plus 1 cup (2 sticks) unsalted butter, cut into 1/2"" cubes $ 3 tablespoons minced shallots $ Kosher salt and freshly ground black pepper $ 2 tablespoons Champagne vinegar or white wine vinegar $ 2 large egg yolks $ 1 tablespoon (or more) fresh lemon juice $ 1 tablespoon finely chopped fresh tarragon $ ",Sauce $ Blender $ Egg $ Vegetarian $ Butter $ Bon Appétit $ Sauce Secrets $ ,French $ ,3.5/4,12,Sauce $ Blender $ Egg $ Vegetarian $ Butter $ Bon Appétit $ Sauce Secrets $ French $ 
https://www.epicurious.com/recipes/food/views/kings-cake-394707,King's Cake ,1 cup (250 g) all-purpose flour $ 2 Tbsp (20 g) superfine granulated sugar $ 1 tsp (5 g) fleur de sel de Guérande (or other fine sea salt) $ Finely grated zest of 1/4 unwaxed lemon $ 1 1/2 tsp (8 g) active dry yeast $ 2 eggs (100 g) $ 2 Tbsp (35 g) orange-flower water $ 2 tsp (10 g) aged dark rum $ 1 1/4 oz (35 g) candied orange peel $ 1 stick plus 2 Tbsp (150 g) unsalted butter $ 1 dried lima bean $ 1 egg yolk $ 2 whole eggs $ 3 dashes superfine granulated sugar $ Dash of table salt $ Apricot jelly or preserve $ Number 10 pearl sugar (coarse sugar) $ 2 quarters each of candied red and green melon $ Candied orange slices $ Coarsely chopped almonds $ ,Cake $ Citrus $ Fruit $ Bake $ Christmas $ Orange $ Melon $ Winter $ Chill $ Advance Prep Required $ ,French $ ,1/4,1,Cake $ Citrus $ Fruit $ Bake $ Christmas $ Orange $ Melon $ Winter $ Chill $ Advance Prep Required $ French $ 
https://www.epicurious.com/recipes/food/views/croissants-394749,Croissants ,"1 Tbsp (12 g) active dry yeast $ 7 Tbsp (100 g) whole milk, warmed to 68°F $ 2 cups (500 g) all-purpose flour $ 1 Tbsp (12 g) fleur de sel de Guérande (or other fine sea salt) $ 6 Tbsp (75 g) superfine granulated sugar $ 2 1/4 Tbsp (35 g) very soft unsalted butter $ 1 Tbsp (15 g) whole dry milk powder $ 2/3 cup (145 g) still mineral water, warmed to 68°F $ 3 sticks (325 g) unsalted cold butter $ 1 large egg yolk $ 2 whole eggs $ Dash of fine salt $ ",Bread $ Dairy $ Breakfast $ Brunch $ Bake $ Mother's Day $ Chill $ Butter $ Advance Prep Required $ Kidney Friendly $ Vegetarian $ Pescatarian $ Peanut Free $ Tree Nut Free $ Soy Free $ Kosher $ ,French $ ,4/4,3,Bread $ Dairy $ Breakfast $ Brunch $ Bake $ Mother's Day $ Chill $ Butter $ Advance Prep Required $ Kidney Friendly $ Vegetarian $ Pescatarian $ Peanut Free $ Tree Nut Free $ Soy Free $ Kosher $ French $ 
https://www.epicurious.com/recipes/food/views/chorizo-and-gigante-bean-cassoulet-394692,Chorizo and Gigante Bean Cassoulet ,"3 cups dried gigante, corona, or large lima beans $ 4 tablespoons extra-virgin olive oil, divided, plus more for drizzling $ 8 fresh Spanish chorizo or hot Italian sausage links (About 2 pounds) $ 1 leek (white and pale-green parts only), cut into 1/4""-thick rounds $ 1 small yellow onion, finely chopped $ Kosher salt and freshly ground black pepper $ 5 garlic cloves, thinly sliced $ 3 anchovy fillets packed in oil, drained, chopped (optional) $ 1 tablespoon tomato paste $ 1 1/2 teaspoons smoked paprika $ 3 cups low-salt chicken broth $ 1 28-ounce can whole tomatoes, drained, crushed with your hands $ 7 sprigs thyme $ 2 bay leaves $ 2 sprigs rosemary $ 6 tablespoons extra-virgin olive oil, divided $ 2 cups fresh coarse breadcrumbs (from three 1/2""-thick slices white sandwich bread) $ Kosher salt and freshly ground black pepper $ 1/2 cup chopped flat-leaf parsley $ 1 teaspoon finely grated lemon zest $ Ingredient info: Fresh Spanish chorizo, a link sausage that's milder than Mexican chorizo, can be found at specialty foods stores, Spanish markets, and latienda.com (try hot or mild). Smoked paprika is available at most supermarkets. $ ",Bean $ Dinner $ Meat $ Party $ Potluck $ Bon Appétit $ Dairy Free $ Peanut Free $ Tree Nut Free $ Soy Free $ Kosher $ ,French $ ,3.5/4,25,Bean $ Dinner $ Meat $ Party $ Potluck $ Bon Appétit $ Dairy Free $ Peanut Free $ Tree Nut Free $ Soy Free $ Kosher $ French $ 
https://www.epicurious.com/recipes/food/views/tourtiere-du-shack-380649,Tourtière du Shack ,"3 1/3 cups all-purpose flour $ 2 cups (4 sticks) chilled unsalted butter, cut into 1/2"" cubes $ 1 teaspoon kosher salt $ 1 1/2 cups low-salt chicken broth $ 1 1/2 medium onions, chopped, divided $ 4 garlic cloves, chopped, divided $ 5 whole black peppercorns plus freshly ground black pepper $ 5 sprigs thyme $ 2 bay leaves $ 1 1/2 pounds boneless pork shoulder (Boston butt), cut into 2"" pieces $ Kosher salt $ 1 tablespoon unsalted butter $ 8 medium button mushrooms, stemmed and finely chopped $ 1/2 cup dry white wine $ 1 1/4 pounds ground pork $ 1/8 teaspoon cinnamon $ 1/8 teaspoon ground cloves $ 3/4 cup grated, peeled russet potato $ All-purpose flour (for surface) $ 1 large egg yolk, beaten to blend $ A 9""-diameter deep dish glass or ceramic pie dish $ ",Mushroom $ Pork $ Bake $ Dinner $ Spice $ Winter $ Bon Appétit $ Sugar Conscious $ Peanut Free $ Tree Nut Free $ Soy Free $ ,French $ Canadian $ ,4/4,34,Mushroom $ Pork $ Bake $ Dinner $ Spice $ Winter $ Bon Appétit $ Sugar Conscious $ Peanut Free $ Tree Nut Free $ Soy Free $ French $ Canadian $ 
https://www.epicurious.com/recipes/food/views/beef-meatball-bourguignon-369530,Beef Meatball Bourguignon ,"3/4 cup fresh bread crumbs $ 1/4 cup whole milk $ 1 1/2 pounds ground round (85 percent lean) $ 2 large eggs, beaten $ 3 tablespoons finely chopped shallots $ 2 tablespoons finely chopped fresh parsley $ 1 1/2 teaspoons kosher salt $ 1/2 teaspoon freshly ground black pepper $ 1 teaspoon vegetable oil $ 4 ounces pancetta, coarsely chopped $ 10 ounces cremini mushrooms, quartered $ 1/4 cup finely chopped shallots $ 3 tablespoons unsalted butter $ 1 medium carrot, cut into 1/4-inch dice $ 1/4 cup all-purpose flour $ 2 cups homemade beef stock or canned reduced-sodium beef broth $ 1 cup hearty red wine, such as Shiraz $ 2 tablespoons brandy or Cognac (optional) $ 2 teaspoons tomato paste $ 1/2 teaspoon dried thyme $ Kosher salt and freshly ground black pepper $ Chopped fresh parsley, for serving $ ",Beef $ Mushroom $ Super Bowl $ Father's Day $ Dinner $ Lunch $ Peanut Free $ Tree Nut Free $ Soy Free $ ,French $ ,3.5/4,6,Beef $ Mushroom $ Super Bowl $ Father's Day $ Dinner $ Lunch $ Peanut Free $ Tree Nut Free $ Soy Free $ French $ 
https://www.epicurious.com/recipes/food/views/french-lentil-prosciutto-and-pepper-salad-369171,"French Lentil, Prosciutto, and Pepper Salad ","1/3 cup/75 ml extra-virgin olive oil, plus 1 tbsp $ 6 paper-thin slices prosciutto di Parma, finely chopped $ 2 shallots, finely chopped $ 1/2 cup/140 g finely diced carrots $ 1/2 cup/140 g finely diced red bell pepper/capsicum $ 2 cups/400 g green French lentils, rinsed and drained $ 1/4 cup/10 g finely chopped fresh flat-leaf parsley $ 2 tsp finely chopped fresh thyme $ 2 tbsp red wine vinegar $ 1 tbsp Dijon mustard $ 1/2 tsp salt $ 1/4 tsp freshly ground pepper $ ",Salad $ Herb $ Appetizer $ Side $ Lunch $ Ham $ Legume $ Lentil $ Bell Pepper $ Root Vegetable $ Carrot $ Winter $ Prosciutto $ Parsley $ Dairy Free $ Wheat/Gluten-Free $ Peanut Free $ Tree Nut Free $ Soy Free $ No Sugar Added $ ,French $ ,3/4,1,Salad $ Herb $ Appetizer $ Side $ Lunch $ Ham $ Legume $ Lentil $ Bell Pepper $ Root Vegetable $ Carrot $ Winter $ Prosciutto $ Parsley $ Dairy Free $ Wheat/Gluten-Free $ Peanut Free $ Tree Nut Free $ Soy Free $ No Sugar Added $ French $ 
https://www.epicurious.com/recipes/food/views/petits-farcis-368949,Petits Farcis ,"4 small new onions, with tops attached $ 4 small pattypan squashes $ 4 small tomatoes $ 4 small eggplants $ 4 bell peppers $ 4 small zucchini $ 1 small onion, finely chopped $ 1 tablespoon neutral oil $ 8 ounces (225 g) ground veal $ 8 ounces (225 g) ground pork $ 1 egg, lightly beaten $ 1 slice white bread, crust removed, crumbled and soaked in
2 tablespoons milk $ 1/4 cup (30 g) grated Parmesan cheese $ 1 teaspoon finely chopped fresh thyme leaves $ 1/2 teaspoon fennel seeds $ 1/4 teaspoon finely chopped garlic $ 1/4 teaspoon dried chile flakes $ Salt and pepper $ Olive oil for drizzling $ ",Onion $ Tomato $ Parmesan $ Eggplant $ Zucchini $ Yellow Squash $ ,French $ ,1/4,1,Onion $ Tomato $ Parmesan $ Eggplant $ Zucchini $ Yellow Squash $ French $ 
https://www.epicurious.com/recipes/food/views/duck-fat-potato-galette-with-caraway-and-sweet-onions-368933,Duck Fat-Potato Galette with Caraway and Sweet Onions ,"4 tablespoons (1/2 stick) unsalted butter, melted, divided, plus more for pan $ 1/2 teaspoon caraway seeds $ 2 tablespoons rendered duck or bacon fat, melted $ 1 teaspoon (or more) kosher salt $ 1/2 teaspoon freshly ground black pepper $ 2 pounds medium Yukon Gold potatoes, unpeeled, cut into 1/8""-thick slices with a mandoline or V-slicer $ 1 small sweet onion (such as Maui), very thinly sliced $ Ingredient info: Rendered duck fat can be found at better supermarkets and at specialty foods stores and dartagnan.com. $ The outer ring from a 9""-diameter springform pan $ ",Onion $ Potato $ Side $ Bake $ Christmas $ Winter $ Christmas Eve $ Caraway $ Mandoline $ Bon Appétit $ Sugar Conscious $ Wheat/Gluten-Free $ Peanut Free $ Tree Nut Free $ Soy Free $ No Sugar Added $ ,French $ ,3.5/4,19,Onion $ Potato $ Side $ Bake $ Christmas $ Winter $ Christmas Eve $ Caraway $ Mandoline $ Bon Appétit $ Sugar Conscious $ Wheat/Gluten-Free $ Peanut Free $ Tree Nut Free $ Soy Free $ No Sugar Added $ French $ 
https://www.epicurious.com/recipes/food/views/gateau-de-sirop-368273,Gâteau de Sirop ,"1/2 cup (1 stick) unsalted butter, room temperature, plus more for pan $ 2 1/4 cups all-purpose flour plus more $ 2 1/4 teaspoons baking soda $ 1 teaspoon kosher salt $ 1 teaspoon ground cinnamon $ 3/4 teaspoon ground cloves $ 1/2 teaspoon ground nutmeg $ 1/2 teaspoon ground allspice $ 1/2 cup sugar $ 1/4 cup sour cream $ 1/2 cup Steen's cane syrup, dark corn syrup, or golden syrup $ 2 large eggs $ 1 tablespoon grated peeled ginger $ 1/2 cup warm buttermilk $ 1 tablespoon powdered sugar $ An 11""-diameter tart pan with a removable bottom $ ",Cake $ Mixer $ Dessert $ Bake $ Sour Cream $ Butter $ Buttermilk $ Bon Appétit $ ,French $ Southern $ ,4/4,1,Cake $ Mixer $ Dessert $ Bake $ Sour Cream $ Butter $ Buttermilk $ Bon Appétit $ French $ Southern $ 
https://www.epicurious.com/recipes/food/views/pot-au-feu-367768,Pot-Au-Feu ,"1/2 cup kosher salt $ 1/4 cup sugar $ 1 head of garlic, halved crosswise $ 1 teaspoon whole black peppercorns $ 2 fresh bay leaves (or 1 dried) $ 2 pound beef brisket $ 3 4"" pieces bone-in beef short ribs $ 1 head of garlic, halved crosswise $ 10 sprigs flat-leaf parsley $ 10 sprigs thyme $ 3 fresh bay leaves (or 1 dried) $ 3 whole cloves $ 1 teaspoon whole black peppercorns $ 3 2""-3"" long marrow bones $ 2 pounds oxtails $ 2 pounds beef bones $ 1 pound veal bones $ 1 pound veal breast $ 5 large carrots (about 1 pound), peeled (2 chopped, 3 cut into 2"" pieces) $ 2 celery stalks, chopped $ 1 onion, quartered $ 1 1-pound piece garlic sausage $ 2 rutabagas (about 1 pound), peeled, cut into wedges $ 1 small head of savoy cabbage (about 1 pound), halved $ 1 pound baby potatoes $ 1/2 cup extra-virgin olive oil $ 1/4 cup finely chopped flat-leaf parsley $ 1/4 cup finely chopped fresh chives $ 1/4 cup finely chopped fresh tarragon $ 2 garlic cloves, minced $ Kosher salt and freshly ground black pepper $ 1/4 cup crème fraîche $ 2 tablespoons prepared white horseradish, drained $ Whole grain mustard $ Dijon mustard $ Toasted sliced country bread $ Cheesecloth $ ",Soup/Stew $ Herb $ Potato $ Bastille Day $ Dinner $ Beef Rib $ Brisket $ Carrot $ Fall $ Winter $ Potluck $ Bon Appétit $ Peanut Free $ Tree Nut Free $ Soy Free $ ,French $ ,3.5/4,8,Soup/Stew $ Herb $ Potato $ Bastille Day $ Dinner $ Beef Rib $ Brisket $ Carrot $ Fall $ Winter $ Potluck $ Bon Appétit $ Peanut Free $ Tree Nut Free $ Soy Free $ French $ 
https://www.epicurious.com/recipes/food/views/banana-tartes-tatin-367749,Banana Tartes Tatin ,"4 tablespoons unsalted butter, softened $ 8 tablespoons light brown sugar $ 4 firm ripe bananas, peeled, cut on a diagonal into 1/4""-thick slices $ 4 6"" rounds puff pastry cut from one package of puff pastry, thawed $ Four 5""-diameter, 1""-high crème brûlée dishes $ ",Dessert $ Bake $ Quick & Easy $ Banana $ Phyllo/Puff Pastry Dough $ Bon Appétit $ ,French $ ,3.5/4,11,Dessert $ Bake $ Quick & Easy $ Banana $ Phyllo/Puff Pastry Dough $ Bon Appétit $ French $ 
https://www.epicurious.com/recipes/food/views/steamed-mussels-in-white-wine-367721,Steamed Mussels in White Wine ,"1 large shallot, finely chopped $ 1/4 onion, finely chopped (about 1/3 cup) $ 1/4 cup dry white wine $ 3 1/2 tablespoons unsalted butter, cut into 1/2"" cubes $ 1 tablespoon white wine vinegar $ 4 1/2 pounds mussels, scrubbed, debearded $ Freshly ground black pepper $ 2 tablespoons chopped flat-leaf parsley $ Cheesecloth $ ",Onion $ Steam $ Quick & Easy $ Dinner $ Mussel $ White Wine $ Boil $ Bon Appétit $ Sugar Conscious $ Pescatarian $ Wheat/Gluten-Free $ Peanut Free $ Tree Nut Free $ Soy Free $ ,French $ ,3.5/4,14,Onion $ Steam $ Quick & Easy $ Dinner $ Mussel $ White Wine $ Boil $ Bon Appétit $ Sugar Conscious $ Pescatarian $ Wheat/Gluten-Free $ Peanut Free $ Tree Nut Free $ Soy Free $ French $ 
https://www.epicurious.com/recipes/food/views/arctic-char-gravlax-with-white-grapefruit-367709,Arctic Char Gravlax with White Grapefruit ,"1 2-pound side of arctic char, skin on, pinbones removed $ 3 tablespoons plus 2 teaspoons finely grated white or pink grapefruit zest $ 3 tablespoons kosher salt plus more $ 2 tablespoons muscovado sugar or light brown sugar $ 1 tablespoon granulated sugar $ 1 tablespoon plus 1 teaspoon dried whole green peppercorns, crushed $ 1 tablespoon juniper berries, well crushed $ 1/2 cup crème fraîche $ 3 teaspoons minced fresh dill, divided $ Crackers or toasts (preferably rye) $ Ingredient info: Juniper berries are sold in the spice section of better supermarkets. $ ",Fish $ Appetizer $ Cocktail Party $ New Year's Eve $ Grapefruit $ Shower $ Chill $ Party $ Dill $ Bon Appétit $ Pescatarian $ Peanut Free $ Tree Nut Free $ Soy Free $ ,French $ ,3/4,1,Fish $ Appetizer $ Cocktail Party $ New Year's Eve $ Grapefruit $ Shower $ Chill $ Party $ Dill $ Bon Appétit $ Pescatarian $ Peanut Free $ Tree Nut Free $ Soy Free $ French $ 
https://www.epicurious.com/recipes/food/views/french-onion-soup-367757,French Onion Soup ,"2 medium onions, finely chopped $ 1 tablespoon unsalted butter $ 1 tablespoon Calvados, Applejack, or other brandy $ 4 cups low-salt beef stock $ Kosher salt and freshly ground black pepper $ 4-8 1/2""-thick slices baguette, cut to fit ramekins $ 1 cup grated Gruyère or raclette cheese $ Four 10-ounces ramekins $ ",Soup/Stew $ Cheese $ Onion $ Quick & Easy $ Dinner $ Lunch $ Fall $ Winter $ Bon Appétit $ Peanut Free $ Tree Nut Free $ Soy Free $ ,French $ ,3.5/4,12,Soup/Stew $ Cheese $ Onion $ Quick & Easy $ Dinner $ Lunch $ Fall $ Winter $ Bon Appétit $ Peanut Free $ Tree Nut Free $ Soy Free $ French $ 
https://www.epicurious.com/recipes/food/views/milk-chocolate-and-salted-caramel-gateau-saint-honore-367763,Milk Chocolate and Salted Caramel Gâteau Saint-Honoré ,"2 14-ounce packages frozen puff pastry (2 sheets; such as Dufour), thawed $ 1 cup (scant) all-purpose flour plus more for surface $ 1 cup whole milk $ 5 tablespoons unsalted butter $ 1 teaspoon sugar $ 1/2 teaspoon kosher salt $ 4 large eggs $ 2 cups whole milk $ 1/3 cup plus 1/4 cup sugar $ 5 tablespoons cornstarch $ 6 large egg yolks $ 3 1/2 tablespoons unsalted butter $ 6 ounces high-quality milk chocolate (such as Lindt or Scharffen Berger), chopped $ 1 1/4 cups hot pastry cream (from above) $ 1 teaspoon unflavored gelatin $ 1 1/2 cups chilled heavy cream, divided $ 9 tablespoons sugar $ 1/8 teaspoon cream of tartar $ 1/4 cup heavy cream $ 1 1/4 cups chilled pastry cream (from above) $ 1 cup (2 sticks) unsalted butter, room temperature $ 1/2 teaspoon kosher salt $ 1/4 teaspoon vanilla extract $ Chocolate Glaze $ Powdered sugar $ ",Cake $ Milk/Cream $ Mixer $ Chocolate $ Dessert $ Valentine's Day $ Bastille Day $ Anniversary $ Birthday $ Phyllo/Puff Pastry Dough $ Bon Appétit $ Peanut Free $ Tree Nut Free $ Soy Free $ ,French $ ,3/4,6,Cake $ Milk/Cream $ Mixer $ Chocolate $ Dessert $ Valentine's Day $ Bastille Day $ Anniversary $ Birthday $ Phyllo/Puff Pastry Dough $ Bon Appétit $ Peanut Free $ Tree Nut Free $ Soy Free $ French $ 
https://www.epicurious.com/recipes/food/views/orange-blossom-honey-madeleines-367764,Orange-Blossom-Honey Madeleines ,"3/4 cup all-purpose flour $ 1/2 teaspoon baking powder $ 1/8 teaspoon kosher salt $ 2 large eggs $ 1/3 cup sugar $ 2 tablespoons orange blossom honey $ 2 teaspoons vanilla extract $ 1/2 teaspoon finely grated orange zest $ 5 tablespoons unsalted butter, melted, cooled, plus more for molds $ One 16-cookie madeleine pan with 3x2"" molds $ ",Cookies $ Dessert $ Bake $ Orange $ Shower $ Honey $ Bon Appétit $ Kidney Friendly $ Vegetarian $ Pescatarian $ Peanut Free $ Tree Nut Free $ Soy Free $ Kosher $ ,French $ ,4/4,3,Cookies $ Dessert $ Bake $ Orange $ Shower $ Honey $ Bon Appétit $ Kidney Friendly $ Vegetarian $ Pescatarian $ Peanut Free $ Tree Nut Free $ Soy Free $ Kosher $ French $ 
https://www.epicurious.com/recipes/food/views/tangerine-souffle-with-citrus-coulis-367722,Tangerine Soufflé with Citrus Coulis ,"6 tangerines, peeled $ 1/4 cup fresh tangerine juice $ 3 tablespoons sugar $ 1 tablespoon (or more) fresh lemon juice $ Unsalted butter (for dish) $ 5 tablespoons plus 1/2 cup sugar, divided $ 3/4 cup fresh tangerine juice, divided $ 1 tablespoon plus 2 teaspoons cornstarch $ 2 teaspoons finely grated tangerine zest $ 1 teaspoon fresh lemon juice $ 6 large egg whites, room temperature $ 1/4 teaspoon cream of tartar $ 4 large egg yolks, room temperature $ Powdered sugar $ A 2-quart soufflé dish $ ",Blender $ Mixer $ Egg $ Dessert $ Bake $ Fall $ Tangerine $ Ramekin $ Bon Appétit $ Vegetarian $ Pescatarian $ Wheat/Gluten-Free $ Peanut Free $ Tree Nut Free $ Soy Free $ Kosher $ ,French $ ,3/4,4,Blender $ Mixer $ Egg $ Dessert $ Bake $ Fall $ Tangerine $ Ramekin $ Bon Appétit $ Vegetarian $ Pescatarian $ Wheat/Gluten-Free $ Peanut Free $ Tree Nut Free $ Soy Free $ Kosher $ French $ 
https://www.epicurious.com/recipes/food/views/thyme-gougeres-367724,Thyme Gougères ,1/4 cup (1/2 stick) unsalted butter $ 1 cup all-purpose flour $ Large pinch of cayenne pepper $ Large pinch of kosher salt $ 1 cup plus 3 tablespoons grated Gruyère $ 1/2 cup grated Asiago $ 2 teaspoons fresh thyme leaves plus more for garnish $ 5 large eggs $ ,Bread $ Cheese $ Bake $ Cocktail Party $ New Year's Eve $ Thyme $ Party $ Bon Appétit $ ,French $ ,3.5/4,37,Bread $ Cheese $ Bake $ Cocktail Party $ New Year's Eve $ Thyme $ Party $ Bon Appétit $ French $ 
https://www.epicurious.com/recipes/food/views/leeks-vinaigrette-367716,Leeks Vinaigrette ,"6 medium leeks (about 2 1/2 pounds) $ 3 tablespoons extra-virgin olive oil, divided $ 1 tablespoon unsalted butter $ 1/2 teaspoon kosher salt and freshly ground black pepper $ 1/4 cup dry white wine $ 1 cup low-salt chicken stock $ 5 sprigs thyme $ 2 tablespoons chopped flat-leaf parsley, divided $ 1 tablespoon coarse-grained Dijon mustard $ 1 tablespoon white wine vinegar $ 2 hard-boiled eggs, whites and yolks separated and chopped $ ",Egg $ Mustard $ Appetizer $ Side $ Braise $ Vegetarian $ Quick & Easy $ Leek $ Fall $ Healthy $ Bon Appétit $ Wheat/Gluten-Free $ Peanut Free $ Tree Nut Free $ Soy Free $ ,French $ ,3/4,7,Egg $ Mustard $ Appetizer $ Side $ Braise $ Vegetarian $ Quick & Easy $ Leek $ Fall $ Healthy $ Bon Appétit $ Wheat/Gluten-Free $ Peanut Free $ Tree Nut Free $ Soy Free $ French $ 
https://www.epicurious.com/recipes/food/views/summer-tomato-bouillabaisse-with-basil-rouille-366433,Summer Tomato Bouillabaisse with Basil Rouille ,"4 garlic cloves, divided $ 1/2 cup (packed) fresh basil leaves $ 1/4 cup mayonnaise $ 5 tablespoons extra-virgin olive oil, divided $ 2 anchovy fillets packed in oil, drained $ 1 tablespoon fresh lemon juice $ 4 cups (about 1 1/3 pound) cherry tomatoes $ 1 small fennel bulb, trimmed, halved, thinly sliced $ Kosher salt and freshly ground black pepper $ 1/4 cup dry white wine $ 1 8-ounce bottle clam juice $ 3 pounds mixed shellfish (such as littleneck clams, cockles, mussels), scrubbed $ 2 tablespoons chopped fresh flat-leaf parsley $ Crusty bread, sliced (for serving) $ ",Soup/Stew $ Shellfish $ Tomato $ Quick & Easy $ Bastille Day $ Backyard BBQ $ Dinner $ Lunch $ Seafood $ Clam $ Mussel $ Summer $ Bon Appétit $ Sugar Conscious $ Pescatarian $ Paleo $ Dairy Free $ Wheat/Gluten-Free $ Peanut Free $ Tree Nut Free $ Soy Free $ ,French $ French Provençal $ ,3/4,6,Soup/Stew $ Shellfish $ Tomato $ Quick & Easy $ Bastille Day $ Backyard BBQ $ Dinner $ Lunch $ Seafood $ Clam $ Mussel $ Summer $ Bon Appétit $ Sugar Conscious $ Pescatarian $ Paleo $ Dairy Free $ Wheat/Gluten-Free $ Peanut Free $ Tree Nut Free $ Soy Free $ French $ French Provençal $ 
https://www.epicurious.com/recipes/food/views/cherry-clafouti-365670,Cherry Clafouti ,"1 pound fresh cherries, stemmed and pitted, or frozen pitted cherries, thawed, drained $ 1 cup whole milk $ 1/4 cup heavy whipping cream $ 4 large eggs $ 1/2 cup all-purpose flour $ 1/2 cup sugar $ 3/4 teaspoon finely grated lemon zest $ 3/4 teaspoon vanilla extract $ 1/2 teaspoon kosher salt $ Powdered sugar $ 10"" springform cake pan or eight 2/3 or 3/4-cup ramekins or custard cups $ ",Milk/Cream $ Fruit $ Dessert $ Fourth of July $ Valentine's Day $ Mother's Day $ Cherry $ Summer $ Anniversary $ Birthday $ Shower $ Party $ Ramekin $ Bon Appétit $ Vegetarian $ Pescatarian $ Peanut Free $ Tree Nut Free $ Soy Free $ Kosher $ ,French $ ,3.5/4,21,Milk/Cream $ Fruit $ Dessert $ Fourth of July $ Valentine's Day $ Mother's Day $ Cherry $ Summer $ Anniversary $ Birthday $ Shower $ Party $ Ramekin $ Bon Appétit $ Vegetarian $ Pescatarian $ Peanut Free $ Tree Nut Free $ Soy Free $ Kosher $ French $ 
https://www.epicurious.com/recipes/food/views/blender-hollandaise-365170,Blender Hollandaise ,"1 1/4 cups (2 1/2 sticks) unsalted butter, cubed $ 2 large egg yolks $ 2 tablespoons fresh lemon juice, plus more $ Kosher salt and freshly ground black pepper $ ",Sauce $ Blender $ Egg $ Brunch $ Christmas $ Vegetarian $ Quick & Easy $ Mother's Day $ Butter $ Lemon Juice $ Bon Appétit $ Sugar Conscious $ Kidney Friendly $ Pescatarian $ Wheat/Gluten-Free $ Peanut Free $ Tree Nut Free $ Soy Free $ No Sugar Added $ Kosher $ ,French $ ,4/4,21,Sauce $ Blender $ Egg $ Brunch $ Christmas $ Vegetarian $ Quick & Easy $ Mother's Day $ Butter $ Lemon Juice $ Bon Appétit $ Sugar Conscious $ Kidney Friendly $ Pescatarian $ Wheat/Gluten-Free $ Peanut Free $ Tree Nut Free $ Soy Free $ No Sugar Added $ Kosher $ French $ 
https://www.epicurious.com/recipes/food/views/lobster-salad-with-green-beans-apple-and-avocado-364850,"Lobster Salad with Green Beans, Apple, and Avocado ","3 tablespoons coarse sea salt $ 10 ounces slim haricots verts (green beans), trimmed at both ends and cut into 1/2-inch pieces (2 cups) $ 1 cup Greek-style yogurt $ 1 tablespoon imported French mustard $ 1/4 teaspoon fine sea salt $ 1/4 cup minced fresh chives $ 1 Granny Smith apple, cored, and cut into 1/4-inch cubes (do not peel) $ 1 large ripe avocado, halved, pitted, peeled, and cut into 1/4-inch cubes $ 1 pound (2 cups) cooked lobster meat, cut into bite-sized pieces $ Equipment: A 5-quart pasta pot fitted with a colander; 4 chilled large dinner plates $ ",Salad $ Quick & Easy $ Yogurt $ Dinner $ Lunch $ Apple $ Seafood $ Lobster $ Avocado $ Green Bean $ Spring $ Summer $ Healthy $ Pescatarian $ Wheat/Gluten-Free $ Peanut Free $ Soy Free $ No Sugar Added $ ,French $ ,3/4,12,Salad $ Quick & Easy $ Yogurt $ Dinner $ Lunch $ Apple $ Seafood $ Lobster $ Avocado $ Green Bean $ Spring $ Summer $ Healthy $ Pescatarian $ Wheat/Gluten-Free $ Peanut Free $ Soy Free $ No Sugar Added $ French $ 
https://www.epicurious.com/recipes/food/views/croques-monsieur-364771,Croques Monsieur ,"1 stick salted butter, softened $ 8 slices pain de mie or firm white bread $ 8 ounces Gruyère cheese, 16 thin slices with rind removed $ 8 (1-ounce) slices smoked ham $ ",Sandwich $ Cheese $ Appetizer $ Bake $ Cocktail Party $ Quick & Easy $ Wedding $ Lunch $ Ham $ Shower $ Engagement Party $ Sugar Conscious $ Kidney Friendly $ Peanut Free $ Tree Nut Free $ Soy Free $ ,French $ ,4/4,2,Sandwich $ Cheese $ Appetizer $ Bake $ Cocktail Party $ Quick & Easy $ Wedding $ Lunch $ Ham $ Shower $ Engagement Party $ Sugar Conscious $ Kidney Friendly $ Peanut Free $ Tree Nut Free $ Soy Free $ French $ 
