link,name,ingredients,recipe_category,recipe_cuisine,rating,rating_count,keywords
https://www.epicurious.com/recipes/food/views/brown-rice-with-shiitakes-and-scallions-242806,Brown Rice with Shiitakes and Scallions ,"4 whole dried shiitake mushrooms, stemmed and caps sliced, or 1 cup dried shiitake slices $ 2 cups short-grain brown rice, rinsed $ 1 piece dried kombu (seaweed), rinsed (optional) $ 3 tablespoons soy sauce $ 1 teaspoon salt $ 1/4 cup thinly sliced scallions (green part only) $ ",Mushroom $ Side $ Low Fat $ Vegetarian $ Low Cal $ Dinner $ Lunch $ Healthy $ Vegan $ Brown Rice $ Self $ Sugar Conscious $ Pescatarian $ Dairy Free $ Peanut Free $ Tree Nut Free $ No Sugar Added $ Kosher $ ,Asian $ ,2.5/4,6,Mushroom $ Side $ Low Fat $ Vegetarian $ Low Cal $ Dinner $ Lunch $ Healthy $ Vegan $ Brown Rice $ Self $ Sugar Conscious $ Pescatarian $ Dairy Free $ Peanut Free $ Tree Nut Free $ No Sugar Added $ Kosher $ Asian $ 
https://www.epicurious.com/recipes/food/views/asian-steak-topped-with-bell-pepper-stir-fry-350398,Asian Steak Topped with Bell Pepper Stir-Fry ,"2 tablespoons Thai-style chili sauce* $ 1 1/2 tablespoons soy sauce $ 2 teaspoons balsamic vinegar $ 2 teaspoons grated peeled fresh ginger $ 2 10- to 12-ounce New York steaks $ 1 1/2 tablespoons vegetable oil, divided $ 1 medium onion, halved, sliced $ 2 medium red bell peppers, cut into $ 4 green onions, chopped $ 1/2 cup chopped fresh cilantro $ ",Stir-Fry $ Kid-Friendly $ Low Cal $ Back to School $ Dinner $ Steak $ Bell Pepper $ Poker/Game Night $ Bon Appétit $ Dairy Free $ Peanut Free $ Tree Nut Free $ No Sugar Added $ ,Asian $ ,3.5/4,9,Stir-Fry $ Kid-Friendly $ Low Cal $ Back to School $ Dinner $ Steak $ Bell Pepper $ Poker/Game Night $ Bon Appétit $ Dairy Free $ Peanut Free $ Tree Nut Free $ No Sugar Added $ Asian $ 
https://www.epicurious.com/recipes/food/views/grilled-lamb-skewers-with-spiced-mint-marinade-243443,Grilled Lamb Skewers with Spiced Mint Marinade ,"1 cup (packed) fresh mint leaves, coarsely chopped $ 3/4 cup orange juice $ 1/2 cup (packed) golden brown sugar $ 1/4 cup dry Sherry $ 1/4 cup apple cider vinegar $ 3 garlic cloves, chopped $ 1 tablespoon finely grated orange peel $ 1 tablespoon chopped peeled fresh ginger $ 2 teaspoons Szechuan peppercorns* $ 1 teaspoon Asian sesame oil $ 1 teaspoon soy sauce $ 1 teaspoon pink peppercorns, crushed $ 1 1/2 pounds 1-inch cubes trimmed leg of lamb (cut from 2 1/2 pounds of untrimmed leg of lamb) $ 
Sometimes called wild pepper or sansho
 $ ",Ginger $ Lamb $ Marinate $ Backyard BBQ $ Orange $ Mint $ Sherry $ Summer $ Grill $ Grill/Barbecue $ Healthy $ Sesame $ Bon Appétit $ ,Asian $ Mediterranean $ ,3/4,5,Ginger $ Lamb $ Marinate $ Backyard BBQ $ Orange $ Mint $ Sherry $ Summer $ Grill $ Grill/Barbecue $ Healthy $ Sesame $ Bon Appétit $ Asian $ Mediterranean $ 
https://www.epicurious.com/recipes/food/views/pupu-platter-350341,Pupu Platter ,"1/2 pound shrimp, peeled and deveined $ 1 tablespoon finely chopped peeled ginger $ 1 tablespoon Asian sesame oil $ 1 tablespoon medium-dry Sherry $ 1 tablespoon soy sauce $ 1 large egg white $ 2 tablespoons finely chopped cilantro $ 2 scallions, finely chopped $ 6 slices firm white sandwich bread, cut into 1 1/2-inch rounds (24 total) $ About 6 cups vegetable oil for frying $ 12 slices bacon (about 3/4 pound), halved crosswise $ 1 (1 1/2-pounds) pineapple, peeled, cored, and cut into 24 (1-inch) chunks $ 1 bunch scallions, greens cut into 5-inch-long pieces and halved lengthwise $ 3 tablespoons soy sauce $ 2 tablespoons seasoned rice vinegar $ 2 garlic cloves, minced $ 2 teaspoons grated peeled ginger $ 1 medium zucchini $ 1/2 pound flatiron steak, cut across grain into 1/8-inch-thick slices $ 24 wooden picks; 24 (6-inch) bamboo skewers, soaked in water for 30 minutes; Equipment: an adjustable-blade slicer; a deep-fat thermometer $ Accompaniment: hoisin and Sriracha sauce $ ",Ginger $ Appetizer $ Super Bowl $ Kid-Friendly $ Oscars $ Dinner $ Lunch $ Pineapple $ Steak $ Bacon $ Shrimp $ Family Reunion $ Poker/Game Night $ Party $ Soy Sauce $ Candy Thermometer $ Gourmet $ ,Asian $ ,3/4,2,Ginger $ Appetizer $ Super Bowl $ Kid-Friendly $ Oscars $ Dinner $ Lunch $ Pineapple $ Steak $ Bacon $ Shrimp $ Family Reunion $ Poker/Game Night $ Party $ Soy Sauce $ Candy Thermometer $ Gourmet $ Asian $ 
https://www.epicurious.com/recipes/food/views/grilled-shrimp-with-spicy-tamarind-dipping-sauce-242804,Grilled Shrimp with Spicy Tamarind Dipping Sauce ,"24 jumbo shrimp, shelled and deveined $ 8 wooden skewers, soaked in water 20 minutes $ 4 cloves garlic, finely chopped $ 1/4 cup tamarind paste (found in Asian markets) $ 1 tablespoon canola oil $ 1 tablespoon fish sauce $ 1-2 tablespoons red pepper flakes $ 1 tablespoon sugar $ ",Garlic $ Quick & Easy $ Backyard BBQ $ Shrimp $ Summer $ Grill $ Grill/Barbecue $ Healthy $ Tamarind $ Self $ ,Asian $ ,3/4,1,Garlic $ Quick & Easy $ Backyard BBQ $ Shrimp $ Summer $ Grill $ Grill/Barbecue $ Healthy $ Tamarind $ Self $ Asian $ 
https://www.epicurious.com/recipes/food/views/blue-claw-crab-boil-with-asian-condiments-242785,Blue Claw Crab Boil with Asian Condiments ,"24 live blue crabs $ 1/2 cup ketchup $ 2 tablespoons wasabi paste $ 1 tablespoon soy sauce $ 1 tablespoon mustard powder $ Fresh lemon juice $ Worcestershire sauce $ 3/4 cup ponzu sauce (found in grocery stores' Asian section) $ 3/4 cup Thai sweet chile sauce $ 2 limes, cut into wedges $ ",Self $ ,American $ Asian $ ,2.5/4,12,Self $ American $ Asian $ 
https://www.epicurious.com/recipes/food/views/vietnamese-chicken-salad-243196,Vietnamese Chicken Salad ,"2 tablespoons fresh lime juice $ 2 tablespoons finely chopped garlic $ 1 tablespoon finely chopped peeled ginger $ 1 teaspoon finely chopped fresh red chiles (preferably Thai or cayenne), or to taste $ 1 whole chicken (about 3 1/2 pounds) $ 1 (2-pound) green cabbage $ 1/2 pound carrots $ 1 tablespoon sugar $ 1/3 cup Asian fish sauce $ 1/4 cup packed light brown sugar $ 1 tablespoon finely chopped fresh red chiles (preferably Thai or cayenne) $ 2 teaspoon finely chopped peeled ginger $ 1 garlic clove, finely chopped $ 5 tablespoons fresh lime juice $ 2/3 cup coarsely chopped salted roasted peanuts $ 1/2 cup packed torn basil leaves $ 1/2 cup packed torn mint leaves $ an adjustable-blade slicer $ lime wedges; thinly sliced fresh red chiles (optional) $ ",Salad $ Chicken $ Ginger $ Poultry $ Back to School $ Dinner $ Lunch $ Lime $ Mint $ Basil $ Peanut $ Hot Pepper $ Carrot $ Family Reunion $ Healthy $ Cabbage $ Potluck $ Gourmet $ Dairy Free $ Wheat/Gluten-Free $ Tree Nut Free $ Soy Free $ ,Asian $ Vietnamese $ Southeast Asian $ ,2.5/4,15,Salad $ Chicken $ Ginger $ Poultry $ Back to School $ Dinner $ Lunch $ Lime $ Mint $ Basil $ Peanut $ Hot Pepper $ Carrot $ Family Reunion $ Healthy $ Cabbage $ Potluck $ Gourmet $ Dairy Free $ Wheat/Gluten-Free $ Tree Nut Free $ Soy Free $ Asian $ Vietnamese $ Southeast Asian $ 
https://www.epicurious.com/recipes/food/views/steamed-scallion-ginger-fish-fillets-with-bok-choy-243067,Steamed Scallion Ginger Fish Fillets with Bok Choy ,"1/2 cup light soy sauce $ 2 tablespoons sugar $ 1/2 cup Shaohsing rice wine $ 1/2 teaspoon five-spice powder $ 2 pounds sole fillet, cut into 8 pieces $ 1 (1-inch) piece fresh ginger, finely julienned $ 6 tablespoons vegetable oil $ 8 scallions (white and green parts), cut crosswise into 2-inch lengths, then thinly julienned lengthwise $ Stir-Fried Baby Bok Choy $ ",Wine $ Fish $ Ginger $ Onion $ Marinate $ Steam $ Spice $ Healthy $ Soy Sauce $ ,Asian $ ,3.5/4,18,Wine $ Fish $ Ginger $ Onion $ Marinate $ Steam $ Spice $ Healthy $ Soy Sauce $ Asian $ 
https://www.epicurious.com/recipes/food/views/stir-fried-baby-bok-choy-243124,Stir Fried Baby Bok Choy ,"1 1/2 pounds baby bok choy $ 2 tablespoons peanut oil $ 1 (1/4-inch) piece fresh ginger, minced (about 1 teaspoon) $ 2 scallions (white and green parts), thinly sliced $ 4 cloves garlic, thinly sliced $ 1 teaspoon coarse sea or kosher salt $ 1 teaspoon sugar $ 1/8 teaspoon ground white pepper $ ",Wok $ Garlic $ Ginger $ Onion $ Side $ Stir-Fry $ Quick & Easy $ Healthy $ Vegan $ Bok Choy $ Sugar Conscious $ Vegetarian $ Pescatarian $ Dairy Free $ Wheat/Gluten-Free $ Tree Nut Free $ Soy Free $ Kosher $ ,Asian $ ,3.5/4,39,Wok $ Garlic $ Ginger $ Onion $ Side $ Stir-Fry $ Quick & Easy $ Healthy $ Vegan $ Bok Choy $ Sugar Conscious $ Vegetarian $ Pescatarian $ Dairy Free $ Wheat/Gluten-Free $ Tree Nut Free $ Soy Free $ Kosher $ Asian $ 
https://www.epicurious.com/recipes/food/views/porcupine-meatballs-350174,Porcupine Meatballs ,"1 pound uncooked shrimp, peeled, deveined, and tails removed $ 2 tablespoons finely chopped scallions $ 2 teaspoons soy sauce $ 1/2 teaspoon grated fresh ginger $ 1/2 cup short-grain rice (such as arborio), soaked in 2 cups very hot water for 2 hours $ Cabbage or lettuce leaves $ Ponzu sauce (available at Asian specialty stores) or more soy sauce $ ",Rice $ Steam $ Cocktail Party $ Dinner $ Shrimp $ Healthy $ Soy Sauce $ Cookie $ Sugar Conscious $ Pescatarian $ Dairy Free $ Peanut Free $ Tree Nut Free $ No Sugar Added $ ,Asian $ Italian American $ ,3.5/4,4,Rice $ Steam $ Cocktail Party $ Dinner $ Shrimp $ Healthy $ Soy Sauce $ Cookie $ Sugar Conscious $ Pescatarian $ Dairy Free $ Peanut Free $ Tree Nut Free $ No Sugar Added $ Asian $ Italian American $ 
https://www.epicurious.com/recipes/food/views/salt-and-pepper-shrimp-350204,Salt and Pepper Shrimp ,"1 1/2 pounds medium shrimp in shell $ 3 quarts corn oil $ 3 tablespoon plus 1 teaspoon kosher salt, divided $ 2 large egg whites, at room temperature 30 minutes $ 1 cup cornstarch $ 3 tablespoons plus 1 teaspoon freshly ground black pepper (not fine) $ 2 cups sliced (1/8 inch thick) fresh jalapeño (about 8 chiles) $ 3 cups cilantro sprigs (from 2 bunches) $ 2 teaspoons flaky sea salt, such as Maldon, or to taste $ Equipment: a deep-fat thermometer $ ",Pepper $ Fry $ Dinner $ Shrimp $ Candy Thermometer $ Gourmet $ ,Asian $ ,3.5/4,5,Pepper $ Fry $ Dinner $ Shrimp $ Candy Thermometer $ Gourmet $ Asian $ 
https://www.epicurious.com/recipes/food/views/pork-and-chive-dumplings-350205,Pork and Chive Dumplings ,"1/2 pound fatty ground pork $ 1/2 tablespoon Shaoxing wine $ 1/4 teaspoon Asian sesame oil $ 1/2 teaspoon Vietnamese chile-garlic sauce (preferably Huy Fong brand) $ 1 1/2 teaspoons finely grated peeled ginger $ 1/2 teaspoon rice vinegar (not seasoned) $ 2 teaspoons soy sauce $ 1/2 teaspoon kosher salt $ Pinch of white pepper $ 3 tablespoons finely chopped cilantro stems $ 3 tablespoons finely chopped flowering chives, flat Chinese chives (garlic chives), or scallions $ 24 to 30 round dumpling wrappers (preferably with egg) $ Accompaniment: Lantern dumpling sauce $ Garnish: thinly sliced scallions $ ",Pork $ Appetizer $ Lunar New Year $ Chive $ Party $ Boil $ Gourmet $ Sugar Conscious $ Kidney Friendly $ Dairy Free $ Peanut Free $ Tree Nut Free $ ,Asian $ Chinese $ ,4/4,19,Pork $ Appetizer $ Lunar New Year $ Chive $ Party $ Boil $ Gourmet $ Sugar Conscious $ Kidney Friendly $ Dairy Free $ Peanut Free $ Tree Nut Free $ Asian $ Chinese $ 
https://www.epicurious.com/recipes/food/views/lantern-dumpling-sauce-350206,Lantern Dumpling Sauce ,"1/2 cup soy sauce $ 1/3 cup water $ 1/2 tablespoon Shaoxing wine $ 1/8 teaspoon Asian sesame oil $ 1 garlic clove, smashed $ 3 (2-inch) dried red chiles, wiped clean $ 1/8 teaspoon sugar $ ",Sauce $ Lunar New Year $ Soy Sauce $ Gourmet $ ,Asian $ Chinese $ ,3/4,2,Sauce $ Lunar New Year $ Soy Sauce $ Gourmet $ Asian $ Chinese $ 
https://www.epicurious.com/recipes/food/views/poached-tangerine-slices-350217,Poached Tangerine Slices ,"4 tight-skinned tangerines, satsumas, or mandarin oranges $ 1 1/2 cups sugar $ 3 cups water $ 1/4 cup dry white wine $ 1/4 cup fresh lemon juice $ ",Fruit $ Dessert $ Poach $ White Wine $ Fall $ Tangerine $ Gourmet $ Fat Free $ Kidney Friendly $ Vegan $ Vegetarian $ Pescatarian $ Dairy Free $ Wheat/Gluten-Free $ Peanut Free $ Tree Nut Free $ Soy Free $ Kosher $ ,Asian $ ,0/4,0,Fruit $ Dessert $ Poach $ White Wine $ Fall $ Tangerine $ Gourmet $ Fat Free $ Kidney Friendly $ Vegan $ Vegetarian $ Pescatarian $ Dairy Free $ Wheat/Gluten-Free $ Peanut Free $ Tree Nut Free $ Soy Free $ Kosher $ Asian $ 
https://www.epicurious.com/recipes/food/views/southeast-asian-squash-curry-350259,Southeast Asian Squash Curry ,"1 tablespoon plus 2 teaspoons vegetable oil, divided $ 1 1/2 pound butternut squash, peeled, seeded, and cut into 1/2-inch pieces $ 3/4 teaspoon cumin seeds $ 1 medium onion, thinly sliced $ 1 (14-ounce) can unsweetened coconut milk (do not stir), divided $ 1 1/2 to 2 tablespoons Thai Kitchen red curry paste $ 1/3 cup water $ 1 (2- to 3-inch) cinnamon stick $ 3 whole cloves $ 5 ounces baby spinach (5 cups packed) $ 1 tablespoon Asian fish sauce, or to taste $ 1/4 cup salted roasted cashews, chopped $ Accompaniment: lime wedges $ ",Quick & Easy $ Dinner $ Cashew $ Curry $ Spinach $ Squash $ Butternut Squash $ Fall $ Potluck $ Gourmet $ Pescatarian $ Dairy Free $ Wheat/Gluten-Free $ Peanut Free $ Soy Free $ No Sugar Added $ ,Asian $ Southeast Asian $ ,3/4,33,Quick & Easy $ Dinner $ Cashew $ Curry $ Spinach $ Squash $ Butternut Squash $ Fall $ Potluck $ Gourmet $ Pescatarian $ Dairy Free $ Wheat/Gluten-Free $ Peanut Free $ Soy Free $ No Sugar Added $ Asian $ Southeast Asian $ 
https://www.epicurious.com/recipes/food/views/sweet-potato-and-kim-chi-pancakes-350207,Sweet Potato and Kim Chi Pancakes ,"1 pound sweet potatoes $ 1 cup packed kimchi (7 ounces), very thinly sliced $ 1 1/2 teaspoons finely chopped garlic $ 1 to 2 tablespoons chopped fresh serrano chiles (including seeds; amount depends on heat of kimchi) $ 1 cup thinly sliced scallions (from about 2 bunches) $ 1 large egg, lightly beaten $ 1 teaspoon kosher salt $ 3/4 cup all-purpose flour $ About 1/2 cup corn oil or lard $ Accompaniment: soy-vinegar dipping sauce $ Equipment: an adjustable-blade slicer $ ",Cocktail Party $ Quick & Easy $ Dinner $ Hot Pepper $ Sweet Potato/Yam $ Pan-Fry $ Cabbage $ Party $ Potluck $ Gourmet $ Sugar Conscious $ Vegetarian $ Pescatarian $ Dairy Free $ Peanut Free $ Tree Nut Free $ Soy Free $ No Sugar Added $ Kosher $ ,Asian $ Korean $ ,3.5/4,14,Cocktail Party $ Quick & Easy $ Dinner $ Hot Pepper $ Sweet Potato/Yam $ Pan-Fry $ Cabbage $ Party $ Potluck $ Gourmet $ Sugar Conscious $ Vegetarian $ Pescatarian $ Dairy Free $ Peanut Free $ Tree Nut Free $ Soy Free $ No Sugar Added $ Kosher $ Asian $ Korean $ 
https://www.epicurious.com/recipes/food/views/cold-spicy-celery-350209,Cold Spicy Celery ,2 bunches celery (preferably organic) $ 2 teaspoons kosher salt $ 1 1/2 teaspoons fresh lemon juice $ 1/2 teaspoon coarse Korean chile flakes $ 1 tablespoon toasted peanut oil $ Sansho pepper to taste $ ,Vegetarian $ Dinner $ Lunch $ Celery $ Hot Pepper $ Healthy $ Potluck $ Gourmet $ Sugar Conscious $ Kidney Friendly $ Vegan $ Pescatarian $ Dairy Free $ Wheat/Gluten-Free $ Tree Nut Free $ Soy Free $ No Sugar Added $ Kosher $ ,Asian $ Korean $ ,2/4,2,Vegetarian $ Dinner $ Lunch $ Celery $ Hot Pepper $ Healthy $ Potluck $ Gourmet $ Sugar Conscious $ Kidney Friendly $ Vegan $ Pescatarian $ Dairy Free $ Wheat/Gluten-Free $ Tree Nut Free $ Soy Free $ No Sugar Added $ Kosher $ Asian $ Korean $ 
https://www.epicurious.com/recipes/food/views/steamed-jasmine-rice-350215,Steamed Jasmine Rice ,3 cups jasmine rice $ 3 1/2 cups water $ ,Rice $ Side $ Quick & Easy $ Dinner $ Lunar New Year $ Potluck $ Boil $ Gourmet $ Fat Free $ Sugar Conscious $ Kidney Friendly $ Vegan $ Vegetarian $ Pescatarian $ Dairy Free $ Wheat/Gluten-Free $ Peanut Free $ Tree Nut Free $ Soy Free $ No Sugar Added $ Kosher $ ,Asian $ ,3/4,0,Rice $ Side $ Quick & Easy $ Dinner $ Lunar New Year $ Potluck $ Boil $ Gourmet $ Fat Free $ Sugar Conscious $ Kidney Friendly $ Vegan $ Vegetarian $ Pescatarian $ Dairy Free $ Wheat/Gluten-Free $ Peanut Free $ Tree Nut Free $ Soy Free $ No Sugar Added $ Kosher $ Asian $ 
https://www.epicurious.com/recipes/food/views/caramel-pecan-cakes-350212,Caramel Pecan Cakes ,"2 cups sugar $ 1 1/2 cups water, divided $ 1/2 cup pecans $ 1/2 stick unsalted butter, melted $ 1 large egg, lightly beaten $ 1/3 cup heavy cream $ 1 1/4 cups all-purpose flour $ 1/2 teaspoon baking soda $ 1/2 teaspoon salt $ 1/4 cup granulated sugar $ 1/4 cup packed brown sugar $ 8 (6-ounces) ramekins $ five-spice ice cream and poached tangerine slices $ ",Cake $ Milk/Cream $ Egg $ Dessert $ Bake $ Valentine's Day $ Lunar New Year $ Pecan $ Gourmet $ Kidney Friendly $ Vegetarian $ Pescatarian $ Peanut Free $ Soy Free $ Kosher $ ,Asian $ ,3.5/4,26,Cake $ Milk/Cream $ Egg $ Dessert $ Bake $ Valentine's Day $ Lunar New Year $ Pecan $ Gourmet $ Kidney Friendly $ Vegetarian $ Pescatarian $ Peanut Free $ Soy Free $ Kosher $ Asian $ 
https://www.epicurious.com/recipes/food/views/steamed-egg-custard-with-blue-crab-and-flowering-chives-350210,Steamed Egg Custard with Blue Crab and Flowering Chives ,"3 large dried Chinese black mushrooms $ 2 1/3 cups water $ 1 (4-inch) piece kombu (dried kelp) $ 2 tablespoons bonito flakes $ 6 large eggs $ 1/4 cup heavy cream $ 1 1/2 teaspoons Shaoxing wine $ 1 1/2 teaspoons dry Oloroso Sherry $ 1 1/2 teaspoons soy sauce $ 1 teaspoon kosher salt $ 1/4 teaspoon sugar $ 1/2 teaspoon Asian sesame oil $ 18 flowering Chinese chives, tough bottoms discarded $ 1/2 pound jumbo lump crabmeat, picked over $ 1/2 teaspoon Asian sesame oil $ 1/4 teaspoon sugar $ 3/4 teaspoon kosher salt $ 1 1/2 teaspoons Shaoxing wine $ 1 tablespoon dry Oloroso Sherry $ Pinch of white pepper $ Equipment: 8 (4- to 5-ounce) bowls or ramekins $ ",Egg $ Mushroom $ Steam $ Quick & Easy $ Dinner $ Crab $ Sherry $ Soy Sauce $ Gourmet $ Sugar Conscious $ Peanut Free $ Tree Nut Free $ ,Asian $ Japanese $ ,3/4,2,Egg $ Mushroom $ Steam $ Quick & Easy $ Dinner $ Crab $ Sherry $ Soy Sauce $ Gourmet $ Sugar Conscious $ Peanut Free $ Tree Nut Free $ Asian $ Japanese $ 
https://www.epicurious.com/recipes/food/views/wilted-watercress-with-garlic-350213,Wilted Watercress with Garlic ,"2 tablespoon corn oil $ 12 garlic cloves, peeled and smashed $ 4 bunches watercress (about 20 ounces), trimmed (about 12 packed cups) $ 1 1/2 teaspoon kosher salt $ 1/4 cup chicken stock or reduced-sodium broth $ ",Wok $ Garlic $ Side $ Stir-Fry $ Low Carb $ Low Cal $ Dinner $ Lunar New Year $ Healthy $ Watercress $ Gourmet $ Sugar Conscious $ Dairy Free $ Wheat/Gluten-Free $ Peanut Free $ Tree Nut Free $ Soy Free $ No Sugar Added $ Kosher $ ,Asian $ Chinese $ ,3/4,1,Wok $ Garlic $ Side $ Stir-Fry $ Low Carb $ Low Cal $ Dinner $ Lunar New Year $ Healthy $ Watercress $ Gourmet $ Sugar Conscious $ Dairy Free $ Wheat/Gluten-Free $ Peanut Free $ Tree Nut Free $ Soy Free $ No Sugar Added $ Kosher $ Asian $ Chinese $ 
https://www.epicurious.com/recipes/food/views/braised-chicken-with-smoked-ham-chestnuts-and-ginger-350211,"Braised Chicken with Smoked Ham, Chestnuts, and Ginger ","2 3/4 cups water $ 12 dried Chinese black mushrooms $ 1/2 teaspoon white pepper $ 2 teaspoons kosher salt, divided $ 1 tablespoon soy sauce $ 2 teaspoon sugar $ 1 cup sliced peeled ginger $ 1/4 cup Shaoxing wine or dry Oloroso Sherry $ 1/4 cup dry white wine $ 2 small chickens (2 1/2 to 3 pounds), each cut into 6 pieces (legs, thighs, and breasts without backbones) $ 2 3/4 cups water $ 2 tablespoons corn oil $ 1 tablespoon plus 2 teaspoon kosher salt, divided $ 1/4 cup finely julienned peeled ginger $ 1/2 cup dry white wine $ 3/4 cup Shaoxing wine or dry Oloroso Sherry $ 3/4 cup dry Oloroso Sherry $ 2 1/2 cups reduced-sodium chicken broth $ 1 1/2 cups plus 2 tablespoon cold water, divided $ 3 1/2 teaspoons sugar $ 2 tablespoons soy sauce $ 1 teaspoon white pepper $ 2 tablespoons cornstarch $ 7 to 8 ounces bottled roasted chestnuts $ 1/4 pound thinly sliced country ham or speck $ Accompaniment: steamed jasmine rice $ ",Chicken $ Ginger $ Braise $ Marinate $ Dinner $ Lunar New Year $ Ham $ Chestnut $ Party $ Gourmet $ Dairy Free $ Peanut Free $ ,Asian $ Chinese $ ,3.5/4,19,Chicken $ Ginger $ Braise $ Marinate $ Dinner $ Lunar New Year $ Ham $ Chestnut $ Party $ Gourmet $ Dairy Free $ Peanut Free $ Asian $ Chinese $ 
https://www.epicurious.com/recipes/food/views/soy-vinegar-dipping-sauce-350208,Soy Vinegar Dipping Sauce ,1/3 cup tamari (preferably San-J brand) $ 2 tablespoons mirin (Japanese sweet rice wine) $ 1 tablespoon sugar $ 4 teaspoons rice vinegar (not seasoned) $ 2 tablespoons water $ 1 tablespoon fresh lemon juice $ ,Sauce $ Quick & Easy $ Soy Sauce $ Gourmet $ ,Asian $ ,0/4,0,Sauce $ Quick & Easy $ Soy Sauce $ Gourmet $ Asian $ 
https://www.epicurious.com/recipes/food/views/steamed-fish-with-scallions-and-ginger-242825,Steamed Fish with Scallions and Ginger ,"2 whole fish (about 2 pounds each, such as black sea bass or wild salmon), scaled, gutted, and scored $ 1/2 cup sliced scallions (green part only) $ 2 tablespoons fresh julienned ginger $ 1/2 cup soy sauce $ 1/4 cup peanut oil $ 1 teaspoon sesame oil $ 1/2 teaspoon sugar $ ",Ginger $ Onion $ Vegetable $ Steam $ Low Cal $ Dinner $ Seafood $ Bass $ Salmon $ Healthy $ Soy Sauce $ Self $ Lunar New Year $ Sugar Conscious $ Pescatarian $ Dairy Free $ Tree Nut Free $ Kosher $ ,Asian $ Chinese $ ,3.5/4,32,Ginger $ Onion $ Vegetable $ Steam $ Low Cal $ Dinner $ Seafood $ Bass $ Salmon $ Healthy $ Soy Sauce $ Self $ Lunar New Year $ Sugar Conscious $ Pescatarian $ Dairy Free $ Tree Nut Free $ Kosher $ Asian $ Chinese $ 
https://www.epicurious.com/recipes/food/views/lisu-spice-rubbed-roast-pork-242879,Lisu Spice-Rubbed Roast Pork ,"About 2 tablespoons lard or bacon drippings $ About 1 1/2 pounds boneless pork butt or loin, no more than 2 inches thick at its thickest $ 2 teaspoons freshly grated nutmeg $ 1 1/2 teaspoons dry-roasted Sichuan peppercorns, ground $ 1/2 teaspoon freshly ground black pepper $ 1 teaspoon salt $ ",Pork $ Roast $ Dinner $ Meat $ Spice $ Gourmet $ Sugar Conscious $ Paleo $ Dairy Free $ Wheat/Gluten-Free $ Peanut Free $ Tree Nut Free $ Soy Free $ No Sugar Added $ ,Asian $ Chinese $ ,4/4,3,Pork $ Roast $ Dinner $ Meat $ Spice $ Gourmet $ Sugar Conscious $ Paleo $ Dairy Free $ Wheat/Gluten-Free $ Peanut Free $ Tree Nut Free $ Soy Free $ No Sugar Added $ Asian $ Chinese $ 
https://www.epicurious.com/recipes/food/views/spicy-sichuan-tofu-em-mapo-doufu-em-242878,Spicy Sichuan Tofu (Mapo Doufu) ,"1/2 teaspoon Sichuan peppercorns, <a href+105622"">toasted</a> and cooled $ 1 (14- to 17-ounce) package tofu (not silken), rinsed $ 3 tablespoons peanut or vegetable oil $ 5 ounce ground pork butt (not lean; 2/3 cup) $ 2 1/2 tablespoons toban jiang (hot bean sauce) $ 1 tablespoon fermented black beans, rinsed, drained, and chopped $ 2 teaspoon Asian chile powder $ 1 cup chicken stock or reduced-sodium chicken broth $ 2 teaspoon soy sauce $ 1 teaspoon sugar $ 1 tablespoons cornstarch $ 4 teaspoons water $ 4 scallions, chopped (1/2 cup) $ Equipment: an electric coffee/spice grinder; a well-seasoned 14-inch flat-bottomed wok. $ ",Wok $ Pork $ Stir-Fry $ Quick & Easy $ Dinner $ Meat $ Tofu $ Soy Sauce $ Gourmet $ Dairy Free $ Tree Nut Free $ ,Asian $ Chinese $ Szechuan/Hunan $ ,3.5/4,6,Wok $ Pork $ Stir-Fry $ Quick & Easy $ Dinner $ Meat $ Tofu $ Soy Sauce $ Gourmet $ Dairy Free $ Tree Nut Free $ Asian $ Chinese $ Szechuan/Hunan $ 
https://www.epicurious.com/recipes/food/views/asian-pork-and-mushroom-burger-wraps-242710,Asian Pork and Mushroom Burger Wraps ,"2 tablespoons canola oil or peanut oil $ 2 tablespoons minced lemongrass (from bottom 3 inches of about 4 stalks) $ 2 garlic cloves, minced $ 4 ounces fresh shiitake mushrooms, stemmed, caps chopped $ 1 teaspoon coarse kosher salt, divided $ 1 3/4 pounds ground pork shoulder (Boston butt) $ 2 tablespoons soy sauce, divided $ 3 teaspoons Asian sesame oil, divided $ 3/4 teaspoon cracked black pepper $ 1/2 cup hoisin sauce* $ 1 tablespoon minced peeled fresh ginger $ 1 tablespoon unseasoned rice vinegar $ 1 teaspoon hot chili sauce (such as sriracha)* $ Nonstick vegetable oil spray $ 2 heads of Bibb lettuce, cored, leaves separated $ 1 cup matchstick-size strips red bell pepper $ 1 cup matchstick-size strips peeled carrot $ 1/3 cup fresh cilantro leaves $ ",Mushroom $ Pork $ High Fiber $ Backyard BBQ $ Summer $ Grill $ Grill/Barbecue $ Lemongrass $ Sesame $ Soy Sauce $ Lettuce $ Bon Appétit $ ,Asian $ ,4/4,30,Mushroom $ Pork $ High Fiber $ Backyard BBQ $ Summer $ Grill $ Grill/Barbecue $ Lemongrass $ Sesame $ Soy Sauce $ Lettuce $ Bon Appétit $ Asian $ 
https://www.epicurious.com/recipes/food/views/grilled-shrimp-satay-with-peaches-and-bok-choy-242685,Grilled Shrimp Satay with Peaches and Bok Choy ,"6 tablespoons smooth natural peanut butter, stirred to combine $ 1/3 cup (packed) dark brown sugar $ 3 tablespoons seasoned rice vinegar $ 2 tablespoons soy sauce $ 2 to 3 teaspoons hot chili paste (such as sambal oelek)* $ 9 tablespoons peach nectar, divided $ 3 peaches or nectarines, each cut into 6 wedges $ 16 uncooked large shrimp, peeled, deveined $ 6 heads of baby bok choy, halved lengthwise $ ",Low Fat $ Quick & Easy $ Low Cal $ High Fiber $ Backyard BBQ $ Peach $ Peanut $ Shrimp $ Summer $ Grill $ Grill/Barbecue $ Healthy $ Bok Choy $ Bon Appétit $ ,Asian $ Indonesian $ ,3.5/4,54,Low Fat $ Quick & Easy $ Low Cal $ High Fiber $ Backyard BBQ $ Peach $ Peanut $ Shrimp $ Summer $ Grill $ Grill/Barbecue $ Healthy $ Bok Choy $ Bon Appétit $ Asian $ Indonesian $ 
