link,name,ingredients,recipe_category,recipe_cuisine,rating,rating_count,keywords
https://www.epicurious.com/recipes/food/views/smothered-grilled-pork-chops-108305,Smothered Grilled Pork Chops ,"2 large red bell peppers $ 2 tablespoons plus 4 teaspoons vegetable oil $ 2 medium onions, thinly sliced $ 1 tablespoon all-purpose flour $ 1/4 cup dry white wine $ 2 tablespoons apple cider vinegar $ 2 tablespoons drained capers $ 1 cup low-salt chicken broth $ 1 tablespoon chopped fresh parsley $ 4 1- to 1 1/4-inch-thick bone-in rib pork chops (each about 12 ounces) $ ",Pork $ Pork Chop $ Summer $ Grill/Barbecue $ Bon Appétit $ ,American $ ,3/4,22,Pork $ Pork Chop $ Summer $ Grill/Barbecue $ Bon Appétit $ American $ 
https://www.epicurious.com/recipes/food/views/grilled-chicken-sandwiches-with-sage-pesto-and-apples-108306,Grilled Chicken Sandwiches with Sage Pesto and Apples ,"3/4 cup lightly packed fresh sage leaves (from 2 large bunches) $ 3/4 cup pine nuts (about 4 ounces) $ 1/4 cup (packed) fresh Italian parsley leaves $ 1 garlic clove $ 3/4 cup plus 3 tablespoons olive oil $ 6 tablespoons freshly grated Parmesan cheese $ 6 skinless boneless chicken breast halves $ 6 4x5-inch rectangles focaccia, ciabatta, or long French rolls, split horizontally $ Mayonnaise $ 3 medium Fuji apples, halved, cored, thinly sliced $ ",Sandwich $ Chicken $ Fruit $ Poultry $ Apple $ Summer $ Grill/Barbecue $ Sage $ Bon Appétit $ ,American $ ,3.5/4,55,Sandwich $ Chicken $ Fruit $ Poultry $ Apple $ Summer $ Grill/Barbecue $ Sage $ Bon Appétit $ American $ 
https://www.epicurious.com/recipes/food/views/marshmallows-10899,Marshmallows ,"1 1/2 cups confectioner's sugar $ 1 1/2 cups cornstarch $ 2 packages gelatin $ 4 cups sugar divided into 3 2/3 cups and 1/3 cup $ 1/2 cup light corn syrup $ 8 egg whites, at room temperature $ 1 teaspoon cream of tartar $ 1 teaspoon vanilla or almond extract, or a few drops of orange flower or rose water $ 1 drop food coloring (optional) $ ",Dessert $ Fall $ Fat Free $ Kidney Friendly $ Dairy Free $ Wheat/Gluten-Free $ Peanut Free $ Soy Free $ ,American $ ,2.5/4,1,Dessert $ Fall $ Fat Free $ Kidney Friendly $ Dairy Free $ Wheat/Gluten-Free $ Peanut Free $ Soy Free $ American $ 
https://www.epicurious.com/recipes/food/views/cheeseburgers-with-charred-green-chiles-and-onions-109698,Cheeseburgers with Charred Green Chiles and Onions ,"1/2 cup mayonnaise $ 1/2 cup prepared barbecue sauce $ 2 1/4 pounds freshly ground beef chuck $ 1 teaspoon salt $ 1/2 teaspoon ground black pepper $ 3 metal skewers $ 3 1/2-inch-thick onion slices $ Vegetable oil $ 3 poblano chiles* $ 12 thin slices cheddar cheese, room temperature $ 6 onion rolls or sesame-seed hamburger buns, split $ ",Sandwich $ Beef $ Onion $ Mayonnaise $ Cheddar $ Hot Pepper $ Summer $ Grill/Barbecue $ Bon Appétit $ ,American $ ,3.5/4,7,Sandwich $ Beef $ Onion $ Mayonnaise $ Cheddar $ Hot Pepper $ Summer $ Grill/Barbecue $ Bon Appétit $ American $ 
https://www.epicurious.com/recipes/food/views/malted-milk-ice-cream-cake-with-blackberry-topping-109721,Malted Milk Ice Cream Cake with Blackberry Topping ,"Nonstick vegetable oil spray $ 1 cup cake flour $ 1 teaspoon baking powder $ 1/4 teaspoon salt $ 1/2 cup sugar $ 1/4 cup (1/2 stick) unsalted butter, room temperature $ 1 large egg $ 1 teaspoon vanilla extract $ 1/3 cup whole milk $ 11 large egg yolks $ 3/4 cup (packed) golden brown sugar $ 3/4 cup malted milk powder $ 6 tablespoons bourbon $ 1 1/2 tablespoons vanilla extract $ 2 1/4 cups whipping cream $ 2 1/4 cups whole milk $ 1 cup plus 2 tablespoons sugar $ 1/2 cup water $ 6 tablespoons sugar $ 4 1/2-pint containers blackberries, divided $ ",Cake $ Milk/Cream $ Egg $ Dessert $ Bake $ Kid-Friendly $ Blackberry $ Summer $ Bon Appétit $ Vegetarian $ Pescatarian $ Peanut Free $ Tree Nut Free $ Soy Free $ Kosher $ ,American $ ,3.5/4,10,Cake $ Milk/Cream $ Egg $ Dessert $ Bake $ Kid-Friendly $ Blackberry $ Summer $ Bon Appétit $ Vegetarian $ Pescatarian $ Peanut Free $ Tree Nut Free $ Soy Free $ Kosher $ American $ 
https://www.epicurious.com/recipes/food/views/watermelon-lemonade-and-blueberry-ice-pops-109724,"Watermelon, Lemonade, and Blueberry Ice Pops ",2 1/2 cups 1/2-inch cubes seeded watermelon (from 2-pound piece) $ 1/4 cup sugar $ 8 5-ounce disposable paper cups $ 8 ice pop sticks or wooden coffee stirrers $ 1/2 cup water $ 1/4 cup sugar $ 1/2 cup fresh lemon juice $ 1/4 cup orange juice $ 1/4 teaspoon vanilla extract $ 2 cups fresh blueberries (from three 1/2-pint containers) $ 1 cup water $ 5 tablespoons sugar $ 1 teaspoon fresh lemon juice $ ,Dessert $ Kid-Friendly $ Frozen Dessert $ Blueberry $ Lemon $ Watermelon $ Summer $ Vegan $ Bon Appétit $ Fat Free $ Kidney Friendly $ Vegetarian $ Pescatarian $ Dairy Free $ Wheat/Gluten-Free $ Peanut Free $ Tree Nut Free $ Soy Free $ Kosher $ ,American $ ,2.5/4,3,Dessert $ Kid-Friendly $ Frozen Dessert $ Blueberry $ Lemon $ Watermelon $ Summer $ Vegan $ Bon Appétit $ Fat Free $ Kidney Friendly $ Vegetarian $ Pescatarian $ Dairy Free $ Wheat/Gluten-Free $ Peanut Free $ Tree Nut Free $ Soy Free $ Kosher $ American $ 
https://www.epicurious.com/recipes/food/views/watermelon-sorbet-with-wine-basil-gelee-109666,Watermelon Sorbet with Wine Basil Gelée ,"3/4 cup sugar $ 1/4 cup water $ 1 teaspoon finely grated fresh lemon zest $ 5 cups coarsely chopped seeded watermelon (from a 4-lb piece, rind discarded) $ 2 tablespoons fresh lemon juice, or to taste $ 1/4 cup packed fresh basil leaves $ 1 1/2 cups dry white wine $ 1/2 cup sugar $ 1 teaspoon finely grated fresh lemon zest $ 1/2 cup plus 2 tablespoons water $ 2 teaspoons unflavored gelatin (from 1 envelope) $ 2 tablespoons fresh lemon juice, or to taste $ an ice cream maker $ ",Dessert $ Frozen Dessert $ Lemon $ Watermelon $ Basil $ White Wine $ Summer $ Gourmet $ Fat Free $ Dairy Free $ Wheat/Gluten-Free $ Peanut Free $ Tree Nut Free $ Soy Free $ ,American $ ,2.5/4,8,Dessert $ Frozen Dessert $ Lemon $ Watermelon $ Basil $ White Wine $ Summer $ Gourmet $ Fat Free $ Dairy Free $ Wheat/Gluten-Free $ Peanut Free $ Tree Nut Free $ Soy Free $ American $ 
https://www.epicurious.com/recipes/food/views/grilled-corn-with-smoked-paprika-butter-109709,Grilled Corn with Smoked Paprika Butter ,"1 cup (2 sticks) unsalted butter, room temperature $ 2 teaspoons hot smoked paprika $ 1 garlic clove, chopped $ 1/2 teaspoon sugar $ Pinch of salt $ 20 ears of fresh corn, shucked $ ",Side $ Kid-Friendly $ Corn $ Summer $ Grill/Barbecue $ Bon Appétit $ Vegetarian $ Pescatarian $ Wheat/Gluten-Free $ Peanut Free $ Tree Nut Free $ Soy Free $ Kosher $ ,American $ ,3.5/4,7,Side $ Kid-Friendly $ Corn $ Summer $ Grill/Barbecue $ Bon Appétit $ Vegetarian $ Pescatarian $ Wheat/Gluten-Free $ Peanut Free $ Tree Nut Free $ Soy Free $ Kosher $ American $ 
https://www.epicurious.com/recipes/food/views/rice-with-julienned-carrots-106533,Rice with Julienned Carrots ,"1/2 cup finely chopped onion $ 1 tablespoon unsalted butter $ 1 cup long-grain white rice $ 1 1/2 cups water $ 1/2 teaspoon salt $ 1 medium carrot, cut into 1/8-inch-thick matchsticks $ ",Rice $ Side $ Quick & Easy $ Carrot $ Spring $ Gourmet $ Sugar Conscious $ Vegetarian $ Pescatarian $ Wheat/Gluten-Free $ Peanut Free $ Tree Nut Free $ Soy Free $ No Sugar Added $ Kosher $ ,American $ ,3/4,13,Rice $ Side $ Quick & Easy $ Carrot $ Spring $ Gourmet $ Sugar Conscious $ Vegetarian $ Pescatarian $ Wheat/Gluten-Free $ Peanut Free $ Tree Nut Free $ Soy Free $ No Sugar Added $ Kosher $ American $ 
https://www.epicurious.com/recipes/food/views/cilantro-oil-106608,Cilantro Oil ,"2 cups coarsely chopped fresh cilantro leaves and tender stems $ 3/4 cup olive oil $ 2 green onions, chopped $ 1 medium jalapeño chili with seeds, chopped (about 1 tablespoon) $ 2 garlic cloves, chopped $ 1/4 cup water $ ",Condiment/Spread $ Food Processor $ Garlic $ Onion $ No-Cook $ Quick & Easy $ Summer $ Jalapeño $ Cilantro $ Bon Appétit $ ,American $ ,3/4,9,Condiment/Spread $ Food Processor $ Garlic $ Onion $ No-Cook $ Quick & Easy $ Summer $ Jalapeño $ Cilantro $ Bon Appétit $ American $ 
https://www.epicurious.com/recipes/food/views/fried-chrysanthemum-onions-14940,"Fried ""Chrysanthemum"" Onions ",2 medium onions $ 2 quarts vegetable oil for deep-frying $ 1/3 cup milk $ 1/4 cup all-purpose flour $ 1/2 cup fine dry bread crumbs $ 1 large egg $ ,Onion $ Side $ Fry $ Gourmet $ Vegetarian $ Pescatarian $ Peanut Free $ Tree Nut Free $ Soy Free $ Kosher $ ,American $ ,2/4,1,Onion $ Side $ Fry $ Gourmet $ Vegetarian $ Pescatarian $ Peanut Free $ Tree Nut Free $ Soy Free $ Kosher $ American $ 
https://www.epicurious.com/recipes/food/views/oatmeal-cookies-with-raisins-dates-and-walnuts-108321,"Oatmeal Cookies with Raisins, Dates, and Walnuts ","2 cups all-purpose flour $ 1 teaspoon baking powder $ 1 teaspoon ground cinnamon $ 1/2 teaspoon baking soda $ 1/2 teaspoon salt $ 3/4 cup (1 1/2 sticks) unsalted butter, room temperature $ 1/4 cup solid vegetable shortening, room temperature $ 1 cup sugar $ 1 cup (packed) dark brown sugar $ 1/4 cup honey $ 2 large eggs $ 1 tablespoon vanilla extract $ 3 cups old-fashioned oats $ 1 cup raisins $ 1 cup chopped pitted dates $ 1 cup chopped walnuts $ ",Cookies $ Fruit $ Nut $ Bake $ Raisin $ Date $ Walnut $ Oat $ Bon Appétit $ ,American $ ,3.5/4,111,Cookies $ Fruit $ Nut $ Bake $ Raisin $ Date $ Walnut $ Oat $ Bon Appétit $ American $ 
https://www.epicurious.com/recipes/food/views/fresh-green-peas-and-sugar-snap-peas-in-sesame-dressing-109708,Fresh Green Peas and Sugar Snap Peas in Sesame Dressing ,"3 cups fresh shelled peas (from 3 pounds peas in pods) $ 12 ounces sugar snap peas, trimmed $ 2 tablespoons unseasoned rice vinegar $ 1 tablespoon soy sauce $ 1 tablespoon oriental sesame oil $ 1 tablespoon (packed) golden brown sugar $ 1 teaspoon coarse kosher salt $ 1/2 teaspoon freshly ground black pepper $ ",Side $ Quick & Easy $ Pea $ Summer $ Sugar Snap Pea $ Boil $ Bon Appétit $ Vegan $ Vegetarian $ Pescatarian $ Dairy Free $ Peanut Free $ Tree Nut Free $ Kosher $ ,American $ Asian $ ,3.5/4,28,Side $ Quick & Easy $ Pea $ Summer $ Sugar Snap Pea $ Boil $ Bon Appétit $ Vegan $ Vegetarian $ Pescatarian $ Dairy Free $ Peanut Free $ Tree Nut Free $ Kosher $ American $ Asian $ 
https://www.epicurious.com/recipes/food/views/mojito-marinated-chicken-breasts-109705,Mojito-Marinated Chicken Breasts ,"3/4 cup fresh lime juice $ 1/2 cup plus 2 tablespoons light rum $ 1/2 cup finely chopped fresh mint $ 6 tablespoons mint syrup $ 1 tablespoon vegetable oil $ 1 tablespoon coarse kosher salt $ 6 chicken breast halves with skin and bones (about 5 pounds) $ 3 large limes, quartered lengthwise $ Fresh mint sprigs $ ",Rum $ Chicken $ Marinate $ Low Carb $ Lime $ Mint $ Summer $ Grill/Barbecue $ Bon Appétit $ ,American $ Cuban $ ,3/4,34,Rum $ Chicken $ Marinate $ Low Carb $ Lime $ Mint $ Summer $ Grill/Barbecue $ Bon Appétit $ American $ Cuban $ 
https://www.epicurious.com/recipes/food/views/fillet-of-cod-with-asparagus-and-prosciutto-109377,Fillet of Cod with Asparagus and Prosciutto ,"1 1/2 pounds slender asparagus spears, trimmed to 7-inch lengths $ 2 garlic cloves, minced $ 1 teaspoon salt $ 2 tablespoons (1/4 stick) butter $ 1 tablespoon plus 6 teaspoons olive oil $ 1/3 cup fresh lemon juice $ 1 1/2 teaspoons grated lemon peel $ 1/2 teaspoon ground black pepper $ 6 6-ounce cod fillets, pinbones removed $ 6 ounces paper-thin prosciutto slices, halved lengthwise $ ",Bake $ Quick & Easy $ Lemon $ Cod $ Asparagus $ Prosciutto $ Bon Appétit $ ,American $ ,3/4,55,Bake $ Quick & Easy $ Lemon $ Cod $ Asparagus $ Prosciutto $ Bon Appétit $ American $ 
https://www.epicurious.com/recipes/food/views/potted-crab-109192,Potted Crab ,"1 lb cooked king crab legs in shell, thawed if frozen and shells split lengthwise $ 1/2 lb lump crabmeat, picked over $ 1 stick (1/2 cup) unsalted butter $ 1 tablespoon medium-dry Sherry $ 1 teaspoon finely grated fresh lemon zest $ 1 teaspoon fresh lemon juice $ 1 teaspoon minced shallot $ 1/4 teaspoon ground mace $ 1/4 teaspoon salt $ 1/8 teaspoon black pepper $ Pinch of cayenne $ Accompaniment:Irish brown bread , thinly sliced and toasted $ a 2-cup glass or ceramic dish; or 4 to 6 (4-oz) ramekins $ ",Shellfish $ Cocktail Party $ Quick & Easy $ Lemon $ Crab $ Sherry $ Spring $ Gourmet $ ,American $ ,2.5/4,4,Shellfish $ Cocktail Party $ Quick & Easy $ Lemon $ Crab $ Sherry $ Spring $ Gourmet $ American $ 
https://www.epicurious.com/recipes/food/views/chocolate-chunk-orange-and-hazelnut-cookies-103155,"Chocolate Chunk, Orange and Hazelnut Cookies ","1 1/4 cups all purpose flour $ 1/2 teaspoon baking soda $ 1/8 teaspoon salt $ 3/4 cup (packed) golden brown sugar $ 1/2 cup (1 stick) unsalted butter, room temperature $ 4 teaspoons grated orange peel $ 1 teaspoon vanilla extract $ 1 large egg $ 3 3-ounce bars bittersweet chocolate, cut into 1/3-inch chunks $ 1 1/2 cups hazelnuts (about 6 ounces), toasted, husked, chopped $ ",Cookies $ Mixer $ Chocolate $ Nut $ Dessert $ Bake $ Orange $ Vanilla $ Spring $ Hazelnut $ Bon Appétit $ ,American $ ,3.5/4,31,Cookies $ Mixer $ Chocolate $ Nut $ Dessert $ Bake $ Orange $ Vanilla $ Spring $ Hazelnut $ Bon Appétit $ American $ 
https://www.epicurious.com/recipes/food/views/roast-turkey-with-herb-butter-and-caramelized-onion-balsamic-gravy-100367,Roast Turkey with Herb Butter and Caramelized Onion-Balsamic Gravy ,"1 16- to 18-pound turkey, neck and giblets reserved for gravy $ Fresh rosemary sprigs (optional) $ Fresh sage sprigs (optional) $ 6 tablespoons (3/4 stick) butter $ 3 tablespoons chopped fresh rosemary $ 3 tablespoons chopped fresh sage $ 1 1/2 tablespoons grated orange peel $ 1 tablespoon ground black pepper $ 4 teaspoons salt $ 5 1/2 cups (or more) canned low-salt chicken broth $ 1 onion, quartered $ 1 bay leaf $ 6 tablespoons (3/4 stick) butter $ 2 large onions, halved, thinly sliced $ 1tablespoon plus 1 teaspoon chopped fresh rosemary $ 1 tablespoon plus 1 teaspoon chopped fresh sage $ 1/3 cup all purpose flour $ 1/2 cup balsamic vinegar $ ",Onion $ turkey $ Roast $ Christmas $ Thanksgiving $ Vinegar $ Rosemary $ Fall $ Sage $ Bon Appétit $ ,American $ ,4/4,155,Onion $ turkey $ Roast $ Christmas $ Thanksgiving $ Vinegar $ Rosemary $ Fall $ Sage $ Bon Appétit $ American $ 
https://www.epicurious.com/recipes/food/views/giant-sunday-pancakes-473,Giant Sunday Pancakes ,"3 large eggs $ 1/2 cup sugar $ 6 tablespoons (3/4 stick) butter, melted $ 1 1/2 cups all purpose flour $ 1 cup milk $ 1 tablespoon baking powder $ 1/4 teaspoon salt $ Butter $ Warm maple syrup $ ",Breakfast $ Brunch $ Kid-Friendly $ Quick & Easy $ Mother's Day $ Father's Day $ Spring $ Pan-Fry $ Bon Appétit $ North Carolina $ ,American $ ,3/4,108,Breakfast $ Brunch $ Kid-Friendly $ Quick & Easy $ Mother's Day $ Father's Day $ Spring $ Pan-Fry $ Bon Appétit $ North Carolina $ American $ 
https://www.epicurious.com/recipes/food/views/chocolate-fallen-souffle-cake-109130,Chocolate Fallen Soufflé Cake ,"12 oz fine-quality bittersweet chocolate (not unsweetened), chopped $ 1 1/2 sticks (3/4 cup) unsalted butter, cut into tablespoon pieces $ 1 1/2 teaspoons vanilla $ 1/4 teaspoon salt $ 3/4 cup sugar $ 5 large eggs, separated and at room temperature for 30 minutes $ 1/4 cup all-purpose flour $ Accompaniment: ice cream or lightly sweetened whipped cream $ ",Cake $ Mixer $ Chocolate $ Egg $ Dessert $ Bake $ Quick & Easy $ Vanilla $ Fall $ Winter $ Engagement Party $ Double Boiler $ Gourmet $ Kidney Friendly $ Vegetarian $ Pescatarian $ Peanut Free $ Tree Nut Free $ Soy Free $ Kosher $ ,American $ ,3.5/4,97,Cake $ Mixer $ Chocolate $ Egg $ Dessert $ Bake $ Quick & Easy $ Vanilla $ Fall $ Winter $ Engagement Party $ Double Boiler $ Gourmet $ Kidney Friendly $ Vegetarian $ Pescatarian $ Peanut Free $ Tree Nut Free $ Soy Free $ Kosher $ American $ 
https://www.epicurious.com/recipes/food/views/baked-baby-back-ribs-with-lemon-confit-marinade-109164,Baked Baby Back Ribs with Lemon Confit Marinade ,"4 large lemons $ 8 large garlic cloves, peeled $ 1/4 cup olive oil $ 3 tablespoons chopped fresh thyme $ 3 tablespoons (scant) coarsely chopped fresh rosemary $ 2 tablespoons fennel seeds, ground $ 2 tablespoons coarse kosher salt $ 1 tablespoon freshly ground black pepper $ 1 tablespoon (packed) golden brown sugar $ 5 pounds meaty baby back pork ribs (about 4 large racks) $ ",Beef $ Citrus $ Bake $ Marinate $ Quick & Easy $ Pork Rib $ Winter $ Thyme $ Potluck $ Bon Appétit $ ,American $ ,3.5/4,13,Beef $ Citrus $ Bake $ Marinate $ Quick & Easy $ Pork Rib $ Winter $ Thyme $ Potluck $ Bon Appétit $ American $ 
https://www.epicurious.com/recipes/food/views/chicken-breasts-with-citrus-pan-sauce-109393,Chicken Breasts with Citrus Pan Sauce ,"4 bone-in chicken breast halves with skin $ 5 teaspoons ground cumin, divided $ 4 tablespoons olive oil, divided $ 2 garlic cloves, pressed $ 1/2 cup chicken broth $ 1/2 cup orange juice $ 1/4 cup fresh lemon juice $ 2 teaspoons grated orange peel $ 1 1/2 teaspoons grated lemon peel $ 1/3 cup chopped fresh cilantro $ ",Chicken $ Roast $ Sauté $ Quick & Easy $ Lemon $ Orange $ Spring $ Cilantro $ Bon Appétit $ ,American $ ,3/4,62,Chicken $ Roast $ Sauté $ Quick & Easy $ Lemon $ Orange $ Spring $ Cilantro $ Bon Appétit $ American $ 
https://www.epicurious.com/recipes/food/views/salmon-club-sandwich-103614,Salmon Club Sandwich ,"6 tablespoons mayonnaise $ 5 tablespoons minced fresh basil $ 1 teaspoon grated lemon peel $ 3 tablespoons olive oil $ 1 tablespoon fresh lemon juice $ 4 5- to 6-ounce skinless salmon fillets (each about 3/4 inch thick) $ 8 bacon slices $ 1 small red onion, sliced $ 8 1/2-inch-thick sourdough or country-style white bread slices (each about 5x3 inches) $ 8 tomato slices $ 8 lettuce leaves $ ",Sandwich $ Fish $ Backyard BBQ $ Lunch $ Mayonnaise $ Basil $ Bacon $ Salmon $ Summer $ Grill $ Grill/Barbecue $ Bon Appétit $ ,American $ ,3.5/4,31,Sandwich $ Fish $ Backyard BBQ $ Lunch $ Mayonnaise $ Basil $ Bacon $ Salmon $ Summer $ Grill $ Grill/Barbecue $ Bon Appétit $ American $ 
https://www.epicurious.com/recipes/food/views/rutabaga-and-carrot-puree-104253,Rutabaga and Carrot Purée ,"2 rutabagas (2 1/2 pounds total), peeled and cut into 1-inch pieces $ 5 carrots, cut into 1-inch pieces $ 3 tablespoons unsalted butter $ 3 tablespoons packed light brown sugar $ 1 teaspoon kosher salt $ ",Food Processor $ Side $ Thanksgiving $ Vegetarian $ Quick & Easy $ Root Vegetable $ Carrot $ Fall $ Rutabaga $ Gourmet $ Pescatarian $ Wheat/Gluten-Free $ Peanut Free $ Tree Nut Free $ Soy Free $ Kosher $ ,American $ ,4/4,38,Food Processor $ Side $ Thanksgiving $ Vegetarian $ Quick & Easy $ Root Vegetable $ Carrot $ Fall $ Rutabaga $ Gourmet $ Pescatarian $ Wheat/Gluten-Free $ Peanut Free $ Tree Nut Free $ Soy Free $ Kosher $ American $ 
https://www.epicurious.com/recipes/food/views/overnight-french-toast-2083,Overnight French Toast ,"1/4 cup (1/2 stick) butter, room temperature $ 12 3/4-inch-thick French bread slices $ 6 eggs $ 1 1/2 cups milk $ 1/4 cup sugar $ 2 tablespoons maple syrup $ 1 teaspoon vanilla $ 1/2 teaspoon salt $ Powdered sugar $ 2 cups maple syrup $ 1 cup chopped walnuts, toasted $ ",Egg $ Breakfast $ Brunch $ Bake $ Bon Appétit $ Portland $ Oregon $ Vegetarian $ Pescatarian $ Peanut Free $ Soy Free $ Kosher $ ,American $ ,3.5/4,140,Egg $ Breakfast $ Brunch $ Bake $ Bon Appétit $ Portland $ Oregon $ Vegetarian $ Pescatarian $ Peanut Free $ Soy Free $ Kosher $ American $ 
https://www.epicurious.com/recipes/food/views/blue-cheese-burgers-with-green-peppercorns-32,Blue Cheese Burgers with Green Peppercorns ,"10 to 12 ounces lean ground beef $ 1 tablespoon Dijon mustard $ 1 green onion, minced $ 2 teaspoons green peppercorns, chopped $ 1 garlic clove, pressed $ 1 1/2 ounces blue cheese, crumbled $ ",Beef $ Broil $ Fourth of July $ Quick & Easy $ Blue Cheese $ Summer $ Bon Appétit $ ,American $ ,3.5/4,14,Beef $ Broil $ Fourth of July $ Quick & Easy $ Blue Cheese $ Summer $ Bon Appétit $ American $ 
https://www.epicurious.com/recipes/food/views/veal-rib-chops-with-caramelized-fennel-and-figs-104496,Veal Rib Chops with Caramelized Fennel and Figs ,"1 3/4 cups canned low-salt chicken broth $ 2 medium fennel bulbs with fronds (about 12 ounces), trimmed, bulbs halved lengthwise, fronds chopped $ 12 dried black Mission figs $ 6 tablespoons unsalted butter $ 1 teaspoon sugar $ 1/4 teaspoon pumpkin pie spice $ 1/2 cup canned beef broth $ 2 tablespoons minced shallot $ 1 cup tawny Port $ 2 8-ounce veal rib chops (each about 1 1/4 inches thick) $ ",Beef $ Vegetable $ Roast $ Sauté $ Christmas $ Fig $ Veal $ Fennel $ Port $ Winter $ Bon Appétit $ ,American $ ,3.5/4,13,Beef $ Vegetable $ Roast $ Sauté $ Christmas $ Fig $ Veal $ Fennel $ Port $ Winter $ Bon Appétit $ American $ 
https://www.epicurious.com/recipes/food/views/roast-chicken-breasts-with-parsley-pan-gravy-104719,Roast Chicken Breasts with Parsley Pan Gravy ,"2 chicken breast halves (with skin and bones; about 20 ounces) $ 1 1/2 teaspoons poultry seasoning $ 1 tablespoon butter, cut into small pieces $ 1 tablespoon all purpose flour $ 1/3 cup canned low-salt chicken broth $ 1/4 cup chopped fresh parsley $ ",Chicken $ Herb $ Poultry $ Roast $ Dinner $ Fall $ Spring $ Winter $ Anniversary $ Parsley $ Bon Appétit $ Sugar Conscious $ Peanut Free $ Tree Nut Free $ Soy Free $ No Sugar Added $ ,American $ ,3.5/4,74,Chicken $ Herb $ Poultry $ Roast $ Dinner $ Fall $ Spring $ Winter $ Anniversary $ Parsley $ Bon Appétit $ Sugar Conscious $ Peanut Free $ Tree Nut Free $ Soy Free $ No Sugar Added $ American $ 
https://www.epicurious.com/recipes/food/views/broiled-brown-sugar-apples-with-bacon-12407,Broiled Brown-Sugar Apples with Bacon ,"2 McIntosh apples (about 3/4 pound total) $ 3 tablespoons packed light brown sugar $ 1/4 pound sliced bacon, cooked until crisp and chopped $ ",Fruit $ Breakfast $ Brunch $ Side $ Broil $ Kid-Friendly $ Apple $ Bacon $ Fall $ Gourmet $ Dairy Free $ Wheat/Gluten-Free $ Peanut Free $ Tree Nut Free $ Soy Free $ ,American $ ,3/4,2,Fruit $ Breakfast $ Brunch $ Side $ Broil $ Kid-Friendly $ Apple $ Bacon $ Fall $ Gourmet $ Dairy Free $ Wheat/Gluten-Free $ Peanut Free $ Tree Nut Free $ Soy Free $ American $ 
https://www.epicurious.com/recipes/food/views/molasses-barbecue-sauce-5423,Molasses Barbecue Sauce ,3 cups chicken stock or canned low-salt chicken broth $ 1 cup dry white wine $ 1/4 cup apple cider vinegar $ 1/4 cup mild-flavored (light) molasses $ 1/4 cup chopped fresh tomato $ 3 tablespoons minced shallots $ 2 tablespoons chopped pitted dates $ 1 tablespoon chopped garlic $ 1/2 teaspoon dried crushed red pepper $ ,Sauce $ Backyard BBQ $ White Wine $ Summer $ Molasses $ Boil $ Bon Appétit $ ,American $ ,3.5/4,8,Sauce $ Backyard BBQ $ White Wine $ Summer $ Molasses $ Boil $ Bon Appétit $ American $ 
https://www.epicurious.com/recipes/food/views/meat-loaf-plus-1458,Meat Loaf Plus ,"1 pound plus 2 ounces ground beef $ 1 cup herbed seasoned stuffing $ 2 eggs, beaten to blend $ 1/2 cup dry red wine $ 10 pimiento-stuffed olives, chopped $ 3 tablespoons minced fresh parsley $ 1 envelope onion soup mix $ 2 garlic cloves, minced $ Salt and pepper $ ",Beef $ Olive $ Bake $ Ground Beef $ Spring $ Winter $ Potluck $ Bon Appétit $ ,American $ ,2.5/4,11,Beef $ Olive $ Bake $ Ground Beef $ Spring $ Winter $ Potluck $ Bon Appétit $ American $ 
https://www.epicurious.com/recipes/food/views/lemon-layer-cake-with-lemon-cream-frosting-104576,Lemon Layer Cake with Lemon Cream Frosting ,"2 cups sifted cake flour (not self-rising; sift before measuring) $ 3/4 teaspoon baking soda $ 1/4 teaspoon salt $ 1/2 cup whole milk $ 2 1/2 tablespoons fresh lemon juice $ 1 stick (1/2 cup) unsalted butter, softened $ 1 cup granulated sugar $ 2 large eggs $ 1 cup heavy cream $ 1/2 cup confectioners sugar $ Lemon curd , chilled $ Garnish: candied violets $ ",Cake $ Milk/Cream $ Dessert $ Bake $ Lemon $ Gourmet $ Kidney Friendly $ Vegetarian $ Pescatarian $ Peanut Free $ Tree Nut Free $ Soy Free $ Kosher $ ,American $ ,3/4,86,Cake $ Milk/Cream $ Dessert $ Bake $ Lemon $ Gourmet $ Kidney Friendly $ Vegetarian $ Pescatarian $ Peanut Free $ Tree Nut Free $ Soy Free $ Kosher $ American $ 
https://www.epicurious.com/recipes/food/views/parmesan-roasted-potatoes-104403,Parmesan Roasted Potatoes ,"1/2 cup finely grated parmesan (1 1/2 ounces) $ 1/2 cup all-purpose flour $ 1 teaspoon salt $ 1/4 teaspoon black pepper $ 8 large boiling potatoes (3 1/2 pounds), peeled and quartered lengthwise $ 1 stick (1/2 cup) unsalted butter, melted $ ",Potato $ Side $ Roast $ Parmesan $ Gourmet $ Sugar Conscious $ Vegetarian $ Pescatarian $ Peanut Free $ Tree Nut Free $ Soy Free $ No Sugar Added $ Kosher $ ,American $ ,3/4,36,Potato $ Side $ Roast $ Parmesan $ Gourmet $ Sugar Conscious $ Vegetarian $ Pescatarian $ Peanut Free $ Tree Nut Free $ Soy Free $ No Sugar Added $ Kosher $ American $ 
https://www.epicurious.com/recipes/food/views/cranberry-jam-104409,Cranberry Jam ,"1 vanilla bean, halved lengthwise $ 1 (12-oz) bag fresh or unthawed frozen cranberries (3 1/2 cups) $ 1 1/2 cups sugar $ 1/2 cup fresh orange juice $ 1/2 cup water $ a food mill fitted with fine disk $ ",Condiment/Spread $ Sauce $ Fruit Juice $ Cranberry $ Orange $ Winter $ Gourmet $ ,American $ ,3.5/4,10,Condiment/Spread $ Sauce $ Fruit Juice $ Cranberry $ Orange $ Winter $ Gourmet $ American $ 
