link,name,ingredients,recipe_category,recipe_cuisine,rating,rating_count,keywords
https://www.epicurious.com/recipes/food/views/sour-cherry-chocolate-mousse-cake-234337,Sour Cherry Chocolate Mousse Cake ,"3/4 cup sour cherry jam or preserves $ 1 tablespoon balsamic vinegar $ 2 tablespoons calvados (or other type of brandy) $ 2 tablespoons hazelnuts, toasted and skins rubbed off $ 3 tablespoons sugar $ 1/2 cup all-purpose flour $ 1/2 stick (1/4 cup) unsalted butter, softened $ 2 tablespoons unsweetened Dutch-process cocoa powder $ 1/8 teaspoon salt $ 1 teaspoon unflavored gelatin (from a 1/4-oz envelope) $ 3 tablespoons cold water $ 1/2 cup chocolate hazelnut spread such as Nutella (5 oz) $ 1/2 cup mascarpone (1/4 lb) $ 1 1/2 cups chilled heavy cream $ 2 tablespoons unsweetened Dutch-process cocoa powder $ 3 tablespoons sugar $ 1/4 cup plus 1 tablespoon heavy cream $ 3 1/2 oz fine-quality bittersweet chocolate (not unsweetened), chopped $ an 8-inch (20-cm) springform pan; parchment paper $ ",Cake $ Cookies $ Berry $ Chocolate $ Dessert $ Bake $ Quick & Easy $ Cherry $ Fall $ Edible Gift $ Hazelnut $ Jam or Jelly $ Gourmet $ Peanut Free $ Soy Free $ ,American $ ,4/4,10,Cake $ Cookies $ Berry $ Chocolate $ Dessert $ Bake $ Quick & Easy $ Cherry $ Fall $ Edible Gift $ Hazelnut $ Jam or Jelly $ Gourmet $ Peanut Free $ Soy Free $ American $ 
https://www.epicurious.com/recipes/food/views/black-and-tans-233822,Black and Tans ,"1 1/4 cups all-purpose flour $ 1/2 teaspoon baking soda $ 1/2 teaspoon salt $ 1/3 cup well-shaken buttermilk $ 1/2 teaspoon vanilla $ 7 tablespoons unsalted butter, softened $ 1/2 cup granulated sugar $ 1 large egg $ 1/4 cup creamy peanut butter $ 2 1/2 tablespoons unsalted butter $ 1 1/2 cups confectioners' sugar, sifted $ 1/4 cup half and half $ 1/4 cup unsweetened Dutch process cocoa such as Periginotti $ 2 1/2 tablespoons unsalted butter $ 1 1/2 cups confectioners' sugar, sifted $ 1/4 cup half and half $ a small offset spatula $ ",Cookies $ Milk/Cream $ Chocolate $ Dessert $ Bake $ Kid-Friendly $ Peanut $ Gourmet $ Kidney Friendly $ Vegetarian $ Pescatarian $ Tree Nut Free $ Soy Free $ Kosher $ ,American $ ,3.5/4,6,Cookies $ Milk/Cream $ Chocolate $ Dessert $ Bake $ Kid-Friendly $ Peanut $ Gourmet $ Kidney Friendly $ Vegetarian $ Pescatarian $ Tree Nut Free $ Soy Free $ Kosher $ American $ 
https://www.epicurious.com/recipes/food/views/hunter-style-grillades-233321,Hunter-Style Grillades ,"1 1/2 pounds beef top-round steak (1/2-inch thick) $ 1 pound veal top-round steak (1/2-inch thick) $ 1/2 cup all-purpose flour $ Kosher salt $ Freshly ground black pepper $ 1/4 cup olive oil $ 2 cups chopped onion (1 large) $ 1 cup chopped red bell pepper (from 1 large) $ 1 cup chopped celery (about 2 ribs) $ 1 pound fresh crimini (or baby bella) mushrooms, quartered $ 1 1/2 cups (from a 28-ounce can) drained canned tomatoes, chopped $ 1 tablespoon chopped garlic $ 2 bay leaves $ 2 tablespoons fresh thyme leaves, minced $ 1 tablespoon fresh rosemary leaves, minced $ 1 teaspoon kosher salt $ 1/4 teaspoon cayenne $ 1/8 teaspoon black pepper $ 2 cups beef broth (homemade or canned) $ 1/2 cup dry red wine $ 1 tablespoon balsamic vinegar (optional) $ 2 tablespoons chopped fresh parsley $ ",Beef $ Mushroom $ Onion $ Tomato $ Braise $ Rosemary $ Veal $ Bell Pepper $ Red Wine $ Winter $ Thyme $ Gourmet $ ,American $ ,3.5/4,12,Beef $ Mushroom $ Onion $ Tomato $ Braise $ Rosemary $ Veal $ Bell Pepper $ Red Wine $ Winter $ Thyme $ Gourmet $ American $ 
https://www.epicurious.com/recipes/food/views/chocolate-lovers-butterscotch-chiffon-tart-234017,Chocolate Lovers' Butterscotch Chiffon Tart ,"1 1/4 cups all-purpose flour $ 1/4 cup unsweetened cocoa powder $ 1/4 teaspoon salt $ 1 stick (8 tablespoons) cold unsalted butter, cut into 1/2-inch cubes $ 3/4 cup powdered sugar $ 1 large egg, beaten $ 3 tablespoons light corn syrup $ 3/4 cup plus 1 tablespoon sugar $ 1/4 cup water $ 1/2 stick (1/4 cup) unsalted butter $ 1 teaspoon cider vinegar $ 1 1/3 cups chilled heavy cream $ 1 1/2 teaspoons vanilla $ 2 teaspoons unflavored gelatin (from 1 envelope) $ 3 large egg whites $ 1 cup chopped pecans (3 1/2 ounces) $ 1 tablespoon unsalted butter $ 1/8 teaspoon salt $ a 9-inch tart pan (1 inch deep) with a removable bottom; pie weights or raw rice (optional); a pastry or bench scraper (optional) $ ",Milk/Cream $ Chocolate $ Egg $ Dessert $ Bake $ Christmas $ Thanksgiving $ Vinegar $ Pecan $ Fall $ Winter $ Gourmet $ Kidney Friendly $ Peanut Free $ Soy Free $ ,American $ ,3/4,1,Milk/Cream $ Chocolate $ Egg $ Dessert $ Bake $ Christmas $ Thanksgiving $ Vinegar $ Pecan $ Fall $ Winter $ Gourmet $ Kidney Friendly $ Peanut Free $ Soy Free $ American $ 
https://www.epicurious.com/recipes/food/views/strawberry-coulis-234239,Strawberry Coulis ,1 cup frozen unsweetened strawberries $ 1/2 cup sugar $ 1 tablespoon lemon juice $ ,Blender $ Food Processor $ Berry $ Citrus $ Dessert $ Easter $ Low Fat $ Quick & Easy $ Strawberry $ Spring $ Vegan $ Fat Free $ Kidney Friendly $ Vegetarian $ Pescatarian $ Dairy Free $ Wheat/Gluten-Free $ Peanut Free $ Tree Nut Free $ Soy Free $ Kosher $ ,American $ ,3/4,6,Blender $ Food Processor $ Berry $ Citrus $ Dessert $ Easter $ Low Fat $ Quick & Easy $ Strawberry $ Spring $ Vegan $ Fat Free $ Kidney Friendly $ Vegetarian $ Pescatarian $ Dairy Free $ Wheat/Gluten-Free $ Peanut Free $ Tree Nut Free $ Soy Free $ Kosher $ American $ 
https://www.epicurious.com/recipes/food/views/pound-cake-squares-with-berries-234861,Pound Cake Squares with Berries ,"2 boxes pound cake mix $ 6 tablespoons butter, melted $ 3 cups whipping cream $ 1 cup sugar $ 2 cups mixed berries (we used strawberries, raspberries, and blueberries) $ ",Cake $ Milk/Cream $ Mixer $ Berry $ Dessert $ Bake $ Broil $ Kid-Friendly $ Wedding $ Kidney Friendly $ Vegetarian $ Pescatarian $ Peanut Free $ Tree Nut Free $ Soy Free $ Kosher $ ,American $ ,3/4,1,Cake $ Milk/Cream $ Mixer $ Berry $ Dessert $ Bake $ Broil $ Kid-Friendly $ Wedding $ Kidney Friendly $ Vegetarian $ Pescatarian $ Peanut Free $ Tree Nut Free $ Soy Free $ Kosher $ American $ 
https://www.epicurious.com/recipes/food/views/chocolate-cake-with-raspberry-filling-234086,Chocolate Cake with Raspberry Filling ,"1 1/4 cups all-purpose flour $ 1/3 cup cocoa $ 3/4 cup sugar $ 1 teaspoon baking powder $ 1 teaspoon baking soda $ Pinch salt $ 1/2 cup buttermilk $ 1 4-ounce jar baby food carrot puree $ 1 4-ounce jar baby food prune puree $ 1 tablespoon pure vanilla extract $ 1 tablespoon pure almond extract $ 2 tablespoons brewed coffee $ 1 whole egg $ 1 egg white $ 1 1-ounce square unsweetened baking chocolate, melted $ 1/4 cup semi-sweet chocolate chips $ 1/4 cup nonfat fudge sauce $ 1/2 cup raspberry all-fruit preserves $ 1/4 cup nonfat fudge sauce $ ",Coffee $ Berry $ Chocolate $ Dessert $ Bake $ Low Fat $ Quick & Easy $ Low Cal $ Back to School $ Raspberry $ Prune $ Vanilla $ Carrot $ Fall $ Healthy $ Kidney Friendly $ Vegetarian $ Pescatarian $ Peanut Free $ Soy Free $ Kosher $ ,American $ ,3.5/4,10,Coffee $ Berry $ Chocolate $ Dessert $ Bake $ Low Fat $ Quick & Easy $ Low Cal $ Back to School $ Raspberry $ Prune $ Vanilla $ Carrot $ Fall $ Healthy $ Kidney Friendly $ Vegetarian $ Pescatarian $ Peanut Free $ Soy Free $ Kosher $ American $ 
https://www.epicurious.com/recipes/food/views/corn-soup-with-sauteed-scallops-and-bacon-234219,Corn Soup with Sautéed Scallops and Bacon ,"6 ears corn $ 4 cups water (reserve water after the corn has cooked) $ 2 tsp olive oil for vegetables $ 2 medium yellow onions, chopped $ 3 cloves garlic, minced $ 1 jalapeño pepper, seeded and minced $ Juice of half a lime $ Clam broth, to taste $ 2 slices bacon $ 6 large sea scallops, quartered $ Salt and freshly ground black pepper $ 1 tbsp chopped cilantro or basil $ ",Blender $ Pork $ Shellfish $ Vegetable $ Side $ Sauté $ Quick & Easy $ Bacon $ Scallop $ Corn $ Fall $ Simmer $ Boil $ Dairy Free $ Wheat/Gluten-Free $ Peanut Free $ Tree Nut Free $ Soy Free $ No Sugar Added $ ,American $ ,2.5/4,2,Blender $ Pork $ Shellfish $ Vegetable $ Side $ Sauté $ Quick & Easy $ Bacon $ Scallop $ Corn $ Fall $ Simmer $ Boil $ Dairy Free $ Wheat/Gluten-Free $ Peanut Free $ Tree Nut Free $ Soy Free $ No Sugar Added $ American $ 
https://www.epicurious.com/recipes/food/views/my-homemade-potato-chips-234557,My Homemade Potato Chips ,"2 medium Yukon Gold or Idaho potatoes, peeled and sliced into 1/8-inch slices on a mandoline or other handheld slicer $ 3 tablespoons olive, canola, or peanut oil $ N/A Salt $ N/A freshly ground pepper $ ",Potato $ Appetizer $ Bake $ Kid-Friendly $ Quick & Easy $ Sugar Conscious $ Vegan $ Vegetarian $ Pescatarian $ Dairy Free $ Wheat/Gluten-Free $ Tree Nut Free $ Soy Free $ No Sugar Added $ Kosher $ ,American $ ,3/4,20,Potato $ Appetizer $ Bake $ Kid-Friendly $ Quick & Easy $ Sugar Conscious $ Vegan $ Vegetarian $ Pescatarian $ Dairy Free $ Wheat/Gluten-Free $ Tree Nut Free $ Soy Free $ No Sugar Added $ Kosher $ American $ 
https://www.epicurious.com/recipes/food/views/warm-berry-and-mango-gratin-in-mascarpone-chantilly-234562,Warm Berry and Mango Gratin in Mascarpone Chantilly ,"1 cup milk $ 1 egg $ 1 egg yolk $ 2 tablespoons flour $ 2 tablespoons sugar $ Half a fresh vanilla bean, scraped, or 1/4 teaspoon vanilla extract $ 1 recipe Pastry Cream (see above) $ 1 cup mascarpone cheese, at room temperature $ 1/2 cup heavy cream, whipped to soft peaks $ 1 pint each: raspberries, blackberries, and blueberries $ 1 ripe mango, peeled and cut into 1/2-inch dice $ ",Milk/Cream $ Berry $ Egg $ Dessert $ Bake $ Casserole/Gratin $ Mango $ Vanilla $ Spring $ Vegetarian $ Pescatarian $ Peanut Free $ Tree Nut Free $ Soy Free $ Kosher $ ,American $ ,2/4,4,Milk/Cream $ Berry $ Egg $ Dessert $ Bake $ Casserole/Gratin $ Mango $ Vanilla $ Spring $ Vegetarian $ Pescatarian $ Peanut Free $ Tree Nut Free $ Soy Free $ Kosher $ American $ 
https://www.epicurious.com/recipes/food/views/farfalle-with-tomatoes-and-feta-cheese-234240,Farfalle with Tomatoes and Feta Cheese ,"1 1/2 pounds farfalle or bow tie pasta $ 6 roma tomatoes, seeded and diced $ 1/2 cup calamata olives, pitted $ 1/3 cup diced red onion $ 4 teaspoons drained capers $ 3 ounces feta cheese, crumbled $ 10 basil leaves, julienned $ Balsamic Vinaigrette $ ",Cheese $ Herb $ Olive $ Pasta $ Tomato $ Easter $ Vegetarian $ Quick & Easy $ Spring $ Boil $ ,American $ Italian $ ,3.5/4,16,Cheese $ Herb $ Olive $ Pasta $ Tomato $ Easter $ Vegetarian $ Quick & Easy $ Spring $ Boil $ American $ Italian $ 
https://www.epicurious.com/recipes/food/views/grilled-oysters-with-mango-pico-de-gallo-and-red-chile-horseradish-234842,Grilled Oysters with Mango Pico de Gallo and Red Chile Horseradish ,"1 ripe mango, peeled, pitted, and finely diced $ 1/2 small red onion, finely diced $ 1 jalapeño chile, finely diced $ Juice of 1 lime $ 2 tablespoons olive oil $ 1 tablespoon finely chopped fresh cilantro leaves $ 2 teaspoons honey $ 1/4 teaspoon kosher salt $ 1/4 teaspoon freshly ground black pepper $ 1/4 cup prepared horseradish, drained $ 1 tablespoon ancho chile powder $ 32 oysters, such as Blue Point or Malpeque, scrubbed $ ",Onion $ Horseradish $ Mango $ Oyster $ Summer $ Grill/Barbecue $ Jalapeño $ ,American $ ,4/4,11,Onion $ Horseradish $ Mango $ Oyster $ Summer $ Grill/Barbecue $ Jalapeño $ American $ 
https://www.epicurious.com/recipes/food/views/garlic-mustard-grilled-beef-skewers-234837,Garlic-Mustard-Grilled Beef Skewers ,"1/4 cup whole grain mustard $ 2 tablespoons Dijon mustard $ 4 cloves garlic, finely chopped $ 2 tablespoons white wine vinegar $ 1 tablespoon low-sodium soy sauce $ 1 tablespoon honey $ 1 tablespoon finely chopped fresh rosemary leaves $ 2 teaspoons Spanish paprika $ 1/4 teaspoon kosher salt $ 1/4 teaspoon freshly ground black pepper $ 2 pounds beef tenderloin $ Twelve 6-inch wooden skewers, soaked in cold water for 30 minutes $ ",Garlic $ Mustard $ Marinate $ Low Carb $ Beef Tenderloin $ Summer $ Grill/Barbecue $ ,American $ ,3.5/4,45,Garlic $ Mustard $ Marinate $ Low Carb $ Beef Tenderloin $ Summer $ Grill/Barbecue $ American $ 
https://www.epicurious.com/recipes/food/views/balsamic-vinaigrette-234241,Balsamic Vinaigrette ,"3 tablespoons balsamic vinegar $ 1 tablespoon Dijon mustard $ 1 garlic clove, minced $ 1/2 cup olive oil $ Salt and freshly ground pepper $ N/A freshly ground pepper $ ",Garlic $ Mustard $ No-Cook $ Easter $ Quick & Easy $ Salad Dressing $ Vinegar $ Spring $ ,American $ ,4/4,58,Garlic $ Mustard $ No-Cook $ Easter $ Quick & Easy $ Salad Dressing $ Vinegar $ Spring $ American $ 
https://www.epicurious.com/recipes/food/views/pimento-cheese-bites-with-cream-of-tomato-dip-234197,Pimento Cheese Bites with Cream of Tomato Dip ,"1 tablespoon extra-virgin olive oil $ 1/2 cup diced onion $ 1 large shallot, minced $ 1 teaspoon kosher salt $ 1 can (28-ounce) can whole tomatoes in juice, chopped (retain juice) $ 1 tablespoon tomato paste $ 1 cup vegetable broth $ 1 bay leaf $ 1/4 cup chopped fresh basil $ 1/2 teaspoon dried thyme leaves or 1 teaspoon fresh $ 2 tablespoons white rice flour $ 1 cup plain soymilk $ 1/4 cup soymilk creamer $ 1 teaspoon sugar, optional $ Freshly ground black pepper to taste $ 1 cup grated soy or dairy cheddar cheese $ 2 tablespoons vegan or light mayonnaise $ 2 tablespoons chopped green onion $ 1/4 cup diced pimentos, drained $ 1 tablespoon chopped green olives $ 1/8 teaspoon kosher salt $ 1/8 teaspoon freshly ground black pepper $ 1/4 teaspoon hot red pepper sauce $ 6 slices spelt, whole-wheat, or sliced sourdough bread $ Canola cooking spray, olive oil, or 1 tablespoon unsalted butter $ ",Blender $ Cheese $ Soy $ Tomato $ Appetizer $ Cocktail Party $ Vegetarian $ Low Sodium $ Low/No Sugar $ Oscars $ Pescatarian $ Peanut Free $ Tree Nut Free $ Kosher $ ,American $ ,3/4,5,Blender $ Cheese $ Soy $ Tomato $ Appetizer $ Cocktail Party $ Vegetarian $ Low Sodium $ Low/No Sugar $ Oscars $ Pescatarian $ Peanut Free $ Tree Nut Free $ Kosher $ American $ 
https://www.epicurious.com/recipes/food/views/chocolate-mousse-with-raspberries-234862,Chocolate Mousse with Raspberries ,"32 ounces fresh whipping cream $ 1 cup sugar $ Two 4-ounce packages instant chocolate pudding mix $ 2 pints fresh raspberries, rinsed $ 20 small dessert goblets $ ",Milk/Cream $ Mixer $ Chocolate $ Dessert $ No-Cook $ Quick & Easy $ Wedding $ Raspberry $ Kidney Friendly $ Vegetarian $ Pescatarian $ Wheat/Gluten-Free $ Peanut Free $ Tree Nut Free $ Soy Free $ Kosher $ ,American $ ,3.5/4,2,Milk/Cream $ Mixer $ Chocolate $ Dessert $ No-Cook $ Quick & Easy $ Wedding $ Raspberry $ Kidney Friendly $ Vegetarian $ Pescatarian $ Wheat/Gluten-Free $ Peanut Free $ Tree Nut Free $ Soy Free $ Kosher $ American $ 
https://www.epicurious.com/recipes/food/views/seasonal-country-salad-with-spiced-walnuts-234558,Seasonal Country Salad with Spiced Walnuts ,"2/3 cup sugar $ 1 tablespoon ground star anise $ 2 tablespoons ground coriander seed $ 1/2 teaspoon cayenne $ Salt $ 2 cups shelled walnut halves $ 1 pound mixed lettuces, washed and dried $ 1/4 cup Aged Sherry-Walnut Vinaigrette $ ",Salad $ Appetizer $ Bake $ Quick & Easy $ Walnut $ Spring $ Anise $ Lettuce $ Coriander $ Kidney Friendly $ Vegan $ Vegetarian $ Pescatarian $ Dairy Free $ Wheat/Gluten-Free $ Peanut Free $ Soy Free $ Kosher $ ,American $ ,3/4,6,Salad $ Appetizer $ Bake $ Quick & Easy $ Walnut $ Spring $ Anise $ Lettuce $ Coriander $ Kidney Friendly $ Vegan $ Vegetarian $ Pescatarian $ Dairy Free $ Wheat/Gluten-Free $ Peanut Free $ Soy Free $ Kosher $ American $ 
https://www.epicurious.com/recipes/food/views/twinkie-milkshake-234517,Twinkie Milkshake ,"2 Twinkies $ 2 scoops chocolate ice cream $ 1 cup milk $ Whipped cream, for topping $ ",Milk/Cream $ Blender $ Chocolate $ Dessert $ No-Cook $ Kid-Friendly $ Quick & Easy $ ,American $ ,1.5/4,5,Milk/Cream $ Blender $ Chocolate $ Dessert $ No-Cook $ Kid-Friendly $ Quick & Easy $ American $ 
https://www.epicurious.com/recipes/food/views/pretty-petal-punch-234863,Pretty Petal Punch ,"One 64-ounce carton guava juice $ One 2-liter bottle ginger ale $ Ice cube or shaped mold, like a heart or ring $ Pink rose petals $ ",Fruit Juice $ Punch $ Non-Alcoholic $ Dessert $ No-Cook $ Summer $ Guava $ Drink $ ,American $ ,2.5/4,4,Fruit Juice $ Punch $ Non-Alcoholic $ Dessert $ No-Cook $ Summer $ Guava $ Drink $ American $ 
https://www.epicurious.com/recipes/food/views/oatmeal-chocolate-chip-and-pecan-cookies-234563,"Oatmeal, Chocolate Chip, and Pecan Cookies ","8 tablespoons unsalted butter, at room temperature $ 3/4 cup sugar $ 1 cup light brown sugar, firmly packed $ 1 teaspoon salt $ 1 teaspoon vanilla extract $ 2 large eggs $ 1 1/2 cups flour $ 1 teaspoon baking soda $ 1/2 teaspoon ground cinnamon $ 1/4 teaspoon ground nutmeg $ 1/8 teaspoon ground clove $ 1 cup quick-cooking oats $ 2 cups chopped pecans $ 2 teaspoons freshly grated orange zest $ 12 ounces semisweet chocolate chips $ ",Cookies $ Chocolate $ Dessert $ Bake $ Kid-Friendly $ Pecan $ Oat $ Kidney Friendly $ Vegetarian $ Pescatarian $ Peanut Free $ Soy Free $ Kosher $ ,American $ ,3.5/4,94,Cookies $ Chocolate $ Dessert $ Bake $ Kid-Friendly $ Pecan $ Oat $ Kidney Friendly $ Vegetarian $ Pescatarian $ Peanut Free $ Soy Free $ Kosher $ American $ 
https://www.epicurious.com/recipes/food/views/meringues-234238,Meringues ,1 cup granulated sugar $ 1 cup superfine sugar $ 8 egg whites $ 1/4 teaspoon cream of tartar $ 1/4 teaspoon salt $ 1 teaspoon vanilla or almond extract $ ,Mixer $ Egg $ Dessert $ Bake $ Easter $ Low Fat $ Vanilla $ Spring $ Fat Free $ Kidney Friendly $ Vegetarian $ Pescatarian $ Dairy Free $ Wheat/Gluten-Free $ Peanut Free $ Soy Free $ Kosher $ ,American $ ,4/4,13,Mixer $ Egg $ Dessert $ Bake $ Easter $ Low Fat $ Vanilla $ Spring $ Fat Free $ Kidney Friendly $ Vegetarian $ Pescatarian $ Dairy Free $ Wheat/Gluten-Free $ Peanut Free $ Soy Free $ Kosher $ American $ 
https://www.epicurious.com/recipes/food/views/grilled-pineapple-with-butter-rum-glaze-and-vanilla-mascarpone-234841,Grilled Pineapple with Butter-Rum Glaze and Vanilla Mascarpone ,"1 cup dark rum $ 12 tablespoons (1 1/2 sticks) unsalted butter $ 1/4 cup light brown sugar $ 1 vanilla bean $ 8 ounces mascarpone $ 1 ripe pineapple, peeled and sliced into 1/4-inch-thick rounds $ 1/2 cup fresh blueberries $ ",Rum $ Dessert $ Blueberry $ Pineapple $ Vanilla $ Summer $ Grill/Barbecue $ Kidney Friendly $ Vegetarian $ Pescatarian $ Wheat/Gluten-Free $ Peanut Free $ Tree Nut Free $ Soy Free $ Kosher $ ,American $ Central American/Caribbean $ ,2.5/4,12,Rum $ Dessert $ Blueberry $ Pineapple $ Vanilla $ Summer $ Grill/Barbecue $ Kidney Friendly $ Vegetarian $ Pescatarian $ Wheat/Gluten-Free $ Peanut Free $ Tree Nut Free $ Soy Free $ Kosher $ American $ Central American/Caribbean $ 
https://www.epicurious.com/recipes/food/views/red-flannel-salmon-hash-with-poached-eggs-and-coriander-hollandaise-234559,Red-Flannel Salmon Hash with Poached Eggs and Coriander Hollandaise ,"1 tablespoon butter $ 2 shallots, thinly sliced $ 1 egg $ 1/4 cup heavy cream $ 1/2 teaspoon chipotle puree* $ 1 tablespoon minced fresh cilantro, thyme, or parsley $ Salt and freshly ground black pepper> $ 8 ounces oven-steamed salmon, or an 8-ounce fillet of raw salmon poached in 2 cups court bouillon $ 1 medium-size red beet, roasted until tender, peeled, and cut into 1/2-inch dice $ 1 large russet potato, cooked until tender, peeled, and cut into 1/2-inch dice $ 1/2 cup panko (Japanese bread crumbs), or fresh bread crumbs $ 2-3 tablespoons butter, for sautéing $ 2 egg yolks $ 2 tablespoons lemon juice $ 1 tablespoon water $ 1 cup clarified butter (see Chef's Trick) $ Salt and pepper to taste $ 1 teaspoon ground coriander seed $ 3 tablespoons minced fresh cilantro $ White vinegar $ 4 large eggs $ ",Milk/Cream $ Egg $ Herb $ Potato $ Breakfast $ Brunch $ Poach $ Sauté $ Steam $ Salmon $ Beet $ Spring $ Pescatarian $ ,American $ ,3/4,6,Milk/Cream $ Egg $ Herb $ Potato $ Breakfast $ Brunch $ Poach $ Sauté $ Steam $ Salmon $ Beet $ Spring $ Pescatarian $ American $ 
https://www.epicurious.com/recipes/food/views/finger-cookies-232939,Finger Cookies ,"1 cup butter, softened $ 1 cup powdered sugar $ 1 egg $ 1 teaspoon vanilla extract $ 2 3/4 cups all-purpose flour $ 1 teaspoon baking powder $ 1 teaspoon salt $ 1/2 cup sliced almonds $ 2 tablepoons Icing Glue (see below) $ 1/4 cup powdered sugar $ 1 teaspoon water $ ",Cookies $ Nut $ Dessert $ Bake $ Kid-Friendly $ Halloween $ Almond $ Kidney Friendly $ Vegetarian $ Pescatarian $ Peanut Free $ Soy Free $ Kosher $ ,American $ ,3.5/4,40,Cookies $ Nut $ Dessert $ Bake $ Kid-Friendly $ Halloween $ Almond $ Kidney Friendly $ Vegetarian $ Pescatarian $ Peanut Free $ Soy Free $ Kosher $ American $ 
https://www.epicurious.com/recipes/food/views/carpaccio-arugula-and-parmesan-stacks-233505,"Carpaccio, Arugula, and Parmesan Stacks ","Mayonnaise: 1/4 cup $ Lemon Juice: 2 tablespoons $ Dijon Mustard: 2 tablespoons $ Salt: 1/2 teaspoon $ Cracked black pepper: 1/2 teaspoon $ Carpaccio (paper-thin slices of beef tenderloin): 16 slices $ Arugula: 1 bunch, washed, dried, and roughly chopped $ Parmesan cheese: 1/4 pound, shaved $ ",Beef $ Appetizer $ No-Cook $ Cocktail Party $ Quick & Easy $ Mayonnaise $ Parmesan $ Arugula $ ,American $ ,3/4,5,Beef $ Appetizer $ No-Cook $ Cocktail Party $ Quick & Easy $ Mayonnaise $ Parmesan $ Arugula $ American $ 
https://www.epicurious.com/recipes/food/views/brain-cupcakes-232941,Brain Cupcakes ,Pink or white paper cupcake liners $ 1 recipe batter for Red Velvet Cupcakes $ 1 recipe Vanilla Butter Cream Frosting $ Red and black food coloring $ Pastry bag and large round tip $ ,Cake $ Dessert $ Bake $ Kid-Friendly $ Halloween $ ,American $ ,3/4,9,Cake $ Dessert $ Bake $ Kid-Friendly $ Halloween $ American $ 
https://www.epicurious.com/recipes/food/views/spicy-skirt-steak-232857,Spicy Skirt Steak ,"1/4 cup olive oil $ 1/4 cup fresh lime juice $ 4 cloves garlic, finely chopped $ 1 tablespoon ground cumin $ 1 tablespoon ground coriander $ 2 skirt steaks, about 3 pounds total, cut in half $ 1 red onion, thinly sliced $ 1 red bell pepper, cored, seeded, and thinly sliced $ 1/4 cup chopped fresh cilantro $ 3 limes, cut in half $ 2 tablespoons hot taco sauce $ 1 teaspoon salt $ ",Marinate $ Lime $ Steak $ Bell Pepper $ Fall $ Tailgating $ Grill/Barbecue $ Cilantro $ ,American $ ,3.5/4,4,Marinate $ Lime $ Steak $ Bell Pepper $ Fall $ Tailgating $ Grill/Barbecue $ Cilantro $ American $ 
https://www.epicurious.com/recipes/food/views/red-velvet-cupcakes-232943,Red Velvet Cupcakes ,"2 1/2 cups all-purpose flour $ 1 teaspoon salt $ 1/2 cup unsalted butter, softened $ 1 1/2 cups sugar $ 2 eggs $ 2 tablespoons cocoa powder $ 2 ounces water $ 2 ounces red food coloring $ 1 cup buttermilk $ 1 teaspoon vanilla extract $ 1 teaspoon white vinegar $ 1 teaspoon baking soda $ ",Cake $ Dessert $ Bake $ Kid-Friendly $ Kidney Friendly $ Vegetarian $ Pescatarian $ Peanut Free $ Tree Nut Free $ Soy Free $ Kosher $ ,American $ ,3/4,40,Cake $ Dessert $ Bake $ Kid-Friendly $ Kidney Friendly $ Vegetarian $ Pescatarian $ Peanut Free $ Tree Nut Free $ Soy Free $ Kosher $ American $ 
https://www.epicurious.com/recipes/food/views/southwestern-corn-233360,Southwestern Corn ,"1 tablespoon vegetable oil $ 2 medium red bell peppers, cored, seeded, deribbed and chopped $ 3 cups fresh corn kernels, blanched (cut from 6 medium ears corn), two 10-ounce packages frozen corn kernels, thawed, or 3 cups canned corn kernels, drained $ 2 jarred jalapeño peppers, seeded and minced $ 1/2 cup chopped cilantro or fresh parsley $ 2 teaspoons kosher salt $ Freshly ground black pepper to taste $ ",Side $ Vegetarian $ Quick & Easy $ Corn $ Bell Pepper $ Vegan $ Jalapeño $ Cilantro $ Pescatarian $ Dairy Free $ Wheat/Gluten-Free $ Peanut Free $ Tree Nut Free $ Soy Free $ No Sugar Added $ Kosher $ ,American $ Southwestern $ ,3.5/4,3,Side $ Vegetarian $ Quick & Easy $ Corn $ Bell Pepper $ Vegan $ Jalapeño $ Cilantro $ Pescatarian $ Dairy Free $ Wheat/Gluten-Free $ Peanut Free $ Tree Nut Free $ Soy Free $ No Sugar Added $ Kosher $ American $ Southwestern $ 
https://www.epicurious.com/recipes/food/views/hot-crab-dip-233213,Hot Crab Dip ,"One 4-ounce package cream cheese, softened $ 1/2 cup mayonnaise $ 1/4 cup finely chopped onion $ 1 tablespoon fresh lemon juice $ 1/2 teaspoon hot pepper sauce $ 1/2 teaspoon Old Bay seasoning or other seasoned salt $ 6 ounces fresh or canned lump crabmeat, drained $ ",Condiment/Spread $ Shellfish $ Appetizer $ Bake $ Quick & Easy $ Crab $ New York $ Sugar Conscious $ Pescatarian $ Wheat/Gluten-Free $ Peanut Free $ Tree Nut Free $ Soy Free $ ,American $ ,3.5/4,49,Condiment/Spread $ Shellfish $ Appetizer $ Bake $ Quick & Easy $ Crab $ New York $ Sugar Conscious $ Pescatarian $ Wheat/Gluten-Free $ Peanut Free $ Tree Nut Free $ Soy Free $ American $ 
https://www.epicurious.com/recipes/food/views/saucepan-brownies-233216,Saucepan Brownies ,"1 stick (8 tablespoons) unsalted butter $ 4 ounces (4 squares) unsweetened chocolate, chopped $ 1 3/4 cup sugar $ 1/4 teaspoon kosher or fine sea salt $ 1 teaspoon pure vanilla extract $ 2 large eggs $ 1 cup all-purpose flour $ 1 scant cup walnuts, broken into large pieces, optional $ ",Chocolate $ Dessert $ Bake $ Quick & Easy $ Kidney Friendly $ Vegetarian $ Pescatarian $ Peanut Free $ Soy Free $ Kosher $ ,American $ ,3.5/4,20,Chocolate $ Dessert $ Bake $ Quick & Easy $ Kidney Friendly $ Vegetarian $ Pescatarian $ Peanut Free $ Soy Free $ Kosher $ American $ 
