link,name,ingredients,recipe_category,recipe_cuisine,rating,rating_count,keywords
https://www.epicurious.com/recipes/food/views/giblet-gravy-240888,Giblet Gravy ,"2 cups pan juices from the turkey $ 4 tablespoons unsalted butter $ 1/4 cup all-purpose flour $ 1/2 cup Plum Glaze $ 1/2 teaspoon dried thyme $ Salt and pepper, to taste $ Giblet mixture $ Giblet Broth , if needed $ ",Sauce $ turkey $ Thanksgiving $ Simmer $ Parade $ ,American $ ,2/4,1,Sauce $ turkey $ Thanksgiving $ Simmer $ Parade $ American $ 
https://www.epicurious.com/recipes/food/views/plum-glaze-240887,Plum Glaze ,1 1/2 cups fresh orange juice $ 1/4 cup Chinese plum sauce $ 1/4 cup honey $ 3 tablespoons soy sauce $ 2 tablespoons orange marmalade $ 2 tablespoons finely minced ginger $ 1 tablespoon finely minced garlic $ ,Sauce $ Fruit Juice $ Thanksgiving $ Quick & Easy $ Plum $ Fall $ Honey $ Jam or Jelly $ Parade $ ,American $ ,0/4,0,Sauce $ Fruit Juice $ Thanksgiving $ Quick & Easy $ Plum $ Fall $ Honey $ Jam or Jelly $ Parade $ American $ 
https://www.epicurious.com/recipes/food/views/whipped-candied-sweets-240886,Whipped Candied Sweets ,"4 tablespoons unsalted butter $ 1/4 cup (packed) light-brown sugar $ 2 tablespoons pure maple syrup $ Finely grated zest of 1 lemon $ Juice of 1/2 lemon $ 1 teaspoon pure vanilla extract $ 1/2 teaspoon ground nutmeg $ 6 sweet potatoes (about 12 ounces each), peeled, cut into large cubes $ Salt, to taste $ ",Side $ Thanksgiving $ Sweet Potato/Yam $ Maple Syrup $ Simmer $ Parade $ ,American $ ,0/4,0,Side $ Thanksgiving $ Sweet Potato/Yam $ Maple Syrup $ Simmer $ Parade $ American $ 
https://www.epicurious.com/recipes/food/views/cranberry-relish-240885,Cranberry Relish ,"16 ounces fresh cranberries, rinsed $ 2 cups granulated sugar $ 1/2 cup cranberry juice $ 1/2 cup fresh orange juice $ 1 tablespoon orange zest $ ",Sauce $ Fruit Juice $ Side $ Thanksgiving $ Quick & Easy $ Cranberry $ Orange $ Simmer $ Parade $ ,American $ ,3.5/4,7,Sauce $ Fruit Juice $ Side $ Thanksgiving $ Quick & Easy $ Cranberry $ Orange $ Simmer $ Parade $ American $ 
https://www.epicurious.com/recipes/food/views/cranberry-fennel-stuffing-240884,Cranberry Fennel Stuffing ,"10 cups cubed (1 inch) day-old French sourdough bread $ 6 tablespoons olive oil $ 1 tablespoon dried thyme $ Salt and pepper, to taste $ 2 pounds sweet Italian sausage, casings removed $ 3 tablespoons unsalted butter $ 2 cups peeled and chopped (1/4 inch) onions $ 2 fennel bulbs, cored, trimmed and cut into 1/4-inch dice $ 2 cups dried cranberries $ 2 cups coarsely chopped walnuts $ Finely grated zest of 2 oranges $ 2 teaspoons dried sage leaves $ 1/4 cup chopped flat-leaf parsley $ 1 cup defatted chicken broth $ ",Onion $ Side $ Bake $ Thanksgiving $ Stuffing/Dressing $ Cranberry $ Sausage $ Walnut $ Fennel $ Fall $ Parsley $ Parade $ ,American $ ,3.5/4,2,Onion $ Side $ Bake $ Thanksgiving $ Stuffing/Dressing $ Cranberry $ Sausage $ Walnut $ Fennel $ Fall $ Parsley $ Parade $ American $ 
https://www.epicurious.com/recipes/food/views/farmhouse-herbed-stuffing-240446,Farmhouse Herbed Stuffing ,"8 tablespoons (1 stick) unsalted butter $ 2 medium onions, cut into 1/4-inch dice (about 3 cups) $ 6 stalks celery with leaves, cut into 1/4-inch dice (about 2 1/2 cups) $ 1 (14-ounce) package seasoned bread stuffing cubes $ 1/3 cup fresh parsley, chopped $ 1 teaspoon celery salt $ 1 teaspoon dried sage, crumbled $ 1 teaspoon dried rosemary, crushed $ 1/2 teaspoon dried thyme, crumbled $ 1/4 teaspoon salt $ 1/4 teaspoon freshly ground black pepper $ 1 1/4 cups hot Homemade Turkey Stock or canned turkey stock, plus 1/2 cup more if baking all of stuffing outside of turkey $ ",Herb $ Side $ Thanksgiving $ Stuffing/Dressing $ Peanut Free $ Tree Nut Free $ Soy Free $ ,American $ ,3.5/4,44,Herb $ Side $ Thanksgiving $ Stuffing/Dressing $ Peanut Free $ Tree Nut Free $ Soy Free $ American $ 
https://www.epicurious.com/recipes/food/views/peach-blueberry-pie-240847,Peach Blueberry Pie ,"3 cups all-purpose flour $ 1 tablespoon sugar $ 1 1/2 teaspoons salt $ 12 tablespoons (1 1/2 sticks) cold unsalted butter, cut into small pieces $ 8 tablespoons cold vegetable shortening $ 4 to 5 tablespoons ice-cold water $ 3 to 3 1/2 pounds ripe peaches $ 2 tablespoons fresh lemon juice $ 1 cup blueberries $ 1 tablespoon pure vanilla extract $ 1/3 cup (packed) light-brown sugar $ 1/2 cup plus 2 tablespoons granulated sugar $ 1/4 cup all-purpose flour $ 1 large egg white, lightly beaten $ 2 tablespoons cold unsalted butter, cut into small pieces $ 2 tablespoons heavy (whipping) cream $ ",Dessert $ Bake $ Blueberry $ Peach $ Parade $ ,American $ ,3.5/4,23,Dessert $ Bake $ Blueberry $ Peach $ Parade $ American $ 
https://www.epicurious.com/recipes/food/views/summer-berry-crisp-240846,Summer Berry Crisp ,"2 cups blueberries $ 2 cups blackberries $ 2 cups raspberries $ 1/4 cup sugar $ 1/4 cup all-purpose flour $ 1/4 teaspoon cinnamon $ 1 cup rolled oats $ 1/2 cup all-purpose flour $ 1/2 cup brown sugar $ 1/2 cup sugar $ Pinch of salt $ 1/2 cup (1 stick) cold unsalted butter, cut into small pieces $ Whipped cream or vanilla ice cream, for serving $ ",Dessert $ Bake $ Kid-Friendly $ Quick & Easy $ Blackberry $ Blueberry $ Raspberry $ Oat $ Summer $ Parade $ ,American $ ,4/4,53,Dessert $ Bake $ Kid-Friendly $ Quick & Easy $ Blackberry $ Blueberry $ Raspberry $ Oat $ Summer $ Parade $ American $ 
https://www.epicurious.com/recipes/food/views/chicken-and-dumplings-240818,Chicken and Dumplings ,"2 tablespoons olive oil $ 1 (3-pound) chicken, cut into pieces $ 1/4 cup flour, seasoned with salt and pepper to taste $ 1 medium yellow onion, peeled and cut into large chunks $ 2 carrots, peeled and cut into large chunks $ 2 stalks celery, cut into large chunks $ 1 bay leaf $ 1 sprig thyme $ 1/4 teaspoon turmeric $ Kosher salt and freshly ground black pepper to taste $ 4 cups low-sodium chicken broth $ Fresh parsley $ 1 1/2 cups flour $ 2 teaspoons baking powder $ 1/2 cup coarsely ground cornmeal $ 1 tablespoon sugar $ 1 teaspoon kosher salt $ 1 3/4 cups heavy cream $ ",Soup/Stew $ Milk/Cream $ Chicken $ Sauté $ Kid-Friendly $ Quick & Easy $ Lunch $ Carrot $ Fall $ Winter $ Cookie $ Peanut Free $ Tree Nut Free $ Soy Free $ ,American $ ,3.5/4,139,Soup/Stew $ Milk/Cream $ Chicken $ Sauté $ Kid-Friendly $ Quick & Easy $ Lunch $ Carrot $ Fall $ Winter $ Cookie $ Peanut Free $ Tree Nut Free $ Soy Free $ American $ 
https://www.epicurious.com/recipes/food/views/smoked-salmon-chowder-240816,Smoked Salmon Chowder ,"1 tablespoon olive oil $ 3 medium leeks, white and light green parts only, rinsed and sliced (about 3 cups) $ 1 garlic clove, minced $ 1 large russet potato, peeled and cubed $ 1 large stalk celery, chopped $ 1/2 teaspoon kosher salt $ 1/2 teaspoon freshly ground black pepper $ 2 cups vegetable broth $ 2 tablespoons tomato paste $ 2 cups milk (any fat content) $ 8 ounces smoked salmon, flaked $ 1/2 cup heavy cream $ 2 tablespoons chives, chopped $ ",Soup/Stew $ Milk/Cream $ Potato $ Sauté $ Kid-Friendly $ Quick & Easy $ Lunch $ Salmon $ Leek $ Fall $ Winter $ Cookie $ Pescatarian $ Wheat/Gluten-Free $ Peanut Free $ Tree Nut Free $ Soy Free $ No Sugar Added $ Kosher $ ,American $ ,3.5/4,87,Soup/Stew $ Milk/Cream $ Potato $ Sauté $ Kid-Friendly $ Quick & Easy $ Lunch $ Salmon $ Leek $ Fall $ Winter $ Cookie $ Pescatarian $ Wheat/Gluten-Free $ Peanut Free $ Tree Nut Free $ Soy Free $ No Sugar Added $ Kosher $ American $ 
https://www.epicurious.com/recipes/food/views/chocolate-sambuca-crinkle-cookies-240814,Chocolate Sambuca Crinkle Cookies ,"1 1/4 cups all-purpose flour $ 1 tablespoon baking powder $ 1/2 teaspoon salt $ 12 ounces fine-quality bittersweet chocolate (not unsweetened), chopped $ 1/2 stick unsalted butter $ 2 large eggs $ 1/2 cup walnuts, coarsely chopped $ 1/2 cup Sambuca or other anise-flavored liqueur $ 2 tablespoons granulated sugar $ 1 cup confectioners sugar $ ",Cookies $ Liqueur $ Chocolate $ Egg $ Dessert $ Bake $ Christmas $ Walnut $ Winter $ Gourmet $ Kidney Friendly $ Vegetarian $ Pescatarian $ Peanut Free $ Soy Free $ Kosher $ ,American $ ,3.5/4,24,Cookies $ Liqueur $ Chocolate $ Egg $ Dessert $ Bake $ Christmas $ Walnut $ Winter $ Gourmet $ Kidney Friendly $ Vegetarian $ Pescatarian $ Peanut Free $ Soy Free $ Kosher $ American $ 
https://www.epicurious.com/recipes/food/views/roast-beef-salad-240788,Roast Beef Salad ,"2 cups peeled, diced (1/2 inch) cooked potatoes $ 3 cups (1 pound) diced (1/2 inch) medium-rare leftover roast beef $ 2/3 cup mixed diced (1/4 inch) red and green bell peppers $ 1/3 cup diced (1/4 inch) red onion $ 2 scallions, thinly sliced $ 3 tablespoons chopped parsley $ Salt and pepper, to taste $ 1/3 cup of your favorite vinaigrette $ Boston lettuce leaves, for serving $ ",Salad $ Beef $ Leafy Green $ Potato $ Quick & Easy $ Lunch $ Bell Pepper $ Fall $ Winter $ Parade $ ,American $ ,0/4,1,Salad $ Beef $ Leafy Green $ Potato $ Quick & Easy $ Lunch $ Bell Pepper $ Fall $ Winter $ Parade $ American $ 
https://www.epicurious.com/recipes/food/views/roast-beef-vegetable-hash-240786,Roast Beef Vegetable Hash ,"2 pounds russet potatoes, peeled and cut into 1/4-inch dice $ 1/2 pound leftover roast beef/epi:recipeLink, cut into 1/4-inch dice $ 1/4 pound thick-sliced bacon, cut into 1/4-inch dice $ 1 onion, chopped $ 1 each red and green bell pepper, seeded and cut into 1/4-inch dice $ 1/4 teaspoon nutmeg $ Salt and pepper, to taste $ 1 tablespoon orange zest $ 4 tablespoons chopped parsley $ 6 poached eggs, for serving $ ",Beef $ Egg $ Potato $ Side $ Bacon $ Bell Pepper $ Fall $ Winter $ Parade $ ,American $ ,3/4,8,Beef $ Egg $ Potato $ Side $ Bacon $ Bell Pepper $ Fall $ Winter $ Parade $ American $ 
https://www.epicurious.com/recipes/food/views/rib-eye-roast-240785,Rib Eye Roast ,"1 boneless prime rib eye roast of beef, about 10 pounds after boning $ Salt and coarsely ground black pepper, to taste $ ",Beef $ Roast $ Dinner $ Fall $ Winter $ Parade $ ,American $ ,3/4,8,Beef $ Roast $ Dinner $ Fall $ Winter $ Parade $ American $ 
https://www.epicurious.com/recipes/food/views/turkey-meatball-grinder-240784,Turkey Meatball Grinder ,"2 pounds ground turkey $ 1 onion, grated $ 1 tablespoon minced garlic $ 1 teaspoon dried basil $ 1 teaspoon dried oregano $ 1 teaspoon fennel seeds $ Salt and pepper, to taste $ 1 egg, lightly beaten (optional) $ 2 tablespoons olive oil $ About 3 cups of your favorite tomato sauce $ 8 French rolls (each about 5 inches long and 3 inches wide); or 3 Italian breads (about 15 inches long and 3 inches wide), sliced into 3 pieces each, with the insides pulled out $ ",Sandwich $ Onion $ Tomato $ turkey $ Kid-Friendly $ Lunch $ Fall $ Winter $ Parade $ ,American $ Italian American $ ,3.5/4,15,Sandwich $ Onion $ Tomato $ turkey $ Kid-Friendly $ Lunch $ Fall $ Winter $ Parade $ American $ Italian American $ 
https://www.epicurious.com/recipes/food/views/rich-little-poboy-240783,Rich Little Po'boy ,"3 small ripe tomatoes, halved $ Salt and freshly ground black pepper, to taste $ 1 Italian bread (12 inches long) $ 1/4 cup mayonnaise $ 1/4 pound thinly sliced rare roast beef $ 4 thin slices ripe Brie cheese $ 4 to 6 lettuce leaves, rinsed and patted dry $ ",Sandwich $ Beef $ Tomato $ Broil $ Lunch $ Mayonnaise $ Brie $ Grill/Barbecue $ Lettuce $ Parade $ ,American $ ,2/4,2,Sandwich $ Beef $ Tomato $ Broil $ Lunch $ Mayonnaise $ Brie $ Grill/Barbecue $ Lettuce $ Parade $ American $ 
https://www.epicurious.com/recipes/food/views/muffuletta-sandwich-240766,Muffuletta Sandwich ,"1 cup each pitted green and black olives, coarsely chopped $ 1 tablespoon tiny capers $ 1/3 cup diced (1/4 inch) roasted red bell pepper $ 1/4 cup diced (1/4 inch) celery, with leaves $ 2 tablespoons chopped flat-leaf parsley $ 2 teaspoons finely minced garlic $ 2 tablespoons red-wine vinegar $ 2 tablespoons olive oil $ Salt and pepper, to taste $ 1 round peasant bread (about 7 inches in diameter, 5 inches high), halved crosswise, insides pulled out $ 4 ounces each thinly sliced Genoa salami and mortadella (found in the deli section) $ 4 ounces thinly sliced provolone cheese $ ",Sandwich $ Cheese $ Olive $ Pork $ Lunch $ Celery $ Bell Pepper $ Fall $ Capers $ Parade $ ,American $ ,3.5/4,8,Sandwich $ Cheese $ Olive $ Pork $ Lunch $ Celery $ Bell Pepper $ Fall $ Capers $ Parade $ American $ 
https://www.epicurious.com/recipes/food/views/brownie-thins-240760,Brownie Thins ,"6 tablespoons (3/4 stick) unsalted butter, cut into pieces $ 2 ounces unsweetened chocolate, chopped $ 1/2 cup sugar $ 1 large egg $ 3 tablespoons plus 1 teaspoon all purpose flour $ 1/4 teaspoon vanilla extract $ 1/4 teaspoon almond extract $ Pinch of coarse kosher salt $ Nonstick vegetable oil spray $ 1/4 cup chopped pistachios $ ",Cookies $ Chocolate $ Dessert $ Bake $ Kid-Friendly $ Pistachio $ Bon Appétit $ Kidney Friendly $ Vegetarian $ Pescatarian $ Peanut Free $ Soy Free $ Kosher $ ,American $ ,3/4,55,Cookies $ Chocolate $ Dessert $ Bake $ Kid-Friendly $ Pistachio $ Bon Appétit $ Kidney Friendly $ Vegetarian $ Pescatarian $ Peanut Free $ Soy Free $ Kosher $ American $ 
https://www.epicurious.com/recipes/food/views/butter-and-herb-roasted-red-onions-240750,Butter- and Herb-Roasted Red Onions ,"6 medium red onions (about 7 ounces each), peeled, cut vertically into 6 wedges to within 1/2 inch of bottom $ 1/2 cup (1 stick) butter, room temperature $ 4 teaspoons minced fresh rosemary $ 1 tablespoon chopped fresh Italian parsley $ 2 teaspoons fresh lemon juice $ ",Herb $ Onion $ Side $ Roast $ Vegetarian $ Quick & Easy $ Low Cal $ High Fiber $ Fall $ Bon Appétit $ Pescatarian $ Wheat/Gluten-Free $ Peanut Free $ Tree Nut Free $ Soy Free $ No Sugar Added $ Kosher $ ,American $ ,3/4,3,Herb $ Onion $ Side $ Roast $ Vegetarian $ Quick & Easy $ Low Cal $ High Fiber $ Fall $ Bon Appétit $ Pescatarian $ Wheat/Gluten-Free $ Peanut Free $ Tree Nut Free $ Soy Free $ No Sugar Added $ Kosher $ American $ 
https://www.epicurious.com/recipes/food/views/roast-beef-tenderloin-with-port-sauce-240690,Roast Beef Tenderloin with Port Sauce ,"1 4- to 5-pound trimmed whole beef tenderloin, tail end tucked under, tied every 3 inches $ 2 teaspoons coarse kosher salt $ 4 tablespoons (1/2 stick) chilled unsalted butter, divided $ 1/4 cup finely chopped shallots $ 3 tablespoons Cognac or brandy $ 1 fresh rosemary sprig $ 1 teaspoon coarsely cracked black pepper $ 1 cup ruby or tawny Port $ Simple Homemade Beef Stock $ 2 tablespoons extra-virgin olive oil $ 2 tablespoons black peppercorns, coarsely cracked in mortar with pestle or in resealable plastic bag with mallet $ ",Roast $ Christmas $ Rosemary $ Beef Tenderloin $ Port $ Winter $ Shallot $ Bon Appétit $ ,American $ ,4/4,210,Roast $ Christmas $ Rosemary $ Beef Tenderloin $ Port $ Winter $ Shallot $ Bon Appétit $ American $ 
https://www.epicurious.com/recipes/food/views/white-chocolate-tiramisu-trifle-with-spiced-pears-240701,White Chocolate Tiramisu Trifle With Spiced Pears ,"1 750-ml bottle dry white wine $ 2 cups pear juice or pear nectar $ 1 1/4 cups sugar $ 12 whole green cardamom pods, crushed in resealable plastic bag with mallet $ 4 1-inch-diameter rounds peeled fresh ginger (each about 1/8 inch thick) $ 2 cinnamon sticks, broken in half $ 5 large firm but ripe Anjou pears (3 to 31/4 pounds), peeled $ 7 ounces high-quality white chocolate (such as Lindt or Perugina), finely chopped $ 1/3 cup poire Williams (clear pear brandy) $ 1/4 cup water $ 1/2 vanilla bean, split lengthwise $ 1 8- to 8.8-ounce container mascarpone cheese* $ 1 cup chilled heavy whipping cream $ 3 3-ounce packages soft ladyfingers,** separated $ 2 cups chilled heavy whipping cream $ 1/4 cup minced crystallized ginger $ White chocolate curls $ 1 tablespoon powdered sugar $ ",Cake $ Fruit Juice $ Chocolate $ Dessert $ Christmas $ Pear $ Vanilla $ White Wine $ Winter $ Cinnamon $ Bon Appétit $ Vegetarian $ Pescatarian $ Peanut Free $ Tree Nut Free $ Soy Free $ Kosher $ White Chocolate $ ,American $ Italian $ ,3.5/4,66,Cake $ Fruit Juice $ Chocolate $ Dessert $ Christmas $ Pear $ Vanilla $ White Wine $ Winter $ Cinnamon $ Bon Appétit $ Vegetarian $ Pescatarian $ Peanut Free $ Tree Nut Free $ Soy Free $ Kosher $ White Chocolate $ American $ Italian $ 
https://www.epicurious.com/recipes/food/views/cornish-game-hen-with-double-cranberry-and-thyme-sauce-240680,Cornish Game Hen with Double-Cranberry and Thyme Sauce ,"3 tablespoons butter, divided $ 1 tablespoon golden brown sugar $ 3 teaspoons chopped fresh thyme, divided $ 1 1 1/2- to 1 3/4-pound Cornish game hen, halved, backbone removed, rinsed, patted dry $ 1/2 tablespoon all purpose flour $ 3/4 cup low-salt chicken broth $ 1/2 cup white grape juice $ 1/3 cup frozen cranberry juice cocktail concentrate, thawed $ 1/4 cup dried sweetened cranberries $ ",Roast $ Quick & Easy $ Cranberry $ Fall $ Winter $ Thyme $ Bon Appétit $ ,American $ ,3.5/4,54,Roast $ Quick & Easy $ Cranberry $ Fall $ Winter $ Thyme $ Bon Appétit $ American $ 
https://www.epicurious.com/recipes/food/views/blood-orange-roast-pork-loin-240673,Blood Orange Roast Pork Loin ,"blood oranges $ 1 3-pound boneless pork loin, rolled and tied $ 3 tablespoons extra-virgin olive oil, divided $ 1 large onion, cut into 8 wedges $ 2 fresh rosemary sprigs, leaves stripped from stems, plus additional sprigs for garnish $ 1/2 cup dry white wine $ 1/2 cup low-salt chicken broth $ 1 large garlic clove, pressed $ Blood orange slices $ ",Onion $ Pork $ Roast $ Low Cal $ Low Sodium $ Orange $ Rosemary $ White Wine $ Winter $ Healthy $ Bon Appétit $ ,American $ ,3.5/4,17,Onion $ Pork $ Roast $ Low Cal $ Low Sodium $ Orange $ Rosemary $ White Wine $ Winter $ Healthy $ Bon Appétit $ American $ 
https://www.epicurious.com/recipes/food/views/bloody-mary-soup-shots-with-shrimp-and-pickled-vegetables-240667,Bloody Mary Soup Shots with Shrimp and Pickled Vegetables ,"32 peeled deveined cooked medium shrimp $ 2 tablespoons fresh lemon juice, divided $ Pickled vegetables (such as carrots, celery, green beans, and olives) $ 1 28-ounce can San Marzano tomatoes in juice $ 2 green onions, chopped $ 1/2 cup (or more) low-salt chicken broth $ 2 tablespoons Worcestershire sauce $ 2 tablespoons vodka $ 1 tablespoon prepared horseradish $ 1/2 teaspoon celery salt $ ",Soup/Stew $ Vodka $ Tomato $ Vegetable $ Appetizer $ Low Fat $ Quick & Easy $ Low Cal $ New Year's Eve $ Shrimp $ Winter $ Bon Appétit $ Peanut Free $ Tree Nut Free $ Soy Free $ No Sugar Added $ ,American $ ,3.5/4,16,Soup/Stew $ Vodka $ Tomato $ Vegetable $ Appetizer $ Low Fat $ Quick & Easy $ Low Cal $ New Year's Eve $ Shrimp $ Winter $ Bon Appétit $ Peanut Free $ Tree Nut Free $ Soy Free $ No Sugar Added $ American $ 
https://www.epicurious.com/recipes/food/views/quick-turkey-stock-240623,Quick Turkey Stock ,"2 quarts turkey or chicken stock or canned low-sodium chicken broth $ Neck, heart, and gizzard reserved from turkey $ ",Soup/Stew $ turkey $ Thanksgiving $ Quick & Easy $ Fall $ Boil $ ,American $ ,0/4,0,Soup/Stew $ turkey $ Thanksgiving $ Quick & Easy $ Fall $ Boil $ American $ 
https://www.epicurious.com/recipes/food/views/roasted-vegetable-and-wine-sauce-240602,Roasted-Vegetable and Wine Sauce ,"1 large leek (white and pale green parts only), halved lengthwise $ 5 carrots, quartered $ 1 head garlic, separated into cloves and peeled $ 2 red bell peppers, quartered $ 1 pound plum tomatoes, halved $ 1 fennel bulb, stalks discarded and bulb quartered $ 2 large onions, quartered $ 2 tablespoons olive oil $ 1 cup boiling water $ 1/2 ounce dried porcini mushrooms (1 cup) $ 1 (4-inch) piece celery $ 4 parsley stems $ 1 large thyme sprig $ 8 black peppercorns $ 2 Turkish bay leaves or 1 California $ 1 cup dry red wine $ 4 quart water $ 1/2 cup sun-dried tomatoes (not packed in oil; 1 1/2 ounces) $ 1/2 stick unsalted butter $ 1/3 cup all-purpose flour $ Equipment: cheesecloth; kitchen string $ kitchen string $ ",Garlic $ Mushroom $ Onion $ Tomato $ Side $ Roast $ Thanksgiving $ Vegetarian $ Fennel $ Leek $ Bell Pepper $ Carrot $ Red Wine $ Winter $ Gourmet $ Pescatarian $ Peanut Free $ Tree Nut Free $ Soy Free $ Kosher $ ,American $ ,4/4,4,Garlic $ Mushroom $ Onion $ Tomato $ Side $ Roast $ Thanksgiving $ Vegetarian $ Fennel $ Leek $ Bell Pepper $ Carrot $ Red Wine $ Winter $ Gourmet $ Pescatarian $ Peanut Free $ Tree Nut Free $ Soy Free $ Kosher $ American $ 
https://www.epicurious.com/recipes/food/views/pumpkin-stuffed-with-vegetable-stew-240601,Pumpkin Stuffed with Vegetable Stew ,"1 fennel bulb with fronds $ 2 medium parsnips (1/2 pound total), peeled, quartered, cored, and cut into 1-inch pieces $ 1/2 pound celery root (sometimes called celeriac; 1/2 of 1 medium), peeled and cut into 1-inch pieces $ 3 medium carrots, peeled and cut into 1-inch pieces $ 14 small shallots (about 1 pound), peeled and left whole, plus 1/2 cup chopped $ 3 tablespoons olive oil, divided 2 red bell peppers $ 1 (8- to 9-lb) pumpkin (preferably cheese, pie, or Sweet Meat variety) $ Roasted-vegetable and wine sauce , heated $ 3 tablespoons unsalted butter $ 1/2 pound fresh cremini mushrooms, trimmed and halved $ 1/4 pound fresh chanterelle mushrooms, trimmed $ 1 pound seitan (seasoned wheat gluten), cut into 1/2-inch pieces $ 1 teaspoon chopped thyme, divided $ 1 tablespoon chopped flat-leaf parsley $ 1/2 teaspoon grated lemon zest $ ",Soup/Stew $ Mushroom $ Roast $ Thanksgiving $ Vegetarian $ Fennel $ Carrot $ Parsnip $ Pumpkin $ Winter $ Shallot $ Gourmet $ ,American $ ,3/4,69,Soup/Stew $ Mushroom $ Roast $ Thanksgiving $ Vegetarian $ Fennel $ Carrot $ Parsnip $ Pumpkin $ Winter $ Shallot $ Gourmet $ American $ 
https://www.epicurious.com/recipes/food/views/cranberry-bars-240613,Cranberry Bars ,"1 1/2 sticks unsalted butter, cut into 1/2-inch cubes $ 2 cups all-purpose flour $ 1/2 teaspoon salt $ 1 cup plus 2 tablespoons granulated sugar, divided $ 3 cups fresh or frozen cranberries (not thawed if frozen; 3/4 pound) $ 1/4 cup water $ Confectioners sugar for dusting $ ",Dessert $ Bake $ Thanksgiving $ Kid-Friendly $ Cranberry $ Winter $ Gourmet $ Kidney Friendly $ Vegetarian $ Pescatarian $ Peanut Free $ Tree Nut Free $ Soy Free $ Kosher $ ,American $ ,3.5/4,18,Dessert $ Bake $ Thanksgiving $ Kid-Friendly $ Cranberry $ Winter $ Gourmet $ Kidney Friendly $ Vegetarian $ Pescatarian $ Peanut Free $ Tree Nut Free $ Soy Free $ Kosher $ American $ 
https://www.epicurious.com/recipes/food/views/poire-belle-helene-ice-cream-cake-240608,Poire Belle Helene Ice Cream Cake ,"1 cup water $ 3/4 cup sugar $ 3 tablespoons pear brandy $ 5 ounces fine-quality unsweetened chocolate, chopped $ 1 (10 3/4-ounce) pound cake (preferably all-butter), thawed if frozen $ 2 pints Häagen-Dazs Caramelized Pear & Toasted Pecan ice cream, slightly softened $ ",Cake $ Chocolate $ Dessert $ Frozen Dessert $ Brandy $ Fall $ Winter $ Gourmet $ Vegetarian $ Pescatarian $ Peanut Free $ Soy Free $ Kosher $ ,American $ ,2/4,1,Cake $ Chocolate $ Dessert $ Frozen Dessert $ Brandy $ Fall $ Winter $ Gourmet $ Vegetarian $ Pescatarian $ Peanut Free $ Soy Free $ Kosher $ American $ 
https://www.epicurious.com/recipes/food/views/apple-galette-240607,Apple Galette ,"Pastry dough $ 2 tablespoons semolina (sometimes called semolina flour) $ 2 pounds Golden Delicious apples (about 4), peeled, cored, and each cut into 8 wedges $ 2 teaspoons fresh lemon juice $ 1/2 teaspoon grated lemon zest $ 1/4 cup granulated sugar $ 1 1/2 tablespoons confectioners sugar $ ",Dessert $ Bake $ Broil $ Thanksgiving $ Lemon $ Apple $ Winter $ Gourmet $ Fat Free $ Kidney Friendly $ Vegan $ Vegetarian $ Pescatarian $ Dairy Free $ Peanut Free $ Tree Nut Free $ Soy Free $ Kosher $ ,American $ ,3.5/4,22,Dessert $ Bake $ Broil $ Thanksgiving $ Lemon $ Apple $ Winter $ Gourmet $ Fat Free $ Kidney Friendly $ Vegan $ Vegetarian $ Pescatarian $ Dairy Free $ Peanut Free $ Tree Nut Free $ Soy Free $ Kosher $ American $ 
https://www.epicurious.com/recipes/food/views/bittersweet-chocolate-pecan-pie-240605,Bittersweet Chocolate Pecan Pie ,"1 (3 1/2- to 4-ounces) fine-quality 60%- to 70%-cacao bittersweet chocolate bar, finely chopped $ Pastry dough $ 2 cups pecan halves (7 ounces), toasted and cooled $ 3 large eggs $ 1/3 cup packed light brown sugar $ 1 teaspoon pure vanilla extract $ 1/4 teaspoon salt $ 3/4 cup dark corn syrup $ Accompaniment: lightly sweetened whipped cream $ ",Chocolate $ Egg $ Dessert $ Bake $ Thanksgiving $ Pecan $ Fall $ Winter $ Gourmet $ Kidney Friendly $ Vegetarian $ Pescatarian $ Dairy Free $ Wheat/Gluten-Free $ Peanut Free $ Soy Free $ Kosher $ ,American $ ,3.5/4,38,Chocolate $ Egg $ Dessert $ Bake $ Thanksgiving $ Pecan $ Fall $ Winter $ Gourmet $ Kidney Friendly $ Vegetarian $ Pescatarian $ Dairy Free $ Wheat/Gluten-Free $ Peanut Free $ Soy Free $ Kosher $ American $ 
https://www.epicurious.com/recipes/food/views/cider-vinaigrette-240598,Cider Vinaigrette ,1 cup unfiltered apple cider $ 3 tablespoons finely chopped shallots $ 2 tablespoons cider vinegar $ 2 teaspoons grainy mustard $ 1/3 cup olive oil $ ,Fruit Juice $ Mustard $ Quick & Easy $ Salad Dressing $ Vinegar $ Apple $ Fall $ Winter $ Shallot $ Gourmet $ ,American $ ,3.5/4,6,Fruit Juice $ Mustard $ Quick & Easy $ Salad Dressing $ Vinegar $ Apple $ Fall $ Winter $ Shallot $ Gourmet $ American $ 
https://www.epicurious.com/recipes/food/views/fish-with-creamy-leeks-240593,Fish with Creamy Leeks ,"1/2 cup sour cream $ 1 1/2 teaspoons all-purpose flour $ 2 medium leeks (white and pale green parts only), thinly sliced $ 2 tablespoons unsalted butter $ 2/3 cup water, divided $ 4 (6-ounce) pieces thick white-fish fillets such as pollock or Pacific cod, skinned $ 1 tablespoon chopped dill $ ",Fish $ Christmas $ Low Carb $ Quick & Easy $ Low Cal $ Low Sodium $ Leek $ Fall $ Winter $ Healthy $ Sour Cream $ Gourmet $ ,American $ ,3.5/4,69,Fish $ Christmas $ Low Carb $ Quick & Easy $ Low Cal $ Low Sodium $ Leek $ Fall $ Winter $ Healthy $ Sour Cream $ Gourmet $ American $ 
