link,name,ingredients,recipe_category,recipe_cuisine,rating,rating_count,keywords
https://www.epicurious.com/recipes/food/views/chinese-chicken-salad-234995,Chinese Chicken Salad ,"20 square wonton wrappers, thawed if frozen $ About 2 1/2 cups vegetable oil $ 1/2 pound snow peas, trimmed 1 lb Napa cabbage, cored, then cut crosswise into 1/3-inch-wide strips (about 6 cups) $ 1 pound Napa cabbage $ 1 (1-lb) head of romaine, torn into bite-size pieces (about 8 cups) $ 1/4 cup soy sauce $ 1/4 cup fresh lemon juice $ 2 tablespoons sugar $ 1 tablespoon distilled white vinegar $ 1 teaspoon salt $ 1/2 teaspoon black pepper $ 1 tablespoon Asian sesame oil $ 1/4 cup vegetable oil $ 6 cups coarsely shredded cooked chicken (from a 2 1/2-lb rotisserie chicken) $ 1/2 cup chopped scallions $ 1/2 cup chopped fresh cilantro $ 1/2 cup sliced almonds, toasted $ 2 tablespoons sesame seeds, toasted $ a deep-fat thermometer (if making wontons) $ ",Chicken $ Herb $ Nut $ Soy $ Vegetable $ Kid-Friendly $ Lunch $ Pea $ Cabbage $ Gourmet $ California $ Dairy Free $ Peanut Free $ Kosher $ ,American $ Chinese $ ,3.5/4,44,Chicken $ Herb $ Nut $ Soy $ Vegetable $ Kid-Friendly $ Lunch $ Pea $ Cabbage $ Gourmet $ California $ Dairy Free $ Peanut Free $ Kosher $ American $ Chinese $ 
https://www.epicurious.com/recipes/food/views/fresh-fruit-tart-with-plum-jam-234960,Fresh Fruit Tart with Plum Jam ,"1 cup sugar $ 1/2 cup water $ 1 vanilla bean, split lengthwise $ 1 pound ripe plums (about 3 medium), halved, pitted, cut into 1/2-inch-thick slices $ 1/2 cup unhusked hazelnuts $ 1 1/2 cups all purpose flour, divided $ 2 tablespoons sugar $ 1/2 teaspoon salt $ 6 tablespoons butter, melted, cooled $ 8 cups assorted fresh fruit, such as halved, pitted, and sliced stone fruit and berries $ Sweetened whipped cream $ ",Fruit $ Dessert $ Bake $ Plum $ Vanilla $ Summer $ Hazelnut $ Bon Appétit $ Vegetarian $ Pescatarian $ Peanut Free $ Soy Free $ Kosher $ ,American $ ,3/4,1,Fruit $ Dessert $ Bake $ Plum $ Vanilla $ Summer $ Hazelnut $ Bon Appétit $ Vegetarian $ Pescatarian $ Peanut Free $ Soy Free $ Kosher $ American $ 
https://www.epicurious.com/recipes/food/views/summer-strawberry-jam-234745,Summer Strawberry Jam ,1 1/2 cups sugar $ 1/2 cup water $ 1 tablespoon fresh lemon juice $ 8 cups halved hulled strawberries (about 5 pounds) $ ,Condiment/Spread $ Vegetarian $ Strawberry $ Summer $ Vegan $ Jam or Jelly $ Simmer $ Bon Appétit $ ,American $ ,3/4,1,Condiment/Spread $ Vegetarian $ Strawberry $ Summer $ Vegan $ Jam or Jelly $ Simmer $ Bon Appétit $ American $ 
https://www.epicurious.com/recipes/food/views/wild-rice-with-smoked-fish-and-snap-peas-234994,Wild Rice with Smoked Fish and Snap Peas ,"2 3/4 teaspoons salt $ 2 cups wild rice (3/4 pound) $ 1 pound sugar snap peas, trimmed $ 3 tablespoons cider vinegar $ 3 tablespoons coarse-grain mustard $ 2 1/2 teaspoons sugar $ 1/3 cup vegetable oil $ 1/3 cup chopped fresh dill $ 1/2 lb hot-smoked salmon or smoked trout, skin discarded and fish flaked into 1/2-inch-wide pieces $ 4 scallions, thinly sliced crosswise (about 1 cup) $ 6 hard-boiled large eggs, quartered lengthwise $ ",Egg $ Fish $ Mustard $ Vinegar $ Salmon $ Trout $ Scallop $ Summer $ Dill $ Wild Rice $ Sugar Snap Pea $ Boil $ Gourmet $ ,American $ ,3.5/4,11,Egg $ Fish $ Mustard $ Vinegar $ Salmon $ Trout $ Scallop $ Summer $ Dill $ Wild Rice $ Sugar Snap Pea $ Boil $ Gourmet $ American $ 
https://www.epicurious.com/recipes/food/views/strawberry-shortcakes-with-brown-sugar-biscuits-and-white-chocolate-cream-234747,Strawberry Shortcakes with Brown Sugar Biscuits and White Chocolate Cream ,"2 ounces high-quality white chocolate (such as Lindt or Perugina), chopped $ 1 tablespoon water $ 1/2 teaspoon unflavored gelatin $ 2 1/2 cups chilled whipping cream, divided $ 3 tablespoons sugar $ 3 cups all purpose flour $ 1/2 cup (packed) golden brown sugar $ 4 teaspoons baking powder $ 3/4 teaspoon salt $ 9 tablespoons (1 stick plus 1 tablespoon) unsalted butter, cut into 1/4-inch cubes, chilled $ 1 cup whipping cream, plus additional for brushing biscuits $ 2 tablespoons raw sugar* $ 4 cups halved hulled strawberries (about 2 to 2 1/2 pounds) $ 1/4 cup sugar $ 2 tablespoons fresh lemon juice $ 1 tablespoon finely grated lemon peel $ 1 tablespoon chopped fresh mint or 2 teaspoons dried lavender blossoms** $ ",Cake $ Milk/Cream $ Chocolate $ Dessert $ Bake $ Strawberry $ Summer $ Bon Appétit $ Peanut Free $ Tree Nut Free $ Soy Free $ ,American $ ,4/4,16,Cake $ Milk/Cream $ Chocolate $ Dessert $ Bake $ Strawberry $ Summer $ Bon Appétit $ Peanut Free $ Tree Nut Free $ Soy Free $ American $ 
https://www.epicurious.com/recipes/food/views/chicken-and-fennel-salad-sandwiches-235020,Chicken and Fennel Salad Sandwiches ,"3 whole chickens $ 4 teaspoons salt $ 3/4 teaspoon black pepper $ 1/2 stick (1/4 cup) unsalted butter, softened $ 1 1/4 cups mayonnaise $ 1/2 cup plain yogurt $ 1 teaspoon finely grated fresh lemon zest $ 1/4 cup fresh lemon juice $ 1 1/2 teaspoons fennel seeds, toasted and cooled, then lightly crushed $ 1 1/2 teaspoons salt $ 1 teaspoon black pepper $ 1 cup chopped fresh basil $ 3cups chopped fennel bulb (sometimes called anise; from 2 to 3 medium bulbs, stalks discarded) $ 12 rolls or buns $ an instant-read thermometer $ ",Salad $ Chicken $ Citrus $ Herb $ Vegetable $ Roast $ Yogurt $ Lunch $ Fennel $ Summer $ Gourmet $ Sugar Conscious $ Peanut Free $ Tree Nut Free $ Soy Free $ ,American $ ,3.5/4,13,Salad $ Chicken $ Citrus $ Herb $ Vegetable $ Roast $ Yogurt $ Lunch $ Fennel $ Summer $ Gourmet $ Sugar Conscious $ Peanut Free $ Tree Nut Free $ Soy Free $ American $ 
https://www.epicurious.com/recipes/food/views/salt-and-vinegar-potato-salad-235029,Salt and Vinegar Potato Salad ,"1 large red onion, cut lengthwise into 1/3-inch-wide wedges and layers separated $ 1/2 cup plus 2 tablespoons cider vinegar $ 2 teaspoons salt $ 5 lb medium yellow-fleshed potatoes such as Yukon Gold $ 2 to 2 1/2 teaspoons Old Bay seasoning $ 1 1/4 teaspoons sugar $ 3/4 cup extra-virgin olive oil $ ",Onion $ Potato $ Side $ Marinate $ Vegetarian $ Quick & Easy $ Summer $ Vegan $ Gourmet $ Sugar Conscious $ Pescatarian $ Dairy Free $ Wheat/Gluten-Free $ Peanut Free $ Tree Nut Free $ Soy Free $ Kosher $ ,American $ ,3.5/4,23,Onion $ Potato $ Side $ Marinate $ Vegetarian $ Quick & Easy $ Summer $ Vegan $ Gourmet $ Sugar Conscious $ Pescatarian $ Dairy Free $ Wheat/Gluten-Free $ Peanut Free $ Tree Nut Free $ Soy Free $ Kosher $ American $ 
https://www.epicurious.com/recipes/food/views/cornmeal-thumbprint-cookies-with-summer-strawberry-jam-234744,Cornmeal Thumbprint Cookies with Summer Strawberry Jam ,"1/2 cup (1 stick) unsalted butter, room temperature $ 1/2 cup (packed) golden brown sugar $ 1 teaspoon (packed) finely grated lemon peel $ 1 large egg, separated $ 1 teaspoon fresh lemon juice $ 1 teaspoon vanilla extract $ 1 1/4 cups all purpose flour $ 1/2 cup yellow cornmeal $ 1/2 teaspoon ground cinnamon $ 1/2 teaspoon salt $ 1/2 cup sugar $ Summer Strawberry Jam $ ",Cookies $ Mixer $ Dessert $ Bake $ Kid-Friendly $ Cornmeal $ Summer $ Jam or Jelly $ Bon Appétit $ Kidney Friendly $ Vegetarian $ Pescatarian $ Peanut Free $ Tree Nut Free $ Soy Free $ Kosher $ ,American $ ,2/4,3,Cookies $ Mixer $ Dessert $ Bake $ Kid-Friendly $ Cornmeal $ Summer $ Jam or Jelly $ Bon Appétit $ Kidney Friendly $ Vegetarian $ Pescatarian $ Peanut Free $ Tree Nut Free $ Soy Free $ Kosher $ American $ 
https://www.epicurious.com/recipes/food/views/summer-fruit-and-meringue-trifle-234962,Summer Fruit and Meringue Trifle ,"4 large egg yolks $ 1/3 cup sugar $ 2 1/2 tablespoons cornstarch $ 1 1/3 cups whole milk $ 1 vanilla bean, split lengthwise $ 1 1/3 cups chilled whipping cream $ 1 5-ounce container mini vanilla meringue cookies $ 1 pound ripe yellow nectarines, halved, pitted, cut into 1/2-inch-thick slices $ 1 cup peach preserves, divided $ 1 pound ripe yellow peaches, halved, pitted, cut into 1/2-inch-thick slices $ 3 5.6-ounce containers boysenberries or blackberries, plus additional for garnish $ 1/2 cup boysenberry preserves $ ",Cake $ Milk/Cream $ Berry $ Egg $ Dessert $ Nectarine $ Peach $ Vanilla $ Summer $ Chill $ Bon Appétit $ Vegetarian $ Pescatarian $ Wheat/Gluten-Free $ Kosher $ ,American $ ,0/4,0,Cake $ Milk/Cream $ Berry $ Egg $ Dessert $ Nectarine $ Peach $ Vanilla $ Summer $ Chill $ Bon Appétit $ Vegetarian $ Pescatarian $ Wheat/Gluten-Free $ Kosher $ American $ 
https://www.epicurious.com/recipes/food/views/pan-cooked-bass-with-dill-and-cucumber-234985,Pan-Cooked Bass with Dill and Cucumber ,"3 tablespoons unsalted butter $ 4 (5- to 7-oz) black sea bass or striped bass fillets (1/2 to 3/4 inch thick) with skin $ 1/2 teaspoon salt $ 1/4 teaspoon black pepper $ 1 1/2 tablespoons finely chopped fresh dill $ 1/2 seedless cucumber (often plastic-wrapped), very thinly sliced $ parchment paper $ ",Sauté $ Quick & Easy $ Bass $ Cucumber $ Summer $ Healthy $ Dill $ Gourmet $ ,American $ ,4/4,13,Sauté $ Quick & Easy $ Bass $ Cucumber $ Summer $ Healthy $ Dill $ Gourmet $ American $ 
https://www.epicurious.com/recipes/food/views/chipotle-lime-grilled-chicken-234987,Chipotle-Lime Grilled Chicken ,1/4 cup fresh lime juice $ 1/4 cup olive oil $ 2 1/2 tablespoons chipotle Tabasco $ 3/4 teaspoon salt $ 6 large skinless boneless chicken thighs (2 1/2 lb total) $ 2 teaspoons mild honey $ ,Chicken $ Marinate $ Quick & Easy $ Lime $ Hot Pepper $ Summer $ Grill/Barbecue $ Gourmet $ ,American $ ,3.5/4,85,Chicken $ Marinate $ Quick & Easy $ Lime $ Hot Pepper $ Summer $ Grill/Barbecue $ Gourmet $ American $ 
https://www.epicurious.com/recipes/food/views/praline-ice-cream-sandwiches-235037,Praline Ice Cream Sandwiches ,"1 cup pecans (3 1/2 ounces), coarsely chopped $ 1 1/2 teaspoons salt $ 1 cup sugar $ 1 1/2 sticks (3/4 cup) unsalted butter at room temperature plus additional for greasing pan $ 1 1/2 cups all-purpose flour $ 1 teaspoon baking powder $ 1/4 teaspoon baking soda $ 1/2 teaspoon salt $ 1 1/4 cups packed dark brown sugar $ 2 large eggs $ 1 teaspoon vanilla $ 2 pt store-bought premium vanilla ice cream, softened $ 2 (15 1/2- by 10 1/2-inch) baking pans (3/4 inch deep; also called jelly roll pans); parchment paper; an offset metal spatula $ ",Sandwich $ Ice Cream Machine $ Nut $ Dessert $ Freeze/Chill $ Vegetarian $ Pecan $ Vanilla $ Summer $ Gourmet $ Kidney Friendly $ Pescatarian $ Peanut Free $ Soy Free $ Kosher $ ,American $ ,3.5/4,12,Sandwich $ Ice Cream Machine $ Nut $ Dessert $ Freeze/Chill $ Vegetarian $ Pecan $ Vanilla $ Summer $ Gourmet $ Kidney Friendly $ Pescatarian $ Peanut Free $ Soy Free $ Kosher $ American $ 
https://www.epicurious.com/recipes/food/views/coconut-coffee-marbled-ice-cream-cake-235036,Coconut Coffee Marbled Ice Cream Cake ,"3/4 cup chocolate wafer crumbs (from about 15 cookies such as Nabisco Famous Chocolate Wafers) $ 1 teaspoon instant-espresso powder $ 2 tablespoons unsalted butter, melted $ 1 pt premium coffee ice cream, softened slightly $ 1 pt premium coconut sorbet, softened slightly $ 3 tablespoons heavy cream $ 1 tablespoon light corn syrup $ 1 tablespoon packed dark brown sugar $ 1 teaspoon unsweetened Dutch-process cocoa powder $ 1/8 teaspoon salt $ 2 oz fine-quality bittersweet chocolate (not unsweetened), finely chopped $ 1 tablespoon unsalted butter $ 1 teaspoon vanilla $ a 1 1/2-qt rectangular mold such as a 12- by 3 1/4- by 2 3/4-inch pté mold; parchment paper; an offset metal spatula $ ",Coffee $ Chocolate $ Dairy $ Dessert $ Freeze/Chill $ Vegetarian $ Vanilla $ Summer $ Gourmet $ Kidney Friendly $ Pescatarian $ Peanut Free $ Tree Nut Free $ Soy Free $ Kosher $ ,American $ ,3.5/4,3,Coffee $ Chocolate $ Dairy $ Dessert $ Freeze/Chill $ Vegetarian $ Vanilla $ Summer $ Gourmet $ Kidney Friendly $ Pescatarian $ Peanut Free $ Tree Nut Free $ Soy Free $ Kosher $ American $ 
https://www.epicurious.com/recipes/food/views/zucchini-mash-235033,Zucchini Mash ,"1 medium green bell pepper, finely chopped (1 cup) $ 2 tablespoons extra-virgin olive oil $ 2 tablespoons unsalted butter $ 1 large garlic clove, finely chopped $ 6 medium zucchini (1 3/4 pounds), halved lengthwise, then thinly sliced crosswise $ 1/2 cup water $ 3/4 teaspoon salt $ 1/2 teaspoon black pepper $ 1/3 cup chopped scallion greens $ ",Garlic $ Vegetable $ Side $ Low Carb $ Low Fat $ Vegetarian $ Quick & Easy $ Low Cal $ Low Sodium $ Low/No Sugar $ Zucchini $ Summer $ Gourmet $ Pescatarian $ Wheat/Gluten-Free $ Peanut Free $ Tree Nut Free $ Soy Free $ No Sugar Added $ Kosher $ ,American $ ,3/4,38,Garlic $ Vegetable $ Side $ Low Carb $ Low Fat $ Vegetarian $ Quick & Easy $ Low Cal $ Low Sodium $ Low/No Sugar $ Zucchini $ Summer $ Gourmet $ Pescatarian $ Wheat/Gluten-Free $ Peanut Free $ Tree Nut Free $ Soy Free $ No Sugar Added $ Kosher $ American $ 
https://www.epicurious.com/recipes/food/views/grilled-corn-with-citrus-butter-235162,Grilled Corn with Citrus Butter ,"1 1/2 teaspoons (packed) finely grated orange peel $ 1 teaspoon (packed) finely grated lemon peel $ 1 teaspoon (packed) finely grated lime peel $ 1 teaspoon coarse kosher salt $ 1/2 cup (1 stick) unsalted butter, room temperature $ Nonstick vegetable oil spray $ 6 ears of corn, husked $ ",Citrus $ Side $ Fourth of July $ Vegetarian $ Quick & Easy $ High Fiber $ Father's Day $ Corn $ Summer $ Grill/Barbecue $ Bon Appétit $ Pescatarian $ Wheat/Gluten-Free $ Peanut Free $ Tree Nut Free $ Soy Free $ No Sugar Added $ Kosher $ ,American $ ,4/4,6,Citrus $ Side $ Fourth of July $ Vegetarian $ Quick & Easy $ High Fiber $ Father's Day $ Corn $ Summer $ Grill/Barbecue $ Bon Appétit $ Pescatarian $ Wheat/Gluten-Free $ Peanut Free $ Tree Nut Free $ Soy Free $ No Sugar Added $ Kosher $ American $ 
https://www.epicurious.com/recipes/food/views/grilled-porterhouse-steak-with-horseradish-cream-235023,Grilled Porterhouse Steak with Horseradish Cream ,"2 (1 1/4-inch-thick) porterhouse steaks (4 pounds total) $ 1 cup sour cream $ 1/4 cup undrained horseradish (from a new jar) $ 4 scallions, chopped $ 1 1/2 teaspoons salt $ 1 1/2 teaspoons black pepper $ an instant-read thermometer $ ",Milk/Cream $ Beef $ Dairy $ Quick & Easy $ Horseradish $ Steak $ Summer $ Grill/Barbecue $ Gourmet $ ,American $ ,3.5/4,10,Milk/Cream $ Beef $ Dairy $ Quick & Easy $ Horseradish $ Steak $ Summer $ Grill/Barbecue $ Gourmet $ American $ 
https://www.epicurious.com/recipes/food/views/hoisin-chicken-in-lettuce-leaves-234988,Hoisin Chicken in Lettuce Leaves ,"2 tablespoons vegetable oil $ 1 tablespoon finely chopped peeled fresh ginger $ 1/2 teaspoon salt $ 2 scallions, chopped (1/4 cup) $ 2 skinless boneless chicken breast halves (about 1 lb total), cut into 1/2-inch pieces $ 1 (8-oz) can sliced water chestnuts, rinsed and coarsely chopped $ 1/4 cup bottled hoisin sauce (preferably Lee Kum Kee, House of Tsang, or Koon Chun brand) $ 1 1/2 teaspoons Worcestershire sauce $ 1 teaspoon rice vinegar (not seasoned) $ 1/2 cup pine nuts (2 1/2 oz) $ 12 large red- or green-leaf lettuce leaves $ ",Wok $ Chicken $ Ginger $ Stir-Fry $ Quick & Easy $ Pine Nut $ Summer $ Chestnut $ Lettuce $ Gourmet $ ,American $ Chinese $ ,3/4,66,Wok $ Chicken $ Ginger $ Stir-Fry $ Quick & Easy $ Pine Nut $ Summer $ Chestnut $ Lettuce $ Gourmet $ American $ Chinese $ 
https://www.epicurious.com/recipes/food/views/sugar-snap-pea-and-cabbage-slaw-235032,Sugar Snap Pea and Cabbage Slaw ,"2 1/2 pounds green cabbage (preferably Savoy), quartered, cored, and thinly sliced (14 cups) $ 3/4 pound sugar snap peas, trimmed and thinly sliced diagonally (4 cups) $ 3/4 cup well-shaken buttermilk $ 1/2 cup sour cream $ 1/4 cup chopped fresh dill $ 2 garlic cloves, minced $ 1 3/4 teaspoons salt $ 1/2 teaspoon black pepper $ 1 tablespoon white distilled vinegar $ ",Dairy $ Garlic $ Herb $ Vegetable $ Side $ Low Carb $ Low Fat $ Vegetarian $ Summer $ Cabbage $ Sour Cream $ Dill $ Sugar Snap Pea $ Gourmet $ Pescatarian $ Wheat/Gluten-Free $ Peanut Free $ Tree Nut Free $ Soy Free $ No Sugar Added $ Kosher $ ,American $ ,0/4,0,Dairy $ Garlic $ Herb $ Vegetable $ Side $ Low Carb $ Low Fat $ Vegetarian $ Summer $ Cabbage $ Sour Cream $ Dill $ Sugar Snap Pea $ Gourmet $ Pescatarian $ Wheat/Gluten-Free $ Peanut Free $ Tree Nut Free $ Soy Free $ No Sugar Added $ Kosher $ American $ 
https://www.epicurious.com/recipes/food/views/double-crust-nectarine-raspberry-pies-235039,Double-Crust Nectarine Raspberry Pies ,"5 cups all-purpose flour $ 3 sticks (1 1/2 cups) cold unsalted butter, cut into 1/2-inch cubes but left in sticks $ 1/2 cup cold vegetable shortening (preferably trans-fat-free) $ 1 teaspoon salt $ About 3/4 cup ice water $ 1 tablespoon milk $ 2 tablespoons sugar $ 6 lb nectarines $ 3 cups raspberries (3/4 pound) $ 3 tablespoons fresh lemon juice $ 1/4 cup quick-cooking tapioca $ 1/4 cup cornstarch $ 1/4 teaspoon salt $ 1 1/2 cups sugar $ a pastry or bench scraper; an electric coffee/spice grinder; 2 (9-inch) glass or metal pie plates (5-cup capacity) $ ",Food Processor $ Dairy $ Fruit $ Dessert $ Bake $ Vegetarian $ Raspberry $ Nectarine $ Summer $ Gourmet $ Pescatarian $ Peanut Free $ Tree Nut Free $ Soy Free $ Kosher $ ,American $ ,3.5/4,2,Food Processor $ Dairy $ Fruit $ Dessert $ Bake $ Vegetarian $ Raspberry $ Nectarine $ Summer $ Gourmet $ Pescatarian $ Peanut Free $ Tree Nut Free $ Soy Free $ Kosher $ American $ 
https://www.epicurious.com/recipes/food/views/wheat-berry-and-smoked-chicken-salad-235019,Wheat-Berry and Smoked-Chicken Salad ,"1 cup hazelnuts (4 1/2 ounces) $ 2 cups wheat berries (3/4 pound) $ 4 medium red bell peppers $ 1 medium garlic clove $ 3 tablespoons Sherry vinegar $ 3/4 teaspoon salt $ 1/2 teaspoon black pepper $ 5 tablespoons olive oil $ 1 1/2 pounds smoked chicken breast, skin discarded and meat cut crosswise into 1/4-inch-thick slices $ 3 ounces baby arugula (8 cups loosely packed) $ ",Salad $ Chicken $ Garlic $ Leafy Green $ Nut $ Pepper $ Broil $ Quick & Easy $ Summer $ Hazelnut $ Gourmet $ ,American $ ,3/4,3,Salad $ Chicken $ Garlic $ Leafy Green $ Nut $ Pepper $ Broil $ Quick & Easy $ Summer $ Hazelnut $ Gourmet $ American $ 
https://www.epicurious.com/recipes/food/views/shrimp-salad-rolls-234979,Shrimp Salad Rolls ,"4 lb large shrimp in shell (21 to 25 per lb) $ 1 1/2 cups mayonnaise $ 3 tablespoons fresh lemon juice $ 3 tablespoons chopped fresh tarragon, or to taste $ 3/4 teaspoon salt $ 3/4 teaspoon black pepper $ 2 cups chopped celery $ 12 hot dog rolls (preferably top-split) $ ",Citrus $ Quick & Easy $ Mayonnaise $ Shrimp $ Celery $ Summer $ Tarragon $ Boil $ Gourmet $ ,American $ ,2.5/4,10,Citrus $ Quick & Easy $ Mayonnaise $ Shrimp $ Celery $ Summer $ Tarragon $ Boil $ Gourmet $ American $ 
https://www.epicurious.com/recipes/food/views/dry-curried-green-beans-235025,Dry-Curried Green Beans ,"1 lb green beans, trimmed $ 1 cup water $ 2 tablespoons unsalted butter $ 3/4 teaspoon curry powder $ 1/2 teaspoon salt $ 1/8 teaspoon black pepper $ 1/8 teaspoon cayenne $ ",Dairy $ Vegetable $ Side $ Quick & Easy $ Curry $ Green Bean $ Summer $ Simmer $ Gourmet $ Sugar Conscious $ Kidney Friendly $ Vegetarian $ Pescatarian $ Wheat/Gluten-Free $ Peanut Free $ Tree Nut Free $ Soy Free $ No Sugar Added $ Kosher $ ,American $ ,3.5/4,7,Dairy $ Vegetable $ Side $ Quick & Easy $ Curry $ Green Bean $ Summer $ Simmer $ Gourmet $ Sugar Conscious $ Kidney Friendly $ Vegetarian $ Pescatarian $ Wheat/Gluten-Free $ Peanut Free $ Tree Nut Free $ Soy Free $ No Sugar Added $ Kosher $ American $ 
https://www.epicurious.com/recipes/food/views/soy-glazed-beef-burger-234986,Soy-Glazed Beef Burger ,"2 teaspoons canola or other mild vegetable oil $ 1 small yellow onion, finely minced $ 2 tablespoons saké $ 1 1/4 pounds ground round $ 1/2 cup panko or 2 slices day-old white bread, lightly toasted and crumbled $ 2 tablespoons beaten egg $ 2 teaspoons dark miso, preferably Sendai miso $ 2 tablespoons sugar $ 1 tablespoon hot water $ 3 tablespoons soy sauce $ ",Beef $ Egg $ Onion $ Sauté $ Lunch $ Summer $ Soy Sauce $ Gourmet $ Dairy Free $ Peanut Free $ Tree Nut Free $ Kosher $ ,American $ Japanese $ ,3/4,11,Beef $ Egg $ Onion $ Sauté $ Lunch $ Summer $ Soy Sauce $ Gourmet $ Dairy Free $ Peanut Free $ Tree Nut Free $ Kosher $ American $ Japanese $ 
https://www.epicurious.com/recipes/food/views/double-chocolate-raspberry-cake-234859,Double Chocolate Raspberry Cake ,1 box chocolate cake mix $ 3 eggs $ 1/2 cup vegetable oil $ 1/3 cup water $ 6 ounces semisweet chocolate chips $ Chocolate Frosting $ 1/4 cup raspberry jam $ 2 fresh raspberries $ ,Cake $ Mixer $ Chocolate $ Egg $ Bake $ Kid-Friendly $ Wedding $ Raspberry $ Jam or Jelly $ ,American $ ,2.5/4,8,Cake $ Mixer $ Chocolate $ Egg $ Bake $ Kid-Friendly $ Wedding $ Raspberry $ Jam or Jelly $ American $ 
https://www.epicurious.com/recipes/food/views/vanilla-mousse-meringues-and-fresh-berries-234237,Vanilla Mousse Meringues and Fresh Berries ,"2 cups plain yogurt $ 1 cup sugar $ 2 cups heavy cream $ 1/2 teaspoon vanilla essence $ 3 egg whites $ Rind of 1 orange, finely julienned and blanched $ Meringues $ 1/2 cups mixed berried $ Strawberry Coulis $ Mint sprigs (for garnish) $ ",Berry $ Dairy $ Egg $ Dessert $ Bake $ Easter $ Yogurt $ Spring $ Summer $ Shower $ Party $ ,American $ ,3.5/4,8,Berry $ Dairy $ Egg $ Dessert $ Bake $ Easter $ Yogurt $ Spring $ Summer $ Shower $ Party $ American $ 
https://www.epicurious.com/recipes/food/views/chocolate-frosting-234860,Chocolate Frosting ,1/2 cup unsalted butter at room temperature $ 3 cups powdered sugar $ 3 tablespoons cocoa powder $ 4 tablespoons heavy cream $ 1 teaspoon vanilla $ ,Milk/Cream $ Mixer $ Chocolate $ Dessert $ No-Cook $ ,American $ ,3/4,19,Milk/Cream $ Mixer $ Chocolate $ Dessert $ No-Cook $ American $ 
https://www.epicurious.com/recipes/food/views/tipsy-turtle-bark-233205,Tipsy Turtle Bark ,"2 cups pecan halves $ 1 cup (about 24) caramel candies, such as Kraft, unwrapped $ 1 tablespoon rum, bourbon, or whisky (see tip, below) $ 1 1/2 teaspoons heavy cream $ 1/4 teaspoon salt $ 1 pound high-quality semisweet chocolate, finely chopped $ ",Bourbon $ Rum $ Microwave $ Chocolate $ Nut $ Dessert $ Bake $ Christmas $ Pecan $ Spirit $ Whiskey $ Edible Gift $ Kidney Friendly $ Vegetarian $ Pescatarian $ Wheat/Gluten-Free $ Peanut Free $ Soy Free $ Kosher $ ,American $ ,3.5/4,56,Bourbon $ Rum $ Microwave $ Chocolate $ Nut $ Dessert $ Bake $ Christmas $ Pecan $ Spirit $ Whiskey $ Edible Gift $ Kidney Friendly $ Vegetarian $ Pescatarian $ Wheat/Gluten-Free $ Peanut Free $ Soy Free $ Kosher $ American $ 
https://www.epicurious.com/recipes/food/views/southwest-pita-crisps-233204,Southwest Pita Crisps ,"1/2 cup vegetable oil $ 1 tablespoon chili powder $ 1 1/2 teaspoons ground cumin $ 1/4 to 1/2 teaspoon cayenne $ Twelve 10-inch pita breads $ 8 ounces extra-sharp yellow Cheddar, shredded (3 cups loosely packed) $ ",Bread $ Cheese $ Bake $ Christmas $ Spice $ Edible Gift $ ,American $ Southwestern $ ,2.5/4,3,Bread $ Cheese $ Bake $ Christmas $ Spice $ Edible Gift $ American $ Southwestern $ 
https://www.epicurious.com/recipes/food/views/easy-does-it-granola-233202,Easy-Does-It Granola ,"1 cup walnut halves $ 1 cup whole almonds, with skins $ 8 cups old-fashioned rolled oats $ 2 sticks (1/2 pound) unsalted butter, melted $ 1/3 cup honey, at room temperature $ 1/2 teaspoon salt $ 1 1/4 cup salted, roasted green pumpkin seeds (see tip, below) $ 1 cup dried currants $ 1 cup chopped dates $ 3/4 cup chopped dried strawberries or dried sour cherries $ ",Nut $ Breakfast $ Brunch $ Bake $ Christmas $ Quick & Easy $ Mother's Day $ Dried Fruit $ Almond $ Walnut $ Oat $ Edible Gift $ Honey $ Vegetarian $ Pescatarian $ Wheat/Gluten-Free $ Peanut Free $ Soy Free $ Kosher $ ,American $ ,3.5/4,10,Nut $ Breakfast $ Brunch $ Bake $ Christmas $ Quick & Easy $ Mother's Day $ Dried Fruit $ Almond $ Walnut $ Oat $ Edible Gift $ Honey $ Vegetarian $ Pescatarian $ Wheat/Gluten-Free $ Peanut Free $ Soy Free $ Kosher $ American $ 
https://www.epicurious.com/recipes/food/views/poached-egg-brioche-234242,Poached Egg Brioche ,"12 large eggs (or 24 small eggs) $ 12 brioche slices, lightly toasted $ 12 thin slices Canadian bacon or smoked ham $ 12 slices tomato (from 2 to 3 tomatoes) $ 12 thin slices red onion (from 1 medium onion) $ 3/4 cup grated Cheddar cheese (about 3 ounces) $ 3/4 cup grated Swiss cheese (about 3 ounces) $ Paprika for garnish (optional) $ ",Cheese $ Egg $ Pork $ Breakfast $ Brunch $ Bake $ Broil $ Poach $ Easter $ Quick & Easy $ Spring $ Peanut Free $ Tree Nut Free $ Soy Free $ ,American $ ,3.5/4,8,Cheese $ Egg $ Pork $ Breakfast $ Brunch $ Bake $ Broil $ Poach $ Easter $ Quick & Easy $ Spring $ Peanut Free $ Tree Nut Free $ Soy Free $ American $ 
https://www.epicurious.com/recipes/food/views/caviar-eggs-234243,Caviar Eggs ,"8 large white eggs $ 8 slices multigrain bread $ Ground white pepper to taste $ 1/4 cup heavy cream $ 2 tablespoons minced shallots $ 1 tablespoon chopped chives (optional) $ 4 ounces Beluga, Osetra, or Sevruga Caviar $ ",Egg $ Fish $ Appetizer $ Breakfast $ Brunch $ Cocktail Party $ Easter $ Quick & Easy $ Spring $ Sugar Conscious $ Kidney Friendly $ Pescatarian $ Peanut Free $ Tree Nut Free $ Soy Free $ ,American $ ,1/4,6,Egg $ Fish $ Appetizer $ Breakfast $ Brunch $ Cocktail Party $ Easter $ Quick & Easy $ Spring $ Sugar Conscious $ Kidney Friendly $ Pescatarian $ Peanut Free $ Tree Nut Free $ Soy Free $ American $ 
