link,name,ingredients,recipe_category,recipe_cuisine,rating,rating_count,keywords
https://www.epicurious.com/recipes/food/views/lemon-oregano-chicken-371,Lemon-Oregano Chicken ,1 large lemon $ 3 tablespoons chopped fresh parsley $ 1 1/2 teaspoons dried oregano $ 1/2 teaspoon ground pepper $ 2 large garlic cloves $ 1/2 teaspoon salt $ 2 chicken breast halves with skin and bones $ 1 tablespoon olive oil $ 1/2 cup plain yogurt $ ,Chicken $ Herb $ Poultry $ Broil $ Quick & Easy $ Yogurt $ Wheat/Gluten-Free $ Lemon $ Grill $ Grill/Barbecue $ Healthy $ Bon Appétit $ ,Greek $ Mediterranean $ ,3.5/4,34,Chicken $ Herb $ Poultry $ Broil $ Quick & Easy $ Yogurt $ Wheat/Gluten-Free $ Lemon $ Grill $ Grill/Barbecue $ Healthy $ Bon Appétit $ Greek $ Mediterranean $ 
https://www.epicurious.com/recipes/food/views/moroccan-fish-tagine-with-peppers-and-olives-339,Moroccan Fish Tagine with Peppers and Olives ,"1/2 cup vegetable oil $ 1/4 cup chopped fresh Italian parsley $ 3 large garlic cloves, chopped $ 3 tablespoons chopped fresh cilantro $ 1 tablespoon Hungarian sweet paprika $ 2 teaspoons ground turmeric $ 1/8 teaspoon crushed saffron threads $ 4 6-ounce white fish fillets (such as halibut or orange roughy) $ 1 pound carrots, peeled, thinly sliced $ 1 1/2 pounds tomatoes, thinly sliced $ 1 large onion, thinly sliced $ 1 lemon, thinly sliced $ 1 teaspoon salt $ 3/4 teaspoon ground pepper $ 1 medium-size red bell pepper, seeded, cut into 1/4-inch-wide strips $ 24 brine-cured olives (such as Kalamata) $ Additional Chopped fresh Italian parsley $ ",Fish $ Herb $ Olive $ Tomato $ Bake $ Marinate $ Spice $ Saffron $ Bell Pepper $ Spring $ Healthy $ Bon Appétit $ ,Mediterranean $ Moroccan $ ,3.5/4,36,Fish $ Herb $ Olive $ Tomato $ Bake $ Marinate $ Spice $ Saffron $ Bell Pepper $ Spring $ Healthy $ Bon Appétit $ Mediterranean $ Moroccan $ 
https://www.epicurious.com/recipes/food/views/turkish-poached-eggs-with-yogurt-and-spicy-sage-butter-352,Turkish Poached Eggs with Yogurt and Spicy Sage Butter ,"1 cup plain yogurt $ 2 large garlic cloves, pressed $ 1/4 cup (1/2 stick) unsalted butter $ 12 fresh sage leaves $ 1/2 teaspoon paprika $ 1/4 teaspoon dried crushed red pepper $ 1 tablespoon distilled white vinegar $ 8 eggs $ Warm pita bread $ ",Dairy $ Egg $ Herb $ Appetizer $ Brunch $ Poach $ Vegetarian $ Yogurt $ Ramadan $ Lunch $ Hot Pepper $ Spring $ Sage $ Bon Appétit $ Sugar Conscious $ Pescatarian $ Peanut Free $ Tree Nut Free $ Soy Free $ No Sugar Added $ Kosher $ ,Mediterranean $ Middle Eastern $ ,3.5/4,12,Dairy $ Egg $ Herb $ Appetizer $ Brunch $ Poach $ Vegetarian $ Yogurt $ Ramadan $ Lunch $ Hot Pepper $ Spring $ Sage $ Bon Appétit $ Sugar Conscious $ Pescatarian $ Peanut Free $ Tree Nut Free $ Soy Free $ No Sugar Added $ Kosher $ Mediterranean $ Middle Eastern $ 
https://www.epicurious.com/recipes/food/views/cabbage-with-prosciutto-375,Cabbage with Prosciutto ,"2 tablespoons olive oil $ 1 medium onion, chopped $ 2 pounds green cabbage, halved, cored, very thinly sliced $ 2 ounces thinly sliced prosciutto, cut into thin strips $ ",Vegetable $ Side $ Sauté $ Quick & Easy $ Spring $ Prosciutto $ Bon Appétit $ Paleo $ Dairy Free $ Wheat/Gluten-Free $ Peanut Free $ Tree Nut Free $ Soy Free $ No Sugar Added $ ,Italian $ Mediterranean $ ,3/4,13,Vegetable $ Side $ Sauté $ Quick & Easy $ Spring $ Prosciutto $ Bon Appétit $ Paleo $ Dairy Free $ Wheat/Gluten-Free $ Peanut Free $ Tree Nut Free $ Soy Free $ No Sugar Added $ Italian $ Mediterranean $ 
https://www.epicurious.com/recipes/food/views/baked-whitefish-with-tomatoes-and-garlic-336,Baked Whitefish with Tomatoes and Garlic ,"1 large bunch cilantro, chopped $ 3 large garlic cloves, chopped $ 3 tomatoes, sliced $ 4 5-to 6-ounce whitefish or sea bass fillets $ 1/4 cup olive oil $ 1 tablespoon paprika $ 1 teaspoon instant chicken bouillon granules $ 1/2 teaspoon ground cumin $ 1/2 teaspoon ground turmeric $ 1/2 teaspoon ground pepper $ 3 cups (about) water $ ",Fish $ Garlic $ Herb $ Tomato $ Bake $ Quick & Easy $ Bass $ Spice $ Bon Appétit $ ,Mediterranean $ ,3/4,24,Fish $ Garlic $ Herb $ Tomato $ Bake $ Quick & Easy $ Bass $ Spice $ Bon Appétit $ Mediterranean $ 
